text,label
"Utah:  Our Jesus can beat up your Jesus.  Can I get ""In Javier Morales We Trust""",1
A chuckle-worthy irony.,1
Heaven forbid that those kids might be allowed to actually think for themselves.,1
"Ask not what you can do for Supply Side Jesus, ask what Supply Side Jesus can do for you.   All by buying gold from my ministry's website!",1
"""President's words ~~have lost all~~ *never* had any meaning. "" FTFY",1
"don't hate the player, hate the game?",0
Kinda like what the Democrats did for years and years before Republicans gained a foothold.,0
"Yeah, yeah, yeah, but if I dare bitch about buhraaack between bites of my turkey drumstick I'm right back in the KKK again as far as the libtards are concerned.",1
Who are you talking to?,0
I'd like to see her abolish corporate personhood.,1
"I was so excited to get on there for my husband to see what he will qualify for, but there are just too many people trying to use it right now.",0
What happens when automation in that industry becomes cheaper?,0
"Wouldn't California be, um, *part* of America?  And therefore a component of its ""exceptionalism""?",1
"What's sad is that trucking used to be a viable, respectable blue-collar career that would feed your family and provide dignity.  Until deregulation, and Republican-led initiatives to fire-then-rehire as ""independent contractors"" made it a race-to-the-bottom, amphetamine-fueled class of serfdom.  Yet these truckers blamed unions &amp; demonized ""liberals"", while rewarding their tormentors, for destroying their vocation as a desirable, honorable profession.",1
"Careful!  Rand is the darling of the Libertarians, they will defend him and his father till their last breaths.",1
"Unless it's Bush's election, but that wasn't really an election since the Supreme Court basically awarded him the office.",0
All the more reason to cut billions from food stamps.  Darned freeloading starving seniors.,1
who gets the money and how do you determine when they don't get anymore money?,0
They are working on hormones to add to the chickens that shrink our penises and make us bad drivers so that they theses stereotypes will be irrelevant in the future.,1
"http://afrocityblog. files. wordpress. com/2009/04/black-man-tea-party. jpg maybe if you had socialism people would be able to put their apostrophe in the right place.  As someone from outside the US it is just absolutely alien that people are on the streets with placards complaining about ""socialism"" especially when you see the exact people who are the ones protesting.  I was in the US recently and I took a cab in St Louis, the cab driver was an older American who had bad health little or no healthcare as I understood it but he spent the entire journey complaining about socialism.  As a Swede/Brit/European my head just cannot get around the concept of someone whose life would be orders of magnitude better complaining about socialist beliefs.  The ruling classes have through a very cunning media campaign managed to dupe the working classes.",1
"Also because youtube comments are a notorious clusterfuck of dumbshittery, and G thinks that one way to go about improving them is by removing their anonymity.",0
Sounds like the complete opposite of Catholicism.,0
"It's already on the books in New York, but the Democratic &amp; Republican politicians think it'd be better to give the billions of dollars back every year rather than fully funding our needed social programs.",0
"Christians can't be Republicans either, but you don't see that affecting them.   Jesus was all about helping the poor, giving out free healthcare, and kicking the moneychangers out of the temple.   He was also pretty cool with taxes, very anti-war, and non-judgemental.    Doesn't seem to stop Christians any from supporting the political party that's completely Anti-Jesus.",1
What next Harvey Milk ended homophobia?,1
The government is not a charity.,0
Why only rely on a single mechanism of control when you could layer dozens over each other?,0
"Call my cynical, but I am guessing they didn't 'fall' for anything.",1
"They're just pissing and moaning that someone told them ""no"".",0
This asshole is going to be responsible for the deaths of millions of Americans.,0
Democrats don't know how to manage money?   Shocking!,1
"It's bad, approval among black Americans has fallen to a “staggering” 93. 6%.",1
Wait until these fuckwits hear about the first amendment.,1
"Well, with the help of liquid nitrogen - maybe.",1
The pope is meeting a cruel dictator.   Likely won't address his cruel dictatorship.   Boo.  At least he isn't blessing Rebecca Kadaga like the last pope.,1
"Yo dawg, help an Airman out",1
Hope is not a strategy.,0
What would you think about putting up a banner explaining the finer points of upholding freedom of speech and why vandalism or censorship is a detriment to freedom?,0
"The Catholic Church is amellennialist, and does not believe in the Rapture, for what it is worth.",0
I'm not calling him progressive until he at least openly discusses the Vatican's policy of covering up charges of child molestation.,0
Scalia couldn't be effective without help from the other 4 corporate justices.,0
"They tried using polls, they tried being clever...  only to discover they poisoned their own well.  Now it's time to take a drink.",1
And seeing the light on the current drug policies.,0
"So when they went to private ownership, they just magically developed over night a deep knowledge of crops, animals, environment, and farming techniques?",1
"Turtle guy, who said his primary goal was to deny Obama a second term is reasonable and willing to negotiate now.  Yeah.... and I'm a Chinese jet pilot.",1
"So... they purchased these books, which by extension funds further prints of these books, just so they could burn these books thus limiting the potential supply.  And this burning of these books does what exactly, save for leading to more printings of those bibles?",1
"From user tilio who deleted his comment after realizing how stupid it was,""as the other side of ""independent,"" i feel the exact opposite.  we're 17 trillion in debt with over 70 trillion in unfunded liabilities (medicare is once again, almost bankrupt).  instead of making efforts to work these down, democrats are piling on even more debt.  it's clear that many democrats / fiscal authoritarians have not looked at this from our point of view.  republicans, tea, and fiscal conservatives in general want spending cuts and deficit reduction.  as long as we stand firm, we win.  either democrats cave to our demands (giving us the spending cuts we want), or democrats drive us off the cliff, destroying the US credit rating, forcing spending cuts because they won't be able to borrow nearly as much money.  the only way we lose is to agree to let democrats / fiscal authoritarians to keep spending.  you may dislike this point of view.  but it is inescapable fact. "" Your joking right?   That debt is largely a legacy of the last president and his two wars, which we had to continue.   Conservative fiscal ideas are what drove us over the edge.   Furthermore, we know your position, but you lost, the majority of voters elected representatives that support the ACA, as evidenced by the wast of time that the republicans tried to remote on it and lost every time.   This is a democracy, just because the majority disagrees with you doesn't mean you get to shut down government and act like a bunch of spoiled children.",1
&gt;“Selling some of your unwanted possessions on eBay or Craigslist could bring in some quick cash. ” The content of the article doesn't match the title of the article.  It's like i'm reading /r/conservative,1
"the best comment is the out of place ""9/11was an inside job""",0
"It would have been nice for the photo to be captioned with an explanation of the infamous event being depicted: Ryan ""washes"" already clean dishes at a soup kitchen that he made reopen late for his photo-op.",1
"The ironic thing about Christie is that liberals like him because he is nice to Obama, and conservatives hate him for the same reason.",1
Conservative response: herp derp Detroit hurr durr,1
"So beware, when the cult ends, it's not usually by everyone realizing how silly they were and retreating to sanity.",0
And to think that people actually believe that the TV series 'Continuum' is based on fiction...,1
Did you sign up for Obamacare  A.  Yesterday?  B.   Today?,1
To be fair a lot of software is overpriced.,0
"I'm not sure what's worse, the policies that have kept the economy stifled for so long, or the unwavering support of those policies by those who are being hurt the most by them.",0
What in the howdy fuck is this.,0
"So translation: ""We can't have atheists *helping* people, that totally undermines my desire to believe they're all selfish and uncharitable! """,1
Does it comes in agp?,1
"""The Papal Octopus"" would be such a cool band name.",0
"Graduated high school in 1974, I still use the skills I learned in shop class on a daily basis, yet I have never been called on to ""diagram a sentence"".",0
The Bane of Boehner's Being is Big Boy Boners,0
No their primary motivation is to get money from the wealthy then do what  the wealthy want.,1
so 93 million lose coverage so that the 45million who dont have coverage... can maybe get it,1
"unfortunately, it's the right wing that's more likely to invoke christianity or relgion in general, so they kinda have a certain ownership of it.",0
This has been the modus operandi of the GOP since Obama was elected - it's time to clear out the dance floor.,0
Making 'class warfare' seem like a bad thing was one of the smartest things rich people ever did.,0
"I'm a college professor.  Incorrect attribution isn't what happened here.   He plagiarized.    I'd report him to the university, and he'd either get expelled or at least put on academic probation.",1
Christians in name only:  ChINOs,0
this is why anti lobbyist law needs to be enacted,0
Correlation does not imply causation.,0
It wants to keep the drug companies healthy.   Why cure when you can treat with medicine for the rest of ones life and get revenue all along the way.   That teamed with the bureaucracy and snails pace of advances sums it up.,1
"The health deductible tripled due to ability of health insurers to now charge 3x more for skin bronzers -- ziiiiinggggg, see what I did there",1
Yea that's it.  China.  Nothing to see here.,1
Republican = bad politicians and Democratic = good politicians?,1
This joke is so boring now.  I'm surprised when I don't see it posted about any piece of computer hardware news.,1
Well if they didn't want to die of hunger they should have worked harder when they were younger  /republican.,1
People with negative personal history will take advantage of the easy fix of saying they found religion.,0
"I love how they at the end, they pull out a stuck Hummer.",0
"They're all ""worthless"" unless you have the money to pay what the insurance doesn't - *after* paying for the insurance!  That is not a phenomenon that started with the health care act.",1
Yet another great rant about how Christians suck at being Christians.,0
I'm actually surprised NBC is running this story.,0
Seems like all is forgiven regarding the Republican brinkmanship caused government shutdown.,1
"Oh look, a right-wing blowhard is talking out his ass.  Must be a day that ends in ""y"".",1
"wouldn't some of the door knockers see this as ""a test"" and knock anyway?  i don't get many door knockers where i live, The 2 times its happened i just answered the door in my underwear and say a polite ""kindly fuck off"" and that worked.",1
i just needed food printers,0
My grandmother got $59 and they just sent her a letter knocking it down to $23.  I am very grateful that she has us that can provide and help her.  I can't imagine those who rely on it a great deal.  Thanks government.  Fuck up the only program that was doing well with a very small amount of fraud.,1
"The first Native American for president,  hmmm??",0
They are in the banking industry - it goes without saying.,0
It's ~~funny~~ depressing how bad you can make good things sound.,0
Nah instant 1950's tax rates.,0
They would probably drop through the floor if men weren't permitted to drive instead.,0
"I guess the mods have dictated that this is now an acceptable domain, but don't you dare try to post from any of the others!  We can't let people think for themselves, now can we?",1
"Well, his ""liberal eugenics"" argument just firmly placed him in the same category as the tea party as he makes up shit that sounds scary and appeals to the uninformed.",0
Hey guys.   Apparently this article meant what it seems and we should all vote it down.,1
"FYI, the 'tiny fraction' isn't the 1%.",0
"I could get behind that.  They make beer for members, sell it to help support their church, and part of the money they bring in goes to the community.  But god still doesn't exist.",1
"lol i read this a the ""Colbert Report"" and was like damn, legit Stephen.",0
you can't fixed stupid.,1
Christian American Patriots Militia - so Nazi brown shirts then.,1
"&gt;“What about Somali or Hispanic students, who might not eat sandwiches? ” Gutierrez asked.   They are called tortas in Mexico genius.",1
HAHAHAHAHAHAHAHAHAHA- wait...  are you serious?,1
"I would love to celebrate him for this, but then I'd need a google+ account.",1
I was happy to see McCain come out and rip him on that comparison.,0
Why should we try to cure diseases?  God designed them to kill you.  /s,1
"The website being broken isn't even the biggest problem.   The biggest problem is that *the law is fundamentally flawed*.   Even if the website was working properly, people would still be getting their hours cut at work and kicked off their existing plans.  This is only the beginning of the shit show.   We haven't even entered the second act yet.",1
That's what I'll call my rifle.,0
I posted this clip here months ago and was downvoted to oblivion.,0
[As opposed to the father of the Protestant Reformation... ](http://en. wikipedia. org/wiki/On_the_Jews_and_Their_Lies),1
"They are still trying to figure out how to backtrack on the Southern Strategy.  Give them a few decades, maybe they will come up for something good for climate change.",1
This is also the kind of shit that'll be on r/cringepics,0
"So, everyone should love pedophilia?",1
From the article: &gt; While there is a possibility that this administrator would have similarly overreacted had the employee worn a George W.  Bush mask...  Bwaaaaaah ha ha haaaaah ha ha hee ho ho ooooh.  Whew.  Good one.,1
"&gt;Congress shall make no law respecting an establishment of religion; or preventing the free exercise thereof...  You can practically *smell* those ""Biblical Principles"", amirite?",1
Yet more proof that there is a god.,1
"&gt;""Believers are more likely to say that God has significant power over weather and disasters. "" No shit, Sherlock.  It's like saying that people who eat meat are more likely to eat a hamburger than are vegetarians/vegans Edit: formatting",1
because Obama is thin skinned,0
"Then why  was Hitler rejected from art school?  :p There are particular facets of Card's books that I find really hard to reconcile with his real life bigotry.   In the later books, Ender is among the most rational and egalitarian characters I have ever read.   Card clearly understands diversity and tolerance better than most people, yet he flat out rejects them.  It's sad how much power Religion has to poison even great minds.",1
"Perfect example: me.  I pay about $6000 per year for health insurance.    Never had to use it until this year.   (Pain in kidney area, trace amount of blood in urine, dehydrated a lot, working outdoors in the south) Gee, I bet I have a kidney stone...  Google agrees $6000 insurance $1000 deductible $1000 in co-pays, 20% of bills for cancer tests, two rounds of x-rays, ultrasound, etc...  $8000 paid so far.   Guess what?   I have a kidney stone.  Good news, there's a procedure available that smashes the stone, but you have to be anesthetized, needs more tests before we can put you out, bloodwork, EKG...  Another couple hundred dollars.  And the procedure?   I will owe 20%, which is $3000.  I don't have another $3000, so I can't really afford to have it done.   Am I risking future kidney function?   Possibly, yes.  Total bill for kidney stone:  $5000 $6000 for insurance $11,000 Total, if I want treatment.   If not, suffer.   I can't currently afford it, so....  Awesome, huh?  EDIT: Oh BTW, my deductible re-sets at the first of the year, so if I don't get this done before xmas, it will cost $1000 more next year.  TL:DR Fuck you America.   Get your shit together.",1
"Wolf in sheep's clothing, BIG-time.",0
The EPA is in fact non essential.,1
Struggling to see the racism through the crazy.,0
Their ideology is homophobic and sexist.,0
