text,label
"What a steaming pile of horseshit.   I guess democrats have all the answers to all the world's problems and republicans have nothing good to say whatsoever.   We can just dismiss them all.    This kind of thinking is what's wrong with partisan politics, and as a matter of fact it's what's wrong with most religious thinking as well.   ""We have all the answers and we're not going to talk you because you're wrong. ""  It's so childish.",1
I saw you driving that car you filthy whore...,1
"this...  this is a joke.  it has to be a joke.  this website must be a subsidiary of The Onion, right?... Please?  God, I hate my countrymen sometimes...",1
What bothers me the most about this is that workers have the ability to make packages go missing without being caught.,0
I wouldn't be surprised if the Park service tried to claim 'eminent domain' next.,0
That's the quickest way to never get another interview.,0
"[Sure it will, i believe you](https://www. youtube. com/watch? v=Etbv2HM5qf0&amp;feature=youtube_gdata_player)",1
If they keep this up I might actually start watching Fox again.,0
sea-tac and seattle are not the same place just so you know and that will not effect seattle workers as the headline implies.,0
And *patriots! *,1
I won't believe the GOP is dead until I see that they have been landslided away in the elections.,0
It ruined Paul Ryan's childhood because he's still a very confused little Eddie Munster.,0
"Impose a $5,000 fee for normal citizens running their mouths, while allowing corporations to get away with things like destroying entire communities and ecosystems for free.  And we allow it.",1
Remember when the same people who are now banning WE THE PEOPLE from public property and land were telling us the 'occupiers' had every right to be there ?,0
The left's irrational hatred of Walmart is comical to me.,0
"Welcome to /r/libertarian, Glenn Beck.",1
The Xbone is going to get pummeled by this thing.,0
"&gt; When her group [the Oklahoma Coalition for Reproductive Justice] began lobbying against a Personhood bill by saying it would restrict in-vitro fertilization, or IVF, a legislator who planned to vote for it, said: “Sorry, what’s IVF? ” Why do American voters allow morons to govern America?   (And no, I'm trying **really really hard** not to just leap to the obvious conclusion. )",1
"In hell, along with the other false gods.",0
This is all part of a broader conspiracy amongst the Seeker-Driven Movement to make public urination a Religious Hate Crime.,1
"If Jesus destroyed satan for our freedom, why is there still evil, Tom, huh?  Huh?  Why Tom?",1
"What I want to know, what has he down that 37% of people approve of?",1
"I am anti-Catholicism and Protestant, but that does not mean that I am anti-Catholicism because I am Protestant.",0
*Hands off my medicore! *,1
"We've always been a target, and with 2014 around the corner, this sub will be a destination for all of reddit's troglodytic progressive asshats.",0
I had no idea we had this problem with Barack until I read the same reddit article that you did.,1
Good thing he was born in Canada.,1
Yep he had lots of flaws fortunately being a bad sci-fi writer wasn't one of them.,1
Sounds like the Democrats too.,0
Not sure if /r/conspiracy or /r/conservative,0
"Even though their support is at an all time low, their press coverage, and funding, will not be.",0
Nothing to see here folks.  Dancing with the Stars is on.   No need to worry about this.  Support the troops.  Murica!,1
"Transhumanism is a morally questionable set of ideas, at best, but this article is put forward by a few crazies from backwoods USA.",0
"Maybe, but my gut tells me these elections aren't being bought by the local versions of American Crossroads and Restore Our Future.",0
"And 50 years ago a kid would be terrified to let their parents read their diary.  The web isn't the problem, nor are the parents.  The fact of life is that kids do things their parents don't like, and no matter how those things are recorded kids would always prefer some privacy.",1
"Well, you know, when you're right about everything why bother listening?",1
They still knowingly broke a law.,0
I'm so happy he's been given enough rope to hang himself.,1
The post talked about questions to conservatives.  Why did you change the topic to refer to 'reasonable people?,1
Can't access the site anyway; it says the security certificate has been revoked.,0
Probably the lower pressure in the upper atmosphere causes it to expand more.,0
"Even if you don't believe in God or Psychics, you gotta follow your gut man.",1
Now if only he'd address his personal issues of pederasty.,1
"If the goal of economic policy since 1980 was to consolidate as much of the currency from the pockets of many into that of the few, job well fuckin done.",1
How much were they given in the bailout?,1
"In other words, our beliefs make more sense when you're drunk.",0
"I'm curious whether McAuliffe's victory changes reddit's stance on money in politics, considering he is a guy who has never been elected to public office and is riding a wave of out of state money?",0
"They know deep down that it's insubstantial, and that is why they feel insecure about letting kids think about it.",0
"Yeah, but guys, Politifact said this was half-true.  You just don't understand the nuance.  Serious you guys.",1
"This assumes Warren runs, but I'm not sure she will.",0
I hope it doesn't need food stamps..,1
The guy who invented basic coverage for everyone in Massachusetts should run for President.,1
"I actually heard Greta Van Whatever complaining on Fox (via Colbert) that nobody knew what to do and where to go to sign up.   Lady, that's your actual job.   That's what the news is actually supposed to be doing.   Informing people.   That's like a garbage man not picking up the trash for month and complaining that there's too much trash everywhere.",1
"The only thing I took away from this article is that if a writer as terrible as this can get a column on HuffPo, I'm obviously not trying hard enough.",1
This was what folks didn't understand about the last raise on incomes over $400k (and the Pubbies exploited to the hilt).,0
"Of course this is only an issue in Republican states.  When Michigan passed its voter ID law, not a single democrat came here ranting and raving some bullshit about racism.",1
"You have to be careful not to allow unqualified to vote.  Since Florida has so much trouble with voter fraud, they should not allow anyone to vote.  That would solve the problem.  Can not be too careful.",1
You can call me Diamond.,0
This is not a checklist.,1
Fuck the Bronze Age.,1
I assume it's because the secret service still uses some of the same tactics for securing a location.,0
"MyFace, the first offline social network",0
"No surprise, extreme hypocrisy is the hallmark of the political left.",0
"I probably wont see you until after new years, so thats Christmas and new years, plural, im trying to say happy holidays to cover both.  Sorry for starting a war on Christ",1
I heard you like websites.,0
"Seriously, how the hell does she continue to get elected?",0
How many of these people support the Commander should stay the deciding person to keep good order in the ranks?,0
Imagine if schools spent $70 million on education.,1
The GOP is a steadily shrinking party so they are desperately putting up walls to cling to power as long as possible.,0
Yep it is hard to get a good education and therefor a good job when you are home schooled by the home schooled.,1
And we are all a bunch of young white males who aren't being inclusive enough.,1
"Congratulations on your successful surgery, praise God!  Also, you have enough beard to shame an Orthodox priest.",1
"Yeah, she just confirmed it.",0
You are using stereotypes to fight racism.  Bravo,1
"OP, you should post this to /r/militaryatheists",0
The more important question here is should the government be allowed to issue secret rulings and legal precedents.,0
Don't forget the burden that eating fast food habitually puts on taxpayers.,1
"Hey man, I'm sure you just missed the memo, but ""capitalism"" is now defined as the government telling us we have to buy something and then narrowing the definition further, by telling us we don't know what we want and they need to show us.",1
This favors aetheists so its religious discrimination either way,0
Darwinism would greatly conflict with Hitler's master race.  It would mean that the master race has evolved from some lower beings.,1
"Maybe because there are more religious people in the world than there are atheists?  And that lower class countries still have a substantial number of ""religious""(not really religious, just following the flow) people in them?  Also, since the study also includes people in prison, where a lot of people convert because of desperation, its not really reliable in that sense.  Oh, shit sorry, I mean, RELIGION IS BAD AND STUFF RABBLE RABBLE RABLLE!",1
"yes, blow up the financial sector, what could possibly go wrong??",1
If you give a mouse a cookie...,0
It seems horribly unfair - and it is - but if we didn't keep paying them - or if we paid them minimum wage as others have suggested - then the wealthiest politicians would hold out forever until they got what they wanted and people who weren't already rich would be disincentivized to run for office at all.  The 1% would be even more grossly over represented than they already are and have even more of an advantage than they already do.,1
"Why do I get the impression the tea party is nothing but a bunch of old racist white men who would rather bring the country down with them, than let president do his job?",1
"If she has aides that update it for her, they could be on furlough.",0
Do you know what type of salt was used for heat storage?,0
Neuroscience and The Matrix would make a cool class too!  Neuroscience and Super Mario Bros could even fit somewhere.  It's not because a subject can be discussed when talking of science that this subject is valid in context.,1
Can't dispute any of it.,0
"Evolution is from the devil, haven't you heard?  The idea is to scare kids from even learning about it.",1
why do a lot of his sentances end with '*mas*'?,0
Hey look!  Someone who thinks The Administration is actually in charge.  How 90s.,1
Welcome to the wonderful world of Regulatory Capture - it will only get worse as the years pass.,0
"In truth this has nothing to do with lobbying or cynical politics.  The uniforms created 8 years ago were horribly designed.  They universally stood out in every environment.  Supposedly the army did their extensive testing on colors and patterns to arrive at good uniform.  But then some top brass ordered them to use the marine digicam pattern (because it's cool and good for recruitment presumably) but to keep the new army colors.  Colors need to be designed specific to a pattern, hence the most ineffective cam since the British invaded (ok, slight overstatement).  This time I hope they do it right.  This is a great story about wasteful spending, but not so much about corruption.",1
"Why Taibbi is not on every news source all the time, I will never know.  The man is a genius.",1
I would be more in favor of a flat 20% tax on all income above $25k usd no deductions or exemptions or credits.,0
You mean like when his union buddies go on strike?,1
"On the plus side though, maybe this will drastically reduce the number of people who comment on YouTube.",0
She made my penis fill with blood!   KILL HER!   THROW STONES AT HER UNTIL SHE IS DEAD ALLAH AHKBAR,1
bet the GOP wont try to repeal the patriot act 42 times.,1
I like this video but not as much as the one where he promises to end wire tapping.  Although the one about closing gitmo asap was good too.  It ties for my other favorite which is where he claimed Libya was caused by a video.  But you cant forget about his bailouts those videos are always worth a watch after all he kept Detroit running.  You can not mention favorite videos tho without talking about his absolute disgust of raising the debt limit while a part time congress person.,1
"Boehner, the perfect example that you (anyone) will not get the government you need, but the one you deserve.",0
"Can't wait for people to bitch about ""LOL /r/circlejerk"".",0
"Because the House cannot vote on a bill unless the Speaker allows it, and Boehner and his compatriots have been planning this shutdown all year long.   Why would they allow such a vote to take place until the country can be sufficiently damaged and he can start pointing fingers everywhere else?",1
The only people offended by the Redskins are white liberals and Obama.,0
"Then they are printers, not journalists.",0
"So basically they use a two minute edited version, which is only his introduction.",0
Nice budget PC there.,1
"The NSA can spy on the *future*!?   Okay, this *is* getting scary.",1
This needs to go viral.,0
"I prefer it!  I'm a Texan and a while back I had a HORRIBLE kidney stone but I didn't know what it was because I had never had one before, I went to the ER in EXCRUCIATING pain and they treated me wonderfully!  I got three, count 'em baby three, shots of morphine through an IV, that is an experience I have never had before but enjoyed and would recommend!  Then I left with a handful of prescriptions after a CT scan (is that right?  Some kind of scan! ) and went home and was high as a kite for a few days and then it passed and we were all good again.  Woo!  So then the bill comes and it's $8000!  So at first I was all like ""woah, shit"" so I called and complained because while in the ER I had specifically ask, repeatedly, how much the scan would cost and had repeatedly had my question refused to be answered by the doctors, nurses, radiologists (or whatever they're called) and even the lady who came in to get my personal info and ask me for a credit card to pay ""as much as I could afford right now"" (I authorized 50$ because she wouldn't explain to me what exactly it was I was paying for ""right now"" and I finally decided they just wanted a card on file).  Sooo when the bill comes the scan ALONE was 6000 bucks, just the scan, the entire rest of my treatment was only 2000 which I would probably have paid gladly after the wonderful care I got (and I knew I was uninsured going into this and I knew ERs are expensive and at the time I was in HORRIBLE pain and scared shitless by it so I didn't care).  I made my choices and would live with them but 6 grand for JUST THE SCAN?  That seemed unreasonable to me and I also found out later that scans like that aren't necessary for kidney stones and often aren't done unless you're peeing blood, so wtf?  So this is where the fun starts, I called to complain about this scan cost, I was quite clear that I would pay a reasonable about for my care and was happy with my care but I couldn't afford 8000 total and that 6k for the scan was nuts, so they ask me to fill out some paperwork to see if I qualified for ""financial relief"" from my bill.  I explained again that I didn't want charity, I just wanted a reasonable bill (and BTW, 2000 for the three shots of morhpine and the 10 minutes the doctor spent with me seems a little out of whack too, 800 of that is called an ""ER fee"" and is apparently a charge you get just for walking into the ER regardless of what happens next, but hey they took good care of me and I don't know what the fuck morphine costs).  Anyway the only option I had was to file for the charitable relief, well ya see I am currently a ""stay at home uncle"" my brother abandoned his two kids with our mom, she can't afford day care (you would not fucking believe how expensive day care is) and since I made less money than she does, I become the stay at home parent.  We all live together now, she pays the bills and I take care of the kids.  It was weird at first but it's actually kinda rewarding and fun now (most of the time).  So technically I'm single with no income and have been for about a year and a half now and my tax returns reflect that.  Actually do have some income for contract IT work with people who knew me before I quit, it's all under the table though.  Soooo I got FULL relief.  I actually have some money and my mother actually makes ""ok"" money and we were willing to pay a reasonable amount for the bill (my hope was to reduce it by half to 4k and pay it out over time, lower is better of course but I had braced myself to accept 4 grand if I could negotiate hard enough to get there).  Instead I paid 0$.  And I learned a valuable lesson, if it looks like you have no money you can go to the ER for freeeeee!  Wee!  So suck it tax payers I ripped you off for 8000 bucks and I have three pain pills left over for a rainy day!  Now stupid Obamacare is going to make me pay for my own insurance :( boooo That's going to be like 70$ a month.  EVERY month!  You even have to pay in December!  Come on government, it's baby Jesus birthday, fucking dicks.",1
reddit told me that they are the same!,1
"She's a uniter.   Most people, regardless of political affiliation, can agree she's horrible.",1
Well it's the only way to stop that awful health care bill that they couldn't stop at the ballot box or in court.,1
Sourceforge has been going downhill for a good while now - it's time that everybody still on there migrated to GitHub or similar.,0
imagine if there was a virus that would wait until the computer is idle and 3d print a very detailed penis for you to find when you get back to your computer?,0
"Forgot to mention in the title, this is an x-post from /r/BasicIncome",0
reads like an invitation to make top brass complain.,0
"Cheney will live forever, because only the good die young.",1
This is now officially my favorite novelty account.  [slow clap],1
"My friend and I are going to attend a rodeo with one of us wearing an Obama mask and one of us wearing a t-shirt pointing saying ""I'm with stupid"".",0
"And a fundy christian half-term governor, with delusions of grandeur, is one of the best sources for comedy in America.",1
"I also don't think it is a ""secret"" per say.....",0
"I have a feeling the ACA will be that little taste of actual health care that makes the American Public say fuck it, I want Universal Healthcare.",0
ugh I hate how they act like they care about veterans day,0
"Well, the people would on average be more attractive in that world",0
I mean if Obama can win one...,1
"""the environment"" ...  another strawman",1
Increase the sample size to the last twenty five terms.,0
"It surprises me that Republican congressmen use visual aids like this.  It just seems to be contradicting their talking points essentially telling Obama to butt out and concentrate on foreign affairs, leaving domestic issues to Congress.  But then they spend hours on the floor complaining about him negotiating with foreign leaders instead of acting as a liaison between Democrats and Republicans in Congress.  I just wish Republicans would pick one or the other and run with it.  *Edit for grammar",1
Feels good to have a spine.   They come in handy when needed.,1
"Well if we did it to them, we woul be in trouble...  SO LET'S STIR UP SHIT!",1
A copy of your wallet after your bitcoins have been stolen is like a photograph of your coins after someone took your money.,0
Here's the logic.  I claim to not believe in Unicorns because I'm ANGRY at Unicorns.  Make sense?,1
This raised my blood pressure a considerable degree,0
"Temp agencies in my area are damn near the only way to get any sort of work at all, and even then, you are lucky if the work lasts for a month or two.",0
I for one am in utter shock that these fine institutions would stoop to such a low level to deceive consumers and benefit themselves financially.   /s,1
Any idea what became of the horrified liberal?,0
Don't let John Stewart know,0
What's the reason for such an eccentric orbit?,0
"Always ironic to see a guy like Reich, who's already made more money than he'll ever need, lecture the ""New Rich"" on how they are too greedy.",1
If I had a ton of money I'd turn this into a commercial and have it run in prime time over and over and over,0
"Does anybody remember during one of the debates how Obama said he was proud to call it ""Obamacare""?",0
So the ends justify the means?,0
I said it when he was elected the first time: Barack Obama will be remembered (eventually) as the worst President in American history.,0
"Stay in school, kids.",1
"Unmarried sex is only bad if the female has an orgasm, because women are sinful vile things who don't deserve enjoyment.",1
"How does Clarence Thomas approach ""judging? "" He weighs cases based on the amount of money he's paid.",1
What the hell happened here?,0
"&gt;$7,000 fine It's insane that one of the largest businesses in the world would refuse to pay this, but it's Walmart.  Is anyone surprised?",1
Why did it take two weeks for this to come out at all?,0
You know actually think Audi Murphy was cool though.,0
So apparently Catholics aren't Christians according to this pamphlet.,0
"Keep attacking the one world leader who stands up to fags, guys.  Whoever said conservatives are their own worst enemies?",1
"Bachmann is nothing if not persistent, her pigheaded refusal to accept facts and give up her delusions border on a personality disorder.",1
Hey we have something in common!,0
"Can't stand Obama.   Agree with him here 100%.   I'm guessing one of the aides had to pull him aside after this.  ""Umm... mister president.... yeah.... ummmm.... """,1
This is what you get when Republicans control your state legislature.,0
You know your government is shit when it looks more like a reality tv show than an actual functioning government,0
"Don't you love that they also gave themselves millions in farm subsidies for their own agri-corp farms.  Not their districts, themselves.  My TP congressman voted yes to it while voting to cut food stamps.  He doesn't get the subsidies but he was part of the shutdown so I give him a hard time about it.",1
"Work, ain't nobody got time for dat!",1
"Yup!  Don't know why more Christians don't follow this.   Oh, wait,  its not hateful and it doesnt further their agenda.",1
"His favorite color is Coca Cola, he clearly knows whats up.",0
"Watching McCain these days is like watching a political take on ""The Notebook"", but without the sadness... instead of bouncing between happiness/sadness, it's glee/fury.",1
"But hey, we're not here to generalize.",1
So they waste billions a year that cannot be accounted for **and** penny pinch by pirating software?,0
Sadly his congressional district will keep putting him in office until they nail the box shut.,0
"Standard stuff here, nothing new.   Same old flawed foundations supporting poor arguments.   He ""owns"" himself, so he is somehow self-sovereign and all humans ought to respect that asking nothing in return.   So he has a right to what he gets and no obligation to give in return.   Standard libertarian nonsense.",1
"If only the polls had been unskewed in time, the 'real Americans' would've seen the plain, unvarnished truth and removed the Muslim Atheist Socialist Fascist Kenyan usurper from office.  Twice.",1
"We should lift the cap, at the very LEAST it should be set at what we pay politicians 174,000k.",0
Would you be having this problem if it were a conservative pres?,0
Didn't know I was so powerful.   Cool.,1
The TPP is a knockout blow to US manufacturing; in its beaten state idk if US manufacturing can make a comeback.,0
How do we get the constitution changed so they have a reason to care?,1
Ronald Reagon is the man!,0
He's no Mark Warner but he's also no Cuccinelli.,1
"When you know your religion is wrong and that you spent your life getting on your knees for no reason, you too would resist.",0
This is hardly Fox News...  (I'm here all week. ),1
"As a progressive service member that is constantly reminded of the oppressive attitude towards homosexuals in the military, this makes me feel sufficiently relieved.",0
The tea party will have a much harder time with funding in the next cycle.,0
"Yes, expand the pyramid scheme...",1
"&gt; “We need to move on and take whatever we can find in the debt limit. ”  Holy shit, do these guys not learn?  ""Hey I pissed on the electric fence over here and it just about blew my dick off, but hey, I bet if I piss on it over *there* something else will happen"".  Fucking idiots.",1
Someone being the foremost expert in a subject is pretty impressive.   That single person having more knowledge and experience of a single subject that any other human alive.   She is the foremost expert of FOUR separate subjects.   Wow.  no.,1
But-but the rapture!,1
So the question during their Twitter Q&amp;A about washing the sleaze off with a regular shower or with baby tears has been answered... it's baby tears while removing candy from said baby.,1
Something like a CVD type 3D printer?,0
Because you can't work the part timers crazy hours now the law will make them full time and require health care.,0
Because that gives the minority party an even bigger incentive to force budget bills to fail?,0
I hope he's more set to go nuclear then the last time he said he was set to go nuclear.,0
"This from the people who scream that Obama has taken their ""freedoms"" away",0
