text,label
"It's sad that low-information liberals don't get the idea that stand your ground is the means for poor people to protect themselves from others attempting to bully them.   Stand your ground means you don't have to turn your back on a threat, which is often the worst thing you can do.  Having to be forced in the time of danger to try to determine if your back is truly against the wall (figuratively) in the face of a threat.   If the situation between the black young man and a Hispanic guy were switched, and the hispanic was driving the black guy's head into the asphalt for no reason other than his own rage, the vast majority of America would support the black man using lethal force to save his own life.  If you aren't in favor of stand your ground, you're either ignorant or you've got a gun control agenda.",1
"For the republicans, probably a crazy fuck that has zero chance of being elected in a nation race, but will pull in tons of cash when he runs.",0
"To be fair, *in general*, voting isn't (or shouldn't be) just about choosing what is best for yourself.",0
When did House Republicans declare Jihad exactly?  I must have missed that.,1
Hawaii is Kenya now.,1
The perimeters around this relaunching were kept incredibly vague so the administration would be able to call any outcome a success.,0
THERE ARE MURDERERS WHO GOT OFF EASIER THAN THAT.,0
"What a fraud.  Fire damaged goods with a personal story that is irrelevant.  You know: under most trading laws you need to be able to prove claims you make.  If you can't prove that this is ""divinely destroyed"" then you are violating those laws.  Good luck with that.",1
The people at Ifixit must be getting a bit miffed that someone has already done their job for them.,0
CBS.  Enough said.,1
A true left wing group only a mother could love,0
Kinda ironic considering Obama's support of unions.,0
Reddit cherrypicks the Pope's messages.,0
Well it's WAY easier to buy a gun then healthcare...,0
"I must have played 5000 hours of crazy taxi, then.......",0
"Oh my god what a headache listening to her!   You know what though?  We're going to hear this same stuff from Republicans for the next few weeks.  It's a ""serious investigation"" they are undertaking...  Presented by Miss South Carolina.",1
They're going to switch from saying that it's not happening to saying that it's too late to change it.,0
"Tell that to the executive branch, who have violated established law by continually making alterations and exempting people from it.",0
"And right after this [someone in the audience fainted](http://www. youtube. com/watch? v=7J80mVXvs64).  Obama was able to pick them out in a crowd of people, diagnose the issue as not serious from the stage, and then get them some water.   How could anyone not love such a compassionate and caring leader?",1
"He's obviously making this up.  He may not realize that, though.",1
"She's a reformist, not a revolutionary",0
"I'm always amazed at how willing liberals are to admit that they agree with ""the ends justifies the means"".",0
"Him, and all the other Tea Party members are a subsidiary of the Koch brothers",0
"In other news, apples 40 times more popular than oranges.",1
"False equivalence: ""I'm right, you're wrong.  Now that we've established that as the basis of discussion, we can progress as equals. """,1
"When you've seen how angry and violent the religious groups are, it makes sense to want no association with them.",0
"As a fellow Pennsylvanian I really do feel like the saying ""Philadelphia and Pittsburgh with Alabama in between"" has some truth.",0
They probably gave him talking points to heckle Obama with to make him a victim and make it look like he's more moderate than he really is.,0
War is peace.,1
"Another thing.. just to add.. when a white person says something conservative or profound it's tossed to the side and called racist, but if you put a black person's picture above it, or say Morgan Freeman said it or whatever, it blows up my news feed as the greatest thing ever said.",1
"Must be a ""racist"" too.  /sarc",1
"American Jews have pretty much never supported Israel in lockstep.  Rather, their support base in the states comes from the born again Christians and Evangelicals.",1
"Which means a lot of ""superior"" officers are complicit.",0
"Thank you for this, good sir.",0
The really important question is why the fuck do we keep talking about Limbaugh?,0
He has a bad Koch habit.,0
"All I can say is ""ha ha"" they should have read it first.",0
"If daily beatings turned out to be the best incentive for artistic production, Valkvinge would be all for it.",0
Im pretty sure that no one takes that guy seriously,0
That's a fancy way of saying he lied.,0
where was obama at in 2007?,0
"it's a college bake sale, let's be fair now.  asians would pay 2. 50",1
"I love the concept, but my wife's a teacher and the kids just can't go longer in the day, and 4 of the current days isn't enough time to cover all of the items needed that she needs to relay to them.",0
It's mind-boggling that it's that high.,1
"&gt;get off Ohio's dick and let them do what they want to do And while we're at it, let's let the south have slavery again.  Frankly, there should be a constitutional amendment protecting a person's right to do what they want with their own body, particularly prior to the point where they are carrying another *viable* life.  No state should be able to write laws that make it more difficult to get an abortion under the guise of ""protecting women"" when it is a fact that abortions performed in the developed world are among the safest procedures in medicine.",1
"It blows my mind that anyone could be pulling down six figures in a ministry position.  I wonder what the rabbi who forbade his apostles to carry money, food, or an extra change of clothing would think.",1
Yet he still won't give it up...,0
It's too bad their lifespan is measured in days.,1
Imagine if it was a man his age going after 17 year old girls with substance abuse problems.,1
"Well, we could have electronic voting machines that have fully open source code, and use cryptography to verify results, but of course, there's no money in that.",0
Having carte blanche of article II powers would be a huge waste...,0
I have had one for almost a year and I don't think that I have even ever plugged it in...,1
Yep this sure is a Republican Shutdown   /sarcasm off,1
They got what they wanted from the troops.,0
"The appropriate response is for wikipedia to block write access from those schools and if the abuse occurs, to block read access from those same schools.",0
No he just has a brain.,0
A smart guy like Bill Nye should know the moon is made of glowy stuff.,1
"I wonder what happens if you take a group of armed men in a foreign country and then tell them that a) you're not getting paid and b) no, you can't leave.",0
If you're not Catholic it's unlikely you care what the Pope says.,0
I think this sample size is shit.,0
Well I've heard that Mexicans and Blacks smoke it and then want to rape white women.    It'll also be detrimental to the cotton industry...,1
"Lol good one, let's just round up every last corrupt politician, regulator and law enforcement officer, and throw them in a prison that's totally not built on corruption, and run by corrupt wardens.",1
Obama calls it Obamacare.,1
"Would anyone be opposed to moving Veterans Day back a week, so we get the PS4 release on a three day weekend?",0
All you need to do these days is get your income defined as a return on an investment.,0
Is the same sponge bob that they were hating on for climate change a few years ago?,0
I hope the Democratic Party is sending this guy wine and roses.,0
"I dont know if I am happy for being on the side that was right, or sad because the rest of America is oblivious to the truth?",0
"I read that in Joey Mousepad's voice, except saying ""intragnisent"".",0
"Obama, the Presidential train wreck.",0
"Jesus Christ, she still exists?",1
"No she will not look back.  It is almost impossible for people like her to examine there lives and see the errors and mistakes they have made.  She is a true believer and thinks of herself as  god's vessel.  If she is wrong, then her god is wrong.  Michele will go to her grave thinking she did her god's will.  The overwhelming evidence that the world rejects her ideas only servers as proof, to her, of  righteousness.  She is a sad delusional old woman who should have never been given power over anything more sentient than a goldfish.",1
"Please give him something to keep him in the US, we dont need him back in the UK.",1
She must have taken the Parsing Graduate Course from Bill Clinton.,1
Why would you name your kid Messiah in the first place?,0
That was today's talking point.,1
It's always good to see a lying president council another lying president on how to/not to lie.,1
"I'll take this as an improvement of sorts.  Silly as this stuff is, it's far less damaging than organized religion.   It's embarrassing now, but as a teenager I was interested in ""magik"".  I read thousands of pages of Aleister Crowley and even that fake ""Necronomicon"" that used to circulate.  So esoteric.  So cool.   The kids will wise up eventually.  Even if they don't, I'll take goddess worshipers, Tarot readers and other occultists over monotheists any day.  ""Harm ye none, do what ye will"" is far more congenial than the bloody-mindedness of the Bible or Qur'an.",1
That's because Republicans don't want poor people to vote.   Those cheeky bastards.,1
When I see Larry Flynt I'm always disappointed he isn't Woody Harrelson.,0
Children are more sensible.,1
Is that not the correct thing to do?   I agree it was poor judgement to take the donation in the first place.   But let's not go all Benghazi about this.,1
Companies you use to have the freedom to boycott.,0
"It's a novel way to ""balance your budget"".   Appropriate for spending and then just not pay the bill.",1
Why would they?,1
Did he talk at all about how he places personal religious beliefs over the civil rights of others?,1
"They're voting for the constituents that matter, the ones that give them money.  Dollars &gt; Votes.",1
Ha!  Gaaaayyyy,1
"For a sub disappointed with Obama, r/politics seems really eager to vote for administration employees.",1
"When do we start using the word ""Treason"" when it comes to these people?",0
Reid' and 'reasons' share part of a syllable; can't be coincidence.,1
Can't wait for Season Two.,0
Religions ain't over 'til the magic brownies say so.,1
It's amazing how Democrats view money.  It has to come from somewhere you idiots and you signed up to foot the bill.  Congratulations.,1
"Liberals: ""We ran a black guy so we can't be racist! "" Tea Party: ""We ran a guy with a 9-9-9 tax plan that will help the economy!  He also has great business experience! "" Media: The Tea Party functions solely around racist issues.",1
I'd rather see her in a leadership position in Congress with a strong whip rallying the Democrats behind her.,0
"It's a shame that the author perpetuates the myth of Mother Teresa, but otherwise a good article.",0
"The further upside is that if the minimum retirement age for benefits was raised 2 years, the fund would be solvent well into the 2050's.",0
"So this guy is dick, right?",1
"It's important here to remember the words of Jesus when he said ""Let the little children come to me, and do not hinder them, for the kingdom of heaven belongs to such as these, until they make too much noise and then you can stare at their parents until they feel so awkward and ashamed and feel like they need to apologise for their children, and then they take their kids to a separate room. """,1
"Gridlock is great when you are an oligarch operating under a corrupt tax scheme with all aspects of government locked in your favor and against the interests of 99. 99% of the population.  The stupidity of these remaining poor tea party folks is stunning, holding a gun to their own heads to rob the nation blind for the likes of the Koch brothers.",1
The Republicans can go fuck themselves.,0
"Because I've seen this article 10 million times over the past 2 days, I'm just assuming she did it for attention, not because she's genuinely a nutjob.",0
"Wow, thanks for all the context, OP.",1
Your tax dollars at work.,1
I don't think you guys are on-board with how important it is to get every bit of carbon out of the ground and into the atmosphere.,1
"Because obviously anyone that doesn't agree with you is a bad person, am I right?",1
Now to see whether he will deliver on his promise or not.,0
6% of American's clicked the wrong button.,1
"Surely they'll offer an ""In TFSM We Trust"" version, right?  Or maybe ""Joseph Smith Lied""?",1
Funny how religion needs to have a non-suicide clause in the first case.   I guess the mom should have gone ahead and murdered the girl and then asked god for forgiveness.   That's legit by their twisted rules.,1
"You mean they've learned nothing by another public, massive defeat?   Shocking.",1
I think what it means is it can buy attack ads and win the minds of large numbers of voters who do little to no research bar what they see on tv.,0
Pre-Giuliani years here we come,0
His naiveté makes me cringe on the inside.,0
College Freshman tells his teacher he will be 'more cautious' with his homework...,1
I'm sure it will pass..,1
"Whether or not you agree that what they're doing is necessary or good, you've got to admire their willingness to stick to what they think is important.",0
He's on a one man crusade to marry them all...,1
"To be fair, that's probably true for a society where women are currently cloistered: giving them the freedom to leave the house on their own will probably increase rates of shopping and drinking lattes at Starbucks, too.",1
Getting damage control advice from Rush?,0
What they said last time.,0
You should do a post on your past experiences on navigating without health insurance and then your experiences on the ACA process you've so far encountered.,0
"Poor people need food, not Paul Ryan.",0
I'm curious about this as well.,0
"Somebody thinks the ""affordable"" premiums will be going up again.",0
Takers come in all forms.    Vets.   Welfare queens.   Widows.   People who own COLOR TV's.    Orphans.  /s,1
"Even though I agree with the article's general purpose, I can't take anyone seriously who compares the tea party to jihadists or the Taliban.  Yeah, they are assholes, but hyperbole doesn't get you anywhere.  The same goes for anyone who spits the words liberal and socialist out like it's poison.   I went to college and studied political science because I was an idealist who wanted to work for the country, to help craft policy which would improve people's lives.  After getting a real taste of what real politics is like, I lost almost all interest.  Thanks assholes!",1
Fuck all the speculation until we see a video.,0
Quit lying paying less tax is not welfare and cutting food stamps is not a tax increase.,0
They are one of the oldest Christian sects.,0
Matthews must mistakenly think that if O'Reilly died he would get a share of the viewership.,0
I'm not sure how I feel about his theology but I wouldn't take how many feathers he ruffles too seriously until you at least look deeper than I have into what he says and how he justifies it.,0
$780 in food stamps (plus WIC)!   That's some lavish dining!,1
The fact that the judge on the case is most likely friends/colleagues with the father of the lawyer for lodsys already spells corrupt when you look at the facts.,0
"I didn't start out that way and I don't really have to stay that way, but distributors are going to have a murderous time competing with the convenience and ease of use offered by most pirating methods.",0
"But we know that we would.  We've had marginal rates at that level in the past and our Rockefeller's, Carnegie's and Edison's all stayed.  And people still flooded into this country and tried to be worthy of those high tax rates.",1
Hah...  You think Canada has strict regulation of the Financial sector...  adorable.,1
Because your bullet doesn't need to agree with a bunch of other people's bullets before it kills anyone?,0
I wonder what Rob Portman would say about that...,0
&gt; ~~Cross country organisers force US teen out of a race by assigning her the number 666~~ US teen voluntarily drops out of race due to irrational religious objection to the number 666.  FTFY,1
"Alas, I know not enough geology to properly refute this.  Instead of researching this myself I'm going to assume they are right.  Pack it up guys, we've been disproven :(",1
"Nah, just toss it in the recycle bin.",0
The Gaywakening.   I wonder why it took them so long to start disciplinary proceedings.,1
"The moment anyone calls it Obamacare, I feel like the news source lacks credibility on the subject.",0
Sort of what happened to occupy wall street?,0
"Yes.  Just fucking yes.  Plus, if anyone criticizes her we can just call them sexist.  Its perfect.",1
*ahem* SPONGE BOB IS A FUCKING CARTOON!!!!!!,0
"Took me awhile, but I see what you did there.",0
I am always amazed at how biblically illiterate people must be to find stuff like this surprising.,0
"Three questions: 1.  Did their previous insurance provide access to ""Family Planning""?  2.  Does the benefits package for executives cover ""Family Planning""?  3.  Does a Multi National Corporation with headquarters in Pakistan have the right to place their American employees under Sharia law?  Inquiring minds want to know.  I'll believe corporations have a soul when one is given Last Rites just before Texas executes it.",1
As a conservative: Morality and economics don't and shouldn't mix...,0
"He's a cloned turd all around, that's for sure.",0
I'm becoming more anti-Islamic by the day...,0
"Believe me, I was furious when our ""socialist"" (I can't roll my eyes at that hard enough) president took single payer off the table before anyone even had to ask him to take it off the table.  We should have nationalized healthcare like every other civilized nation on the planet, but apparently my fellow Americans just don't want it.  They're barely willing to tolerate the incredibly mild reforms in the ACA.  Hell, people are furious at the president because their terrible fake insurance is being replaced by cheaper insurance that actually insures them.  ""But but but you said I could keep eating dirt and paying for the privilege if I wanted!  Liar!  Liar! "" We've been trying for single payer since Teddy Roosevelt's day, and it got him kicked out of his own party.  This sort of ""everything new is pants-pissingly terrifying"" mindset is why we still won't use the damn metric system.  As much as I think my country NEEDS single payer, realistically I have to admit that the majority of us apparently don't WANT it, so I'll take whatever petty improvements we can get.",1
"On a side note:  Today I learnt  Psalm 137 mentioned in this article inspired ""By the Rivers of Babylon"" by Boney M - which was one of my favorite records many years ago.",0
"For more information about an Article V Convention of States, visit /r/ConventionOfStates",0
"Could you image how poor of a state they would be, without ""city folks"" tax money?",0
"Skanks, the lot of them.",1
"I observe this every day.  If you talk to a ""right winger"" in Fox news terms, then they *hate* big government, Obama, socialized medicine, taxes, etc etc etc.  Talk to them about *actual* programs, and suddenly they are actually for almost every government program in existence.",1
One small step for Atheists..,0
"Considering it's a net loss for humans, yes.",0
My friends just showed me one of these the other day - Apparently he got stopped on the street by debating converter.,0
This way too funny to take seriously.,0
"Damn Ted, you must think gods a pussy.",1
"I think the Republicans make a fatal error when they don't take in to account, human nature.  When you tell people they can't vote, they are sure to show up in droves.",1
Don't they need it the MOST?,1
"Cool, we can keep the governorship and take her congressional seat!",0
Is it plagiarism if they ghost wrote the book for him in the first place?,1
Happy Veterans Day!,1
Minesweeper @ 4k here we come.,0
If you are under 100% of the federal poverty level you do not qualify for a subsidy.  If your state did not expand medicaid you do not qualify for that.  You are SOL.,1
"One down, ~26 more to go, along with their political evangelical selected and elected majorities in their state legislatures.",0
Does it restore much needed snap benefits?,0
Because then there wouldn't be any gurus.,1
Unicorn populations are out of control and causing habitat destruction for Bigfeets.,1
"Nope, this is not the view of the majority of Christians (either around the world now, or throughout history), but it is typical of what are called ""Dispensational Premillennialists,"" and they happen to have a pretty strong (but weakening) presence in the churches of America, particularly in the south.",0
"Patriotism?  We're Christians, not patriots.  I love all of humanity, not just 'MURICA.",1
"If this even gets to 100k, you know that some whitehouse aid will  respond with bullcrap about surveillance and security and the administration's supposed stance on the NSA revelations.  And of course, oh yeah the book report; education is good.",1
"In his letter of resignation, he said he wishied to spend more quality time with his klan.",1
Blame the veil covering all their peripheral vision.,1
"Yes, but can it run Minecraft on far?",0
"Well, back to Firefox then!",0
"I really wish it were true, but I'm pretty skeptical.",0
Michele Bachmann is also linking US Politicians to idiocy to everyone outside the US.,0
I am an American Jew and I call on the people of Israel to get rid of Netanyahu and other right-wingers.,1
"The home team always hears cheers from the crowd, even in their worst seasons.  They wouldn't even know they were losing if it weren't for the numbers.",1
"They also view it as a one way street and decry the ""war on Christmas"" so you know its also bullying christians to disagree with them too.",0
And possibly feels guilty that he resides in and makes his living from the high-income class?,0
Cola costs more per litre than petrol around here.,0
"Why would you buy this, and what would you do with it?",0
"The point of the article is that while everyone (outside of the Fox bubble) understands that it is an astro-turf group funded by billionaires, many progressives see tea-party supporters as uninformed, low income fools who are working against their own best interest.   While the reality is that the majority of tea-party supporters are the same wealthy conservatives that have been around since the Reagan revolution.    This is not to say that the media hasn't focused on the image of the ignorant white-trash supporter with a severe spelling dysfunction.",1
I wish more of my fellow Tennesseeans would vote against her when we have the chance.,0
"Zimmerman didn’t claim Stand Your Ground, just the same run-of-the-mill Self Defense every other state has.",0
"If he wants to keep it secret, the word wouldn't get out.",1
"""No title of nobility shall be granted by the United States: and no person holding any office of profit or trust under them, shall, without the consent of the Congress, accept of any present, emolument, office, or title, of any kind whatever, from any king, prince, or foreign state. "" Article I, Section 9, Clause 8, Constitution, United States of America.",1
Until the next office suite.,0
"lol, that's one big massive steaming pile of r/shitpoliticssays",0
"Ahhh yes, the ol' *he's such an eloquent and learned speaker on issues of belief, religion and theism as well as being a noted scientist, this only confirms my belief that this averred non-believer who has repeatedly argued against silly beliefs is actually a believer. *  If you can believe that.",1
This is how the grey goo begins.,0
The Koch Brothers are driving society into a 21st century feudalism.,0
"Why?   We've got more money than we know what to do with in the USA.  We've got people paying $5,000 to sit in the stands at Fenway to watch a ball game where a 29 year old pitcher is getting paid $2 Million Dollars....  We're not broke, we've just got our priorities all wrong",1
where in the article does it say he has a faith in god?,0
"Allen West rails on Obama, CNN Drops Morgan, and the Goverment Shutdown.   This is a great week!",1
"Once you hear Blondie's Rapture, you need no other.",0
"Washington, D. C.  Surpasses New York, L. A.  as Fastest Growing Region of Wealth http://www. weeklystandard. com/blogs/washington-dc-surpasses-new-york-la-fastest-growing-region-wealth_767299. html 7 of the 10 richest counties in D. C.  http://www. forbes. com/sites/tomvanriper/2013/04/25/americas-richest-counties/",1
AHAHAHAHAHAHAHAHAHAHAHAHA!  HAHAHAHAHAHAHAHA!  HAHAHAHAHA!  HAHA!  HA...  Now I'm sad because this will never happen :(,1
The truth is out of style,1
"I believe nothing the Obama regime tells me, I believe a lot of what the Iranian one does.  [**Iran threatens widespread retaliation against US and allies**](http://dailycaller. com/2013/09/10/iran-threatens-widespread-retaliation-against-u-s-and-allies/#ixzz2lo2bVVso)",1
The thing that worries me about Jon Stewart is a nagging fear that Comedy Central is periodically trying to pressure Stephen Colbert to be more like him in order to appeal to a broader audience.,0
She would have much more effect as the chairman of the senate banking committee.,0
"Feinstein is a complete tool, any ""reforms"" from her are likely utter rubbish.",0
Landmark in the sense that it conforms to the reality 99% of scientist know to be true.,1
"They aren't crazy, they're stupid.",0
"Ok, I only have one x chromosome...  but *I* feel patronized.",1
"People are stupid, but they keep forgetting how stupid they are.",0
