text,label
@user thanks for all your help Giles,1
@user I am procrastinating on getting work done b/c I am reading your new book!,1
@user but they put it in soaps and shampoo! It's healthy!,1
Thank u to all u beautiful ppl that talk extra loud when I'm trying to watch tv I love you guys so much #srslyofALLrooms,1
@user It's no longer political.@user is setting the stage for all out race war.That is his only way he can succeed.,0
#mondaymorning pouring rain and i am singing 'the most wonderful time of the year' as i walk to the office,1
It's nice to see continuity in our gender struggles.,1
True http,1
Getting damage control advice from Rush?,0
"Pips who drop out of school n have Kirya as 'eir role model tht ey wana sing too..guy spix Portuguese,French,english...#Not a school dropout",0
"&gt;$7,000 fine It's insane that one of the largest businesses in the world would refuse to pay this, but it's Walmart.  Is anyone surprised?",1
Staying #casual #monday #funday #ootd #fashion #style #allyouneedisstyle #todayimwearing http,1
"If the government is shut down for a week, it should automatically trigger dissolution of congress, an emergency election and a CR for the time between dissolution and the new election.",0
My life on a daily basis #notreally #lcsbeauty #followme #lblogger http,0
@user 1/5th. Just like in the real world!,1
That's comfortably the most stonewall penalty I've ever seen.. What are these refs on? #hadone #Stoke,0
I work in front of laptop for 8 hours a day and suffer terrible dry eye. #bloodshot #eyerony,0
"I shun the workplace chit chat, to look at what happening on twitter #randomtweet",1
@user gay but I bang that,0
"HaHaHaHa!! #hypocrisy ""MT @user: Katie Hopkins calls Russell Brand a bully...: http",1
Maybe he should create a National Board of Journalism Teachers and give himself accreditation so he can flunk them anyways.,1
Is there even math cells? if there is they're not working ahhh hahaha #mathisfun,1
I feel so blessed to get ocular migraines.,1
"Oh look, a right-wing blowhard is talking out his ass.  Must be a day that ends in ""y"".",1
Tomorrow is the day I'm coming back to Florida for good ... :( unless something changes in the next 24hrs which I doubt #ready,0
Just now layin down to go to bed. College is great guys. It doesn't stress you out or keep you up at night at all. Or make you cry.,1
"happy birthday to my boo @user love you, have a great day! http",0
Hope is not a strategy.,0
"Walking down the mall in front of a group of guys and hear ""even the momma got it"" Jesus lol everyone loves polly",0
Walking to school is so awesome,1
The people at Ifixit must be getting a bit miffed that someone has already done their job for them.,0
Most useful algorithm I've learned in class so far is finding a substring by using the fast fourier transform,1
Literally functioning on 4 hours of sleep and I feel great !! #Not #CollegeisKillingMe #OneMoreWeek,1
@user Frisky at 2am? That's nothing new.,0
At least I don't have to clean the floor,0
I liked a @user video from @user http 2015 Challenge! Style By Dani,0
"@user @user This sounds high, but is safe for short term use. It dramatically increases antimicrobial peptides in the blood.",0
Isn't the point to learn how to craft our own reality? What am I missing here? Should we not be different? #wat?http,0
#forgive #others #not #because they #deserve #forgiveness #you #peace love this from @user #words #wisdom ... http,0
@user Please give me a Follow Back.,0
Such a good lie in,1
Carphone Warehouse call centre employees are such classy people @user,1
My body refuses to sleep. #fucccck,0
Can almost smell the turkey #hungry,0
@user @user what's going on with sharks hair? Looks like the council has cut it,0
"A strange day so far everyone seems in such a good moodmaybe in actually napping or still drunk ""still time for grumpy to return",1
@user @user so glad I bought a diesel car 2 years ago,1
Eating sweets in PE,1
... Can#do#no#more#not#usually#a#quitter#only#so#much#can#be#thrown#at#me!,0
"@user if aguero is out for a long time, city could buy bony in January!",0
Hah...  You think Canada has strict regulation of the Financial sector...  adorable.,1
Welcome to the wonderful world of Regulatory Capture - it will only get worse as the years pass.,0
@user ugh... painful for sure. can't win em all I spose... but you shouldn't ever look like that.,0
"If you drag yesterday into today, your tomorrow cannot be what it was meant to be. Let. It. Go. #BringOn2015",0
They would probably drop through the floor if men weren't permitted to drive instead.,0
Hanging out with my niece all day jokes,0
Just gave Imperfecto a 3.5/5 rating on @user http,0
"To all those who held back in #2014 start again in #2015 as.. ""@user: It's never too late to start! http",0
@user No reasons given. Some waited expecting a call but only found they were not chosen from media announcement,0
Parking meter obviously forgot to get its own parking ticket. http,1
We may be some time. #Hibernot #Not http,0
#np #NowPlaying #NowListening #Music #Don't Let Her Pull You Down by #New Found Glory from the #album: #Not With... http,0
"I'm in the back chilling for now on , if I don't keep it contact with you or hit you up don't get mad I'm just on some other shit",0
"Migrains,, throwing up are always fun",1
And seeing the light on the current drug policies.,0
Putin praising Constitutional Court for defending against 'arbitrary action on the part of the government http,1
Did #lyntoncrosby invent #CameronMustGo ? Puerile attacks on @user in RW press provoked #webackEd which led to #CameronMustGo,1
[I am shocked! ](https://www. youtube. com/watch? v=nM_A4Skusro),1
@user I think that was the joke.,1
@user @user @user Missed off the hashtag?,0
Nothing better than getting a snapchat from @user with #the weight playing in the background #sameparents #sametunes,0
This 'legendary' anfield European cup atmosphere is great hey! ;-),1
@user Joke of the year congrats! #Kuivaa :/,1
You're never too old for Footie Pajamas. http,0
@user yeah me! I should get a more active social life and get away from the internet...,0
"Some are really loving the criticism on Zoella. Let it rest, please. I wonder what you would do for some £££.",0
The @user moderation queue is flushed once every one planet Miller hour!,1
I can't wait to go to the post office to get bent over with $100 shipping fees to mail my folks' #Christmas gifts to Montana.,1
"amazing how they are the one doing the ignoring, and think they are set free @user @user @user",0
"Check out> @user¢â""¬Â¦music that makes you feel something. #London #UK",0
"Just as the microphone fails: ""If we were having this conversation 100 years ago..."" @user #WebRTC #WebRTCParis",1
The of how worst films become must see #films: http,1
@user @user: Thats quite an interesting number coz I managed to read only 17 but i will surely make it in #2015.,0
@user @user @user @user @user @user @user fuck it mite just warch eastenders,0
Trying to eat crackers on the quiet floor likeee.. Maybe if I chew slower no one will notice..#not,1
"@user you guys sure screwed this up royally. I'm happy for Lester, the brain trust over there sucks. #nicejob #LesterToChicago",1
Please snow let us get out of dance early,0
"Second major nosebleed of the day has halted my training efforts. Nares, this means war.",0
Oh how I missed middle school drama :~),1
"Somebody thinks the ""affordable"" premiums will be going up again.",0
His immortal words resonate wisely in these dark days of deceit and malevolence,0
almost 72 hs of a kid asking for his christmas gift and zero answers from @user thank you guys! you are awesome #not,1
Breaking up with your girl so you don't have to buy her any presents #lowbudget #smartmove #a #good #idea #butscheming doe,0
Nice touch. All the bar staff in the ground wearing #saintsfc t shirts,0
The shadowy Investigatory Powers Tribunal says tapping of major Internet cables OK. That's alright then. http,1
Claybo Dawson and I are @user 's #squadgoals,0
"Ahhh 7 a.m bedtimes, how I've missed you #examproblems",1
Seems like all is forgiven regarding the Republican brinkmanship caused government shutdown.,1
"@user @user Really?! This is absolutely below the belt, especially towards Tom Boon ... #DeepRespect ...",1
@user haha they were never nice. Guess I'm not cool enough #sadface,0
"YOU are violent, it shows in your tweets @user @user @user @user @user",0
"It's a good thing Obama opened up Cuba in his first term, and didn't wait until all his elections were over. #cuba",1
Aaand the hits just keep on coming. #BadDay,0
"I prefer it!  I'm a Texan and a while back I had a HORRIBLE kidney stone but I didn't know what it was because I had never had one before, I went to the ER in EXCRUCIATING pain and they treated me wonderfully!  I got three, count 'em baby three, shots of morphine through an IV, that is an experience I have never had before but enjoyed and would recommend!  Then I left with a handful of prescriptions after a CT scan (is that right?  Some kind of scan! ) and went home and was high as a kite for a few days and then it passed and we were all good again.  Woo!  So then the bill comes and it's $8000!  So at first I was all like ""woah, shit"" so I called and complained because while in the ER I had specifically ask, repeatedly, how much the scan would cost and had repeatedly had my question refused to be answered by the doctors, nurses, radiologists (or whatever they're called) and even the lady who came in to get my personal info and ask me for a credit card to pay ""as much as I could afford right now"" (I authorized 50$ because she wouldn't explain to me what exactly it was I was paying for ""right now"" and I finally decided they just wanted a card on file).  Sooo when the bill comes the scan ALONE was 6000 bucks, just the scan, the entire rest of my treatment was only 2000 which I would probably have paid gladly after the wonderful care I got (and I knew I was uninsured going into this and I knew ERs are expensive and at the time I was in HORRIBLE pain and scared shitless by it so I didn't care).  I made my choices and would live with them but 6 grand for JUST THE SCAN?  That seemed unreasonable to me and I also found out later that scans like that aren't necessary for kidney stones and often aren't done unless you're peeing blood, so wtf?  So this is where the fun starts, I called to complain about this scan cost, I was quite clear that I would pay a reasonable about for my care and was happy with my care but I couldn't afford 8000 total and that 6k for the scan was nuts, so they ask me to fill out some paperwork to see if I qualified for ""financial relief"" from my bill.  I explained again that I didn't want charity, I just wanted a reasonable bill (and BTW, 2000 for the three shots of morhpine and the 10 minutes the doctor spent with me seems a little out of whack too, 800 of that is called an ""ER fee"" and is apparently a charge you get just for walking into the ER regardless of what happens next, but hey they took good care of me and I don't know what the fuck morphine costs).  Anyway the only option I had was to file for the charitable relief, well ya see I am currently a ""stay at home uncle"" my brother abandoned his two kids with our mom, she can't afford day care (you would not fucking believe how expensive day care is) and since I made less money than she does, I become the stay at home parent.  We all live together now, she pays the bills and I take care of the kids.  It was weird at first but it's actually kinda rewarding and fun now (most of the time).  So technically I'm single with no income and have been for about a year and a half now and my tax returns reflect that.  Actually do have some income for contract IT work with people who knew me before I quit, it's all under the table though.  Soooo I got FULL relief.  I actually have some money and my mother actually makes ""ok"" money and we were willing to pay a reasonable amount for the bill (my hope was to reduce it by half to 4k and pay it out over time, lower is better of course but I had braced myself to accept 4 grand if I could negotiate hard enough to get there).  Instead I paid 0$.  And I learned a valuable lesson, if it looks like you have no money you can go to the ER for freeeeee!  Wee!  So suck it tax payers I ripped you off for 8000 bucks and I have three pain pills left over for a rainy day!  Now stupid Obamacare is going to make me pay for my own insurance :( boooo That's going to be like 70$ a month.  EVERY month!  You even have to pay in December!  Come on government, it's baby Jesus birthday, fucking dicks.",1
I love my mom,1
@user guys!!! you've just smashed it!! #WhereDoBrokenHeartsGo #XFactorFinal,0
@user I was only clarifying for my LEGION of other followers. #NotForTheIntellectuals #DrHandsomeDennis,1
http What Day is the Sabbath? #follow #Jesus #Christ #FBC #FBCJAX http,0
@user Funny thing is now she's a security guard at Fed Ex in LA where I pick up all the time.,1
I didn't know the story of Noah had transformers in it. Man the modern biblical tale killsssss it. #whatarethelivingrockpeoplefor,1
@user And here I though that a one programmer operation had the same money and power as EA. #TheMoreYouKnow,1
"@user @user @user @user #GamerGate , now with weaponized Ninjas. we trained with Assasins Creed.",1
"@user Even though @user's got more ex-wives than @user majors, I'm happy for that washed-up mess... #Not!! #Blocked",1
@user I hate you lol,0
@user it's no fair that u get to have a lie on & I'm up early for College and it's bloody freezing #fair #lucky #duck,0
I just love when you test my patience!,1
"don't knw how to react everytime sum1 says me being in a wheelchair ""inspires"" them! im just living they same you are dude",0
aw i love it when my boss schedules me to work the day that a storm comes to the bay area!!!!!!!!!!!!!!!!!!! :'),1
Absolutely appalling service once again from @user Can't wait for the rise in fares next month #excuses #joke,1
They probably gave him talking points to heckle Obama with to make him a victim and make it look like he's more moderate than he really is.,0
"Great, I've got a lung infection. This is fun. :/ #notfun #miserable",1
"""I can't breathe!"" was chosen as the most notable quote of the year in an annual list released by a Yale University librarian",1
"I have an idea, how about 911 operators don't ever describe race? And police have to wear color blind glasses?",1
"I'm seeing #catfish while I search for a #fishsitter for my #goldfish, #LoveLife",1
"@user not you, you're on pain medications",0
trivia crack is taking over my life.,0
@user yeah stressed isnt the word could easily punch someone in the face right now,0
supaaa sweet when you have finals in the AM and ya can't sleep.,1
#BBC #News -- #Denmark #challenges #Russia and #Canada #over #North #Pole. http,0
"""@user: AMAZING. I love this team. They scrap and always find a way! 15-6"" <-- indeed. #dcRising",0
"i need to start going to bed earlier...smh, goodnight everyone, or should i say goodmorning haha #morning ... http",1
That's because Republicans don't want poor people to vote.   Those cheeky bastards.,1
Xmas on the blog feat intimissimiofficial and @user * Read our story and share the LOVE... http,0
@user So that is what happened the ACORN voter fraud people.,0
"yea, and some survived it.",1
I blame my mom. Mother of the Year #sarcasm,1
"Always classy, never trashy and just a little sassy.",0
Well @user I watched'Making of' clip about Drive Rescored. Now I see how easily composers do it! http #,1
@user WTF!!!! Was that #GangstaWankstaYard,0
Am I the only one who finds it very stressful when the #OrionLaunch feed keeps buffering...?!,0
I wish religious fundamentalism would be officially regarded as a mental illness.,0
So kind of occ health to book my tb skin test on my day off uni. I am thrilled,1
It is so rewarding to work in a place where the teachers and students have been reduced to nothing but numbers and test scores.,1
New homeschool year. New Marketing business. Clickbank University. Wealthy Affiliate. Writing the book finally. #holyschedule #needanapp 0_0,0
"@user :-) Go for it. 20th Century Fox copied me and did 21st Century Fox, after all ... , I hasten to add *very* unlitigiously!",1
"What's sad is that trucking used to be a viable, respectable blue-collar career that would feed your family and provide dignity.  Until deregulation, and Republican-led initiatives to fire-then-rehire as ""independent contractors"" made it a race-to-the-bottom, amphetamine-fueled class of serfdom.  Yet these truckers blamed unions &amp; demonized ""liberals"", while rewarding their tormentors, for destroying their vocation as a desirable, honorable profession.",1
Here comes the universe. #TMLtalk #Leafs,0
@user happy birthday Skip! We will always love you! #Phillies #legend,0
I always can't wait to see how works. #IfYouKnowWhatIMean,1
I wonder what Professor Iaukea has to say about the new Disney Princess...?,1
#NOT ALL There good & bad in every occupation & race #Stop Labeling #Not All http,0
": When some masseuses offer ""soothing"" massages the way reviewers offer stinging criticisms. #Masseuse=#Reviewer #Massage=#Criticism",1
"Ostentatious ""a showy display designed to impress"". Thats the word I immediately think of when I see a woman feeding her child! #Idiot",1
"EXO COMING SOON 2015 Better pray this is better with 10 members *sighs* But either way, obssessed fans would still be obssesed ._.",0
Don't let John Stewart know,0
Sad that when someone drinks they treat you like shit and won't talk to you.,0
Landmark in the sense that it conforms to the reality 99% of scientist know to be true.,1
#Consensus of Absolute Hilarious #Irony – #MichaelMann to lecture on #Professional #Ethics for #Climate #Scientists? http,1
http #TeenAnalCasting #Alice Alice and Dana -TLW 3X05 Part 2,0
#UKArtistOnly @user @user @user present. #UKUntoldStory #MIXTape #GetOn #DUCMG,0
"Math presentation, ap history test, ap science test, and whatever the hell we're doing in Asgill... Today should be fun!",1
"The best love is the kind that awakens the soul, and makes us reach for more...",0
I am so happy that Thad (the Lead Multiplayer Designer for Hardline) followed me XD,0
Today is awesome!,1
@user One of those obvious when you see it but oh so clever ideas!! Glad you approved!,0
@user - p.s. strong tweet. particularly Horatio's involvement in the matters #bloodlinecontinues xxx,0
Worked both jobs between 545am and 830pm w 15 minutes between jobs. Already planned to sleep immediately after work tomorrow.,0
"Peshawar school massacre: Pak must know their greater enemy is terrorism, not India.#Peshawarattack",0
"The Catholic Church is amellennialist, and does not believe in the Rapture, for what it is worth.",0
Youve got to just love the efficiency @user two-day service! #7DayService #prioritymail #hahahaha http,1
"Preparing some sample answers for the rehearsal exam qs for Digital Media with Google Drive, I'm so technologically advanced..",1
@user I think it's a safe bet it won't fit the crime.,0
itsfunny bc people think im quiet but im just listening toeveryones convos and figuring out ur weaknesses todestroy u later in life #sarcasm,1
is too complex a word for him to understand @user @user @user,0
Probably just scarred the cleaning lady half to death because she didn't know I was home.,0
Connacht Camogie champions 2014! 3 years in a row! Hon HRC! #MountbellewIsAHurlingStronghold #HolyRosary4life #SeniorB,0
Hummingbirds #Are #Experts #at #Hovering #After #All: #Background #Motion ...: If the hovering ability of the... http,0
#034i #100 #Glitter #Inside #Just #Lamp #Of Please RT: http http,0
Those Amarillo hops make it just right #goldilocks - Drinking a Tour de Fall @ Memphis' Pint & Dram - http #photo,0
Imagine if schools spent $70 million on education.,1
Now I see why this play wasn't reviewed. Because it wasn't even close. http,1
"Cry me a river, OP.  I'm thrilled that ENDA passed and fundies can't be discriminatory bigots in the workplace any longer.",1
"http://afrocityblog. files. wordpress. com/2009/04/black-man-tea-party. jpg maybe if you had socialism people would be able to put their apostrophe in the right place.  As someone from outside the US it is just absolutely alien that people are on the streets with placards complaining about ""socialism"" especially when you see the exact people who are the ones protesting.  I was in the US recently and I took a cab in St Louis, the cab driver was an older American who had bad health little or no healthcare as I understood it but he spent the entire journey complaining about socialism.  As a Swede/Brit/European my head just cannot get around the concept of someone whose life would be orders of magnitude better complaining about socialist beliefs.  The ruling classes have through a very cunning media campaign managed to dupe the working classes.",1
"Get on the work bus, driver turns his music on and the first song on is 'another day in paradise' #irony",1
@user @user true n that's y we r jaded EVERY YEAR,0
Well said @user! I for one am fed up of all these women breastfeeding ostentatiously!,1
I just love 160 question tests in the morning.,1
Can I ask why we didn't hv GEJ n PDP trending yesterday night http,1
Love the fact that are school smells like a sewer.,1
feeling well,0
If this year wld be filled w all these rainy days it wont be so cool a cool way to start e year,0
Now I remember why I buy books online @user #servicewithasmile,1
can you imagine being in high school today with a delusional dad making a fool of himself on the internet @user,0
"This person has an interesting view of what ""traditional"" means.",0
Last day of school it was so much fun but not much people came. what a shocker,1
@user Is it on display at any given time at Ryerson?,0
Nooooooooooo again it's on!!! #PickANewSong #CantStandIt,0
"She said nope, I'm only getting gift cards...ones she bought using her credit card points. .",1
"The secret of #change is to focus all your energy, not on fighting the old, but on building the new. ~Source Unknown #Quotes #QvAW",0
"There's millions of autobot & troll accounts on Twitter that post dumb sh*t for RT's, then people call them stupid & naive.",1
@user Lol I hope that's a good kinda crazy,0
Chillax Bitches. why is my face so squished. #fireball http,0
@user miss u lots and lots like jelly tots,0
"Yoga pants, a sweatshirt, and nikes, am I @user yet?",0
"@user So, this Topless Feminist was just looking for someone to love?",1
"Wallahi speaking to an unbeliever is bid'a, let alone wishing him/her a happy celebration.",1
Uh-oh. Better head for the hills. #storm #clouds #seekshelter http,0
@user @user yip most likely the next time I get #suckered into #making anotherone,0
Lol RT @user: Wouldn't surprise me if Soldado bangs in a hatrick and we win 0-3 against Chelsea tonight .. The legend is back,0
At http -- The sun finally decided to play #beastside #tahiti http,1
@user People who are drinking and driving now please,0
Well you just have to look... Don't you ?? #wrestling #SportsEntertainment #wwe #raw or #smackdown #co... http,0
Bet that was #limbs in the Sunderland end,0
watching Elf was a prime decision tonight,0
@user just trying to confuse you all,0
"If his Twitter account is any sign, then this book looks to be a must read id rather read twilight http",1
Is it plagiarism if they ghost wrote the book for him in the first place?,1
@user still out w/ back sprain?,0
@user nice to know that you give me so much importance. :) :] @user n,1
Nothing like waiting at an airport. #youcanthearit,1
"Tell that to the executive branch, who have violated established law by continually making alterations and exempting people from it.",0
They have #been seen www.MonsterMMORPG. com since. gist by #MonsterMMORPG #darumaka,0
"@user @user if accurate, v sad indeed",0
"somebody wake me up early tomorrow ive been facing weird aches in my back since early december .,. and why do u think that relates madaka",0
This has been the modus operandi of the GOP since Obama was elected - it's time to clear out the dance floor.,0
$780 in food stamps (plus WIC)!   That's some lavish dining!,1
@user good thing we had enough #whitewine and #christmastrees to survive if needed. #chardsohard #fashion ;),1
It's hard to take people seriously who can't spell and think grammar is a type of cracker.,0
#ready for doing #business today #tiredashell #coffeecoffeecoffee #morecoffee #... http http,1
Just seen 3 bikes on bikes.,1
"Don't you love that they also gave themselves millions in farm subsidies for their own agri-corp farms.  Not their districts, themselves.  My TP congressman voted yes to it while voting to cut food stamps.  He doesn't get the subsidies but he was part of the shutdown so I give him a hard time about it.",1
#Minivan #Mom #Ebony #Wilkerson #Guilty #By #Reason #of #Insanity: #Judge: A Florida judge ruled Friday that... http,0
That moment you drop your phone right after your kid gives you a case for Xmas but before it's actually opened and put to use.,1
#BBC #News -- #USA -- #Jeb #Bush to #explore #White #House #bid. http,0
Hope everyone is having a lovely Marxist Christmas,1
Over on CBS at noon is #BALvsMIA. FOX has #SEAvsPHI after the #Saints. #NFL,0
@user @user @user Oh wow your talking Skype! Cool!,1
We are MAD Gamers: http Follow @user #Wellington #NewZealand http,0
"And a fundy christian half-term governor, with delusions of grandeur, is one of the best sources for comedy in America.",1
Can't say no to that @user try now. Lets go @user we can do this #COYQ,0
Congrats still SASMVT for a good run. Ulitin nalang ulit ang 6-peat next year :),0
hahahaha... 'Best Asian Style' went to the group of pretty boys ALL wearing blacks suits with a tie/bow. HOW STYLISH. #2014MAMA,1
What normal people see vs. what I see @user http,0
