text,label
Don't think that you can just use my boyfriend when you have noone else...#not#on#my#watch,0
Decemberbessen #not #fail #footprint sorry... http,1
I wonder what triggered the anxiety? #sarcasm,1
: Historians collecting correct facts about wrong abuse. #Correct=#Wrong #FactAboutAbuse,1
"Crime figures: true picture may be worse than feared, says think-tank report via @user http Surprised?",1
"http nope, you do NOT fit that definition @user @user @user @user @user",0
The city that only sleeps on mass transit. #naptime #isntitironic #donchathink #imnotsure... http,1
I dont understand tlist as I dont read inamorata I only read inamorato lmao #sorry or prob lol,0
Church sign of the day: How would you feel if we celebrated your birthday without you? #StoleEm #TheReasonForTheSeason,0
"Cool, we can keep the governorship and take her congressional seat!",0
"@user now, to remember which book... #goodluck",0
@user Our 3 losses followed bye weeks & an FCS team. Do we get rid of those next year? #sarcasm,1
http so Ugly Christmas Sweater Women's Sz M http,0
Easiest final of my life. So glad I studied 11 hours for it,1
Thx for catching on #urock,1
Wash hands with water? MOH is rubbing this on everyone's face? #irony http,1
Hi @user not a single vote was polled in 3 polling stations of Kulgam #Kashmir & im tuned into @user :p thnx #KashmirBoycotts,1
What a great start to my morning #smh,1
I said it when he was elected the first time: Barack Obama will be remembered (eventually) as the worst President in American history.,0
@user @user Actually Israel's demand renders it antisemitic acc to your mate's favourite non definition of antisem.,1
I am just hoping he will get center to right Catholics to think.,0
Cause I love going to bed alone every night.. #not,1
@user Can't wait to play the #BFHardline Beta with you XD #Epic,0
"""@user: @user Aaaaaamd what time is your bedtime? >better tweet Dad at night from my house. I don't want to get in trouble!",0
thts impoxible koz the late kajwangs brother is stil alive and kan occupy the seat but raila,0
I like listening to dads truck drivers tell me about them going to the strip joint and their old lady getting mad at them over it,1
I just love EU servers...,1
why is there a hotdog on http,0
@user there wasn't room for #LoveYouBro,0
"Considering President Obama's first term began in the throes of the Great Recession and recovery stimulus was compromised down to be less effective, it should have been clear to all from this beginning what the conservative goals were, and what they were willing to do to achieve them.",0
She must have taken the Parsing Graduate Course from Bill Clinton.,1
"they don't sing live, but they sure are hella good looking #smh",0
"@user Say it ain't so, Joe. Who would imagine a government program fraught with fraud? Has this ever happened before?",1
@user this game is pathetic. How are they losing this game?,0
#NOT ALL There good & bad in every occupation & race #Stop Labeling #Not All http,0
"@user My ex husband's autopsy report from the coroner took ages too, it just seems to be the slow machinations of the process.",0
Babysitting night! Hoping my car doesn't get towed bc idk where to park,0
Can't believe it's been nearly 11months since my mum passed away miss her so much more and more everyday,0
#Ministers #criticised #over #train #deals http,0
I'm hungover and I'll end up staying up until 4 :'(,0
@user I'm smarter than most people who lie to me. I have fun picking the holes in their stories.,0
stomach flu once again...what a surprise.,1
Wasn't the playoff supposed to make this process easier?? #NCAA,0
"@user Cause of all the things in life this seems to be in #Balance. Music- Medicine, @user - Doctor #SuperDayLineUp",0
Lighting now setup on the #Malawi #Aquarium... Water tomorrow! #Cichlids #NoFilter #MarineWhite http,0
I can already tell today is going to be a wonderful day,1
"The word ""#Trust"" coming out of the mouths of #Holder or #Obama is just rich with and #hypocrisy. #IRS #racebaiters",1
@user Way to lay out yesterday and put it all on the line #GoodLeader #Sarcasm,1
I had the best New Years!!!! Spent it with the people I love & I fucking loved it! Such a happy camper right now!,0
Who accepts this challenge? Who's Next? Ends Soon. Be A Ten Executive & Founding Member. http,0
Dont we all just love those people who message you out of nowhere and act like you guys are close cus they want something from you?,1
Great start to the morning #flattire,1
"Thanks for the dick pic, really, thanks. #Sarcasm",1
@user Why does a iPhone purchased at full-price still need a mobile device unlock code to work internationally? #uncarrier,0
#NBA players #NY support protests of #police killings/sure #money donations for #college WB coming http,1
It #has been #seen www.monstermmorpg. com since. parados by #MonsterMMORPG #bean,0
"Yeah, but guys, Politifact said this was half-true.  You just don't understand the nuance.  Serious you guys.",1
Listening to the rain in bed #Peacefull,0
Just delivered @user #cronuts to @user hmmm its for a customer I hope!!! http,1
@user Tough crowd. Josh Smith was tremendous tonight.,0
"Work, ain't nobody got time for dat!",1
@user can you reveal what you were drinking now?,0
@user: don't say anything... just retweet it http @user @user @user,0
Well today can go fuck itself.,0
Shoes on make-up done ! I'm ready,1
Yay for cars having a case of the Mondays. #not,1
"Dear () #Spain's gov and Catalan Police, congrats you managed to accomplish the impossible: Go even lower than #Greece #OperaciónPandora",1
Oh ffs my body clock is f'd #iwanttosleep,0
to have a highway clean up section of highway. people expressed their freedom of speech @user @user @user,0
What a shock. Duke Johnson is hurt in an important game. #canes,1
#PTIUKGoNawazGoCampaign Show up at the peaceful protest infront of Lancaster house to greet our PM with respect,1
Drinking an Imperial IPA (2014-) by @user - http #photo,0
Going to my class #fuckyou important,0
"@user @user Wasn't that full in the nosebleeds where I was sitting, but it was fun! Crowd reacting to JoePa is my fav memory.",0
@user @user you do not afford the same treatment to PO's .Goes both ways.,0
"Fell asleep @ 8:30pm, woke up at 12:00am. Can't get back to #sleep. I had almost forgotten about you #insomnia - welcome back.",1
I wonder what was the holiday rituals for true Africans,0
LOL lets see if he actually READS it @user @user @user,0
@user hmmm interesting 'jury's out' but edging towards the right side of 'favourable' !! #hopethathelps,0
"""No title of nobility shall be granted by the United States: and no person holding any office of profit or trust under them, shall, without the consent of the Congress, accept of any present, emolument, office, or title, of any kind whatever, from any king, prince, or foreign state. "" Article I, Section 9, Clause 8, Constitution, United States of America.",1
"@user Hey Alex, thanks for the support. My FB page is : http and success to you.",0
No he just has a brain.,0
http so Ugly *Size SMALL* Christmas Sweater Cardi Basic Editions Holiday Vintage http,0
that fits @user @user @user @user,0
http #SchoolSystem Update #Textbook Lies to support #Evolution theory. #Tco... http,0
Just now layin down to go to bed. College is great guys. It doesn't stress you out or keep you up at night at all. Or make you cry.,1
@user @user @user @user don't forget @user and @user (they're as smart & kind as lovely),0
"The Catholic Church is amellennialist, and does not believe in the Rapture, for what it is worth.",0
"Still wondering why the pop-up ""save password"" still pops up even when you do not tick ""keep logged in"". -Sarcastic",0
"""@user: This year's class picture is so awesome. Really awesome! "" hahahahaha",1
To be fair a lot of software is overpriced.,0
Now I see why this play wasn't reviewed. Because it wasn't even close. http,1
Fucked up. in the mood at all,0
"Off to brave Tesco. Humungous shopping list, hail outside #ohbliss",1
@user mocking a spiritually precious holiday for millions is just so courageous of you... #shameonyou,1
I LOVE not sleeping. It's the best.,1
Yay yet another week with a child home from school ill! Just a hint of #Sarcasm to brighten my day.,1
Its gonna be a loooong day.. but yolo lets have fun,1
*looks at blackboard* *calls life alert* Help my grades have fallen and they can't get up,0
"It would make too much sense to connect all major US cities by rail.  I think that the Airlines and car companies would lobby heavily to make sure this never happens.  Looking at which cities the Highspeed was supposed to connect, it seems it was destined to fail.",1
I'll go to Hawaii! Bye Bye my friends! I'll be back#Hawaii#trip#with#myfamiry#because#girlfriend http,0
"ROFLMAO yeah, OOPS is right @user @user @user @user",0
@user you have never seen me,0
"I'm heading off, but need to say this! ""Just because I am concerned for my country, and it's people-Does #NOT make me a racist! #Terrorists",0
Let me bully a Park Ranger doing their job under difficult circumstances I helped bring on.  Wait... a different and accurate viewpoint?   I'm out.,1
"99 % of Maldives is water. Yet, we're experiencing a water shortage.",1
THE EMPEROR HAS NO CLOTHES!,1
@user We should monitor them...,1
@user @user 3 more nights 3 more nights #londoncalling http,0
"But not a grocery store or pharmacy. Sensible. ""@user: Offices or apartments? owners of Monroe Avenue factory ponder options""",1
@user Here's a list. Lots of great choices to help #Coyotes win a cup next year. http,1
#smile for the #photo #ok they said #boys #trouble #funny #football #kids #adorable #friends http,0
"I'm waiting for the silly conservative comments that will say how great this is, and how the 50's were a golden time, so our current minimum wage should be more than sufficient.",0
"By @user ""@user Gears up to release its next issue 'Wifey Series' with #covermodels... http",0
"""Saturday selfies"" miss you guys @user @user jessica101xxx mark8 kiss each and one... http",0
"""Execute"" commands the beginning of a job but it is used to end a person's life Now that's",1
Too blessed to be stressed. So hype for next year! #HAILSTATE http,0
Once again @user is re writing history re: #CubaEmbargo ! *primal scream* #tcot,0
Would you be having this problem if it were a conservative pres?,0
Gael 'pro at presentations' Anderson #not #choke,1
Remember when the same people who are now banning WE THE PEOPLE from public property and land were telling us the 'occupiers' had every right to be there ?,0
Those bad Anonymous and Occupy people did it all because they support white supremacy,1
"@user @user I just want learning from this group. Development. And to turn Green, Bass, and Thornton into assets.",0
"MORON, no one has ever said a ball is square #STRAWMAN @user @user",0
I feel and look like shit. #rainyday #nomakeup #sorrynotsorry http,0
@user you could probably just call or text her that information. #allcelebritiesarefriends,1
The guy who invented basic coverage for everyone in Massachusetts should run for President.,1
@user @user I'd prefer the slew of #Ferguson protestors across the US...they stop traffic shut dwn bridges,0
I have three exams today lets gooooo! #School #Sarcasm #Swag,1
Miss skateboarding and it's not even winter yet #skateeverydamnday @ Hoof Life http,0
It's freezing out there & very hazy ... Just want to go home.,0
@user I think it was the hotel owners...,0
"I don't understand why anyone watches these bowl games. They don't matter. Great, a team outside the top 4 dominated. #dontcare",0
Take my time because I want it all right? http,1
#AskSuperwomanLIVE if you could swim in any liquid besides water what would you swim in?@user 4,0
"""President's words ~~have lost all~~ *never* had any meaning. "" FTFY",1
": When some masseuses offer ""soothing"" massages the way reviewers offer stinging criticisms. #Masseuse=#Reviewer #Massage=#Criticism",1
Fans watch #tylerfarr in concert at @user #countrymusic #throwdown1035 #tampa http,0
Hummingbirds #Are #Experts #at #Hovering #After #All: #Background #Motion ...: If the hovering ability of the... http,0
I adapted the Snoopy comic for academic paper submission :P Reviewer 2 is the stuff of nightmares! http,0
I'm sure it will pass..,1
You're still shit @user #cheater #pong,0
@user Warwick Davis is more than twice the man Tony Blair is,1
"Sarcasm incoming: This weekend is going to be such a great time being grounded with nothing to do but homework, gunna have a blast!",1
@user I think that was the joke.,1
@user kabhi I'm messier than usual messy wesay I need chai & I'm resting for last 2 days. May be this is the reason.,0
@user @user @user #TSU website now worth $1.5 Million! people get paid for posting! http,0
Well it's always a good time losing at the Bay... @user @user @user,1
Cramming 200+ psych pages into my brain even though we learnt that cramming isn't effective,1
Oh I just love when I wake up with a migraine #not #needmeds,1
Listening to a guy who decimated his team explaining to another how to build teams... hahahahaha aaaah. #tragedy,1
"Ask Mystic Mona YOUR question! Psychic View, weekdays at 9am (PDT) 347-850-1494 http #BlogTalkRadio",0
Gonna be the shittest Christmas ever without my mum.. Gonna get so drunk,0
@user Presumably you have evidence to back this claim and it's not simply a feeling you have based on your interactions.,1
@user wesay Yar her date was good I guess she(in first meeting)wanted to b seen with a girl or smth(in hindsight I found her mashkook),0
Tell me the #Quintessential #Aussie now isn't a Govt paid job & then have the hyde to buy overseas online and pay no GST . mmm #SadButTrue,0
"""They bombarded out country"" #immigration @user",1
Still can't believe my teammate is engaged! #Holymoly #RingBySpring #TurnUpppp @user,0
"juugin everything, niggas got warrants to pay",1
Done to much again http,1
Aw thanks mother nature. Merry Christmas to you too!,1
@user @user @user but would you be willing to purchase from a vending machine?,0
Uh-oh. Better head for the hills. #storm #clouds #seekshelter http,0
#sotrue #ihavenolife #misshim #lovehim #haveabetterone #Justin #no #justinbeiber by grandtheftauto_five_troller http,0
Correlation does not imply causation.,0
Fun night with these girls. It may look like we are eating dessert but its just for show ... http,1
I'm in love with the cocoa,0
Nobody can deny this. #career #gita such a #profound word. http,0
#Malala Yousufzai receives #NobelPeacePrize and #Pakistan ranks in top 10 dangerous countries !!! #irony,1
"Giving 200 Cr. Water Subsidy to ""Public"" is a CRIME & Wasting 200 Cr. On Advertisement is DEVELOPMENT...Waah ji waah http",0
@user It's no longer political.@user is setting the stage for all out race war.That is his only way he can succeed.,0
@user A cool look and a cool mind is all you need to party all night. #QuiksilverGoesSupersonic http,0
Successful morning doing my essay... #ChristmasShopping,1
I think tori is actually my favorite human being on this earth tbh,0
"Yeah, the prom is the most important event in your life",1
go subscribe @user on youtube http for good music,0
@user always a worthy choice @user @user @user @user,0
@user @user @user @user @user @user mmmm,0
Some guy chattin shit to me on the bus saying I look like snoop dogg #KMT #again,0
@user yes mother as you wish,1
This is a song??? Awful!! http,0
"#Ukraine's #President to #meet #Russian, #French, #German #leaders, #rules #out #offensive. http via @user",0
"I love the concept, but my wife's a teacher and the kids just can't go longer in the day, and 4 of the current days isn't enough time to cover all of the items needed that she needs to relay to them.",0
My favorite color is every color.,0
"The late Howie Carr wd be amused to see Granny Warren putting the wood to a ""bow-tied bum kisser""",1
".@user Finally had a chance to watch Doyle finale. Thanks for 6 great seasons. Yes, I cried at the end...",0
i'm so funny,1
"If only the polls had been unskewed in time, the 'real Americans' would've seen the plain, unvarnished truth and removed the Muslim Atheist Socialist Fascist Kenyan usurper from office.  Twice.",1
@user has passed @user as the world's most valuable #startup! #growth #nyc http,0
I'm not staring at your boobs hun..I'm looking at your heart #relax,0
This is definitely me! #me #sarcastic #sarcasm #ecards #ecard #somecard #tease #funny #lol... http,0
"Looking forward to a nice and long 130km #cycle tomorrow, in the minus degree weather #fool #festive500",1
"Well now the festive season has begun, let's take a moment to reflect on how much more royalties Slade and Wizard will get #sarcasm",1
@user a#chance#till#January! #this is so good #you always make me#smile,0
@user now that's just mean. #sorrynotsorry,1
New shirt #new #shirt #im #sorry #its #just #i #literally #do #not #care #at #all http,0
@user do 4 fans! http APP PAYS you & YOUR FANS!! See-http Go 2: http,0
Hit Them Angles And Duck Face To Hide Those Wrinkles ; ) #ThatsABossBitchRightThere . . . !!,1
"To be fair, that's probably true for a society where women are currently cloistered: giving them the freedom to leave the house on their own will probably increase rates of shopping and drinking lattes at Starbucks, too.",1
I can't wait to see how many pairs of beats headphones show up at the gym after Christmas,1
"My Twitter account is worth $100.20, according to Social Account Worth Calculator. See how much you're worth http",0
Yups sarcasm and wine! #winelover http,0
They are in the banking industry - it goes without saying.,0
I don't think it's the last time ;-) #hobbit #onelasttime #cinema #ov #3d #48hfr http,0
Sarcasm is the only thing i like. #sarcasticbitch,0
Shout outs to the guy who took a shower in 1 Million before heading out. The WHOLE BUS thanks you,1
Used my brains and stopped drinking at 8 and been on the tea feeling sober and good.. Bring on tomorrow,0
@user so funny lolololol,1
I fucked them really badly #AdvancedWarfare http,0
If that's Man U at its best they have much bigger problems than us ;) #saintsfc. Then again we're still 5th #noproblem,0
@user the police turned it violent. (-_-) I so LOVE the truth in headlines!! (-_-),1
"@user Oh, come on. Give her a chance with her trust worthy SNS warriors and her followers in that ""Uber-Right wing"" portal.",1
@user no but i followed you and i saw you posted that so i thot i might add on...sorry,0
Bet that was #limbs in the Sunderland end,0
"@user So we can see Reigns do a lame superman punch & a spear? Gee, can't wait! #RAW",1
"@user he's played 5 minutes, 0-4 from field, a steal and 2 fouls. that's it. that's all he's done.",0
@user Go you! #not Home until the 1st Jan. So excited!,0
A maths tutorial is exactly what I need right now #lol #struggle #uni,1
War is peace.,1
": When some naturopaths sell ""aromatic"" herbs the way apothecaries sell noxious poisons. #Naturopath=#Apothecary #Herb=#Poison",1
Nothing says welcome to home better than this. #wemissedyoutoo http,1
@user @user I keep seeing noon... Is it 1PM eastern or noon eastern? Need to plan my morning accordingly. Please advise.,0
"If there was no #CFBPlayoff this year, would there really be an argument against #ALAvsOre for a #NationalChampionship? Shouldn't be.",1
@user Guess they didn't get the memo reg non-nuclear Baltic sea #sarcasm,1
http #Science of the #GardenOfEden - #Eden #KentHovind #Christian #Jesus #Christ #c... http,0
Ohhh the joy of getting pulled over http,1
@user @user empty threats even #TheBear supports #united http,0
"@user oh joy, now i get to have even more of them in my living room! #putyourtoysaway #badboyfriend",1
is not lost. @user @user @user http,0
I hope I could recover from fever today. I need to start with strama..,0
Who dares to play this game? Lol #Shots #Sex #Fine #Tipsy #Drunk #Dead #NeedAGoodLaugh http,0
Aaaaaaaaand we're back in the ER. Hooray for no sleep!,1
"Could you image how poor of a state they would be, without ""city folks"" tax money?",0
"Love ya Jerry, but what the heck was that?",0
"Well, weekend is over! Now it's #TwitterTime again :D Have a nice monday!",1
"@user @user .@user has warned @user about Bassem.Heck, they might already know him! #Ferguson #NYC",0
@user dusty as usual #redbucket http,0
"Another thing.. just to add.. when a white person says something conservative or profound it's tossed to the side and called racist, but if you put a black person's picture above it, or say Morgan Freeman said it or whatever, it blows up my news feed as the greatest thing ever said.",1
Insane like a fox.  Ted Cruz is actually very very intelligent.  It's his constituents that are insane.  He's just playing the part.,1
Come to jhb to play volleyball on a fake beach #work http,1
Everone is supporting Fawad alam :D No fawad no cricket :D :v #Supportfawad #Usman http,1
#Michigan RT @user: Rich Rodriguez not available for the photo op. He's at the Fiesta Bowl.,0
And seeing the light on the current drug policies.,0
the ONLY time a crime becomes a federal crime @user @user @user @user @user @user,0
My stomach is a Wonderland for gas inducing bacteria. #blessed,1
When I'm lacking inspiration I resort to scribbling angry/pretty things. Great start to the week! #sarcasm http,1
I'm ready for @user's first headlining tour of North America! Tickets/info at http #lunatic2015,0
"But wait bitcoins arent real nothing was really stolen...  people pirate virtual information, music and software all the time... its all virtual..... why pay for software?   So why should it be wrong to take bitcoins..... :P (sarcasm)",1
Feels like we been playing against the refs most games. That was a clean Wall block that the refs took away. Ugh.,0
50km into the #Rapha #festive500 and we stop off for a Coffee#1... Toes are coming back to life @user,0
Woke up crying because of the nightmare I had... gonna be a great day,1
"I have an ""attitude"" because you think you're hot shit at a buffet restuarant. #lifegoals #sideworknazi",1
Did you know ? If you are reading this right now you are not blind...lol.,1
I just love when you test my patience!,1
If only I could be a cooler kid xp lol I'm such a nerd #can #i #know #when #im #not #gonna #get #rejected,0
Ariana Grandes makeup is always sooo flawless,0
@user @user I'm sure you're all inconsolable,1
Such a fun day in the lib studying Econ for 14 hours.. can't wait to do it again tomorrow #ThisIsMiserable,1
"Zimmerman didn’t claim Stand Your Ground, just the same run-of-the-mill Self Defense every other state has.",0
New England (-11.5) over New York Jets; Pittsburgh (-2.5) over Kansas City; Carolina (-4) over Cleveland.,0
"I love how they at the end, they pull out a stuck Hummer.",0
NO PAİN- NO GAİN ! #Fit #Fitness #gym #No #Give #Up http,0
Minesweeper @ 4k here we come.,0
That's always a great way to boost self-esteem,1
#MIley #Cyrus #Is #The #Bad #Influence – Sources Say Patrick Schwarzenegger Is!: Miley Cyrus has been dating... http,0
I'll do it tomorrow is a dangerous way to live,0
@user Fact we have a liberal school system. Yes I'm conservative.No that does not make me racist.(before you accuse me of that),0
"@user we all love a trier mate, but seriously, game seems to pass him by, poor on the ball,doesn't pick his runner up!",0
HAHAHAHAHAHAHAHAHAHA- wait...  are you serious?,1
home alone aka turn on all the lights #scaredycat,0
@user @user @user Hahahahahahahhahaha! I was some one and it happened to be ya! !,1
"I shouldn't lose a full day of work because of system updates, but it happened yesterday. #fuckingwindows",0
@user No clue what you were talking about? Well that's a first!,1
@user I don't think the Hereditary Baronet wants to encourage a something-for-nothing culture :-$ #irony,1
Lol at docs who don't know what they're doing. #fuckthat,1
Great start to the day,1
Nice touch. All the bar staff in the ground wearing #saintsfc t shirts,0
@user: Super Junior's Henry asks sasaeng fans to let him sleep http http Henry oppa >^<,0
At http -- The sun finally decided to play #beastside #tahiti http,1
"@user haven't you used the ""don't you know who I am"" line yet...",1
Oh the - a gas hauling semi with FLAMMABLE signs all over it - and the driver is smoking. #truestory #I10 #Texas2015,1
IS IT FRIDAY? *heavy sigh* Nooo. It Is totally Wednesday~! What a MESS. Wait 2 more days.,0
Just got yelled at by proxy. It's going to be an excellent day. #sarcasm,1
#Laundrymatfun#LOL#YesIsaidNOT#spincycle#youspinmeround#recordplayer#thatsmykid#80smusic#teachingth http,1
@user: It's really difficult not to bark back at my pms-ing daughter. When bae tweets about you <,0
@user I was using,0
".Thanks to Kanye, McCartney will finally get that big break he's been waiting for. No more dumpster diving for him. #caring",1
I asked God to protect me from my enemies a long time ago .. short after I started losing friends or #naah,1
The Grinch Stole My Sanity http via @user #lol #fun #funny http,1
@user: don't let fuckboys get in the way of you being happy never have AND never will. Lmao #DontBelieveMeJustWatch,1
#politics is not my cup of tea says #sonakshi @user of #lingaa fame . #sonakshi dad #shatru is our top #bjp leader,1
You know you love an author when you figure out how a book ends long before it does but can't wait to see how the author actually ends it,0
Hmm. Training for encouraging motivational change tonight. Don't know if I can be bothered to go. #burnout,1
"The ironic thing about Christie is that liberals like him because he is nice to Obama, and conservatives hate him for the same reason.",1
"Maaaaan stupid instagram I went from having 300+ followers, to my cat my mom and tom from MySpace -_-... #smh #butstill !!!",0
Unicorn populations are out of control and causing habitat destruction for Bigfeets.,1
"@user @user @user outta the boardroom, I to the partay!! #luvvit",0
"@user Not going this time, we might have a chance! Fool me once, shame on you, fool me twice... #fuckthat",0
