text,label
IT'S DEFINITELY NOT FRIDAY. THE REASON IS: It's Tuesday~! Yesterday it was Monday so why should it be Friday.,1
The Bane of Boehner's Being is Big Boy Boners,0
Neuroscience and The Matrix would make a cool class too!  Neuroscience and Super Mario Bros could even fit somewhere.  It's not because a subject can be discussed when talking of science that this subject is valid in context.,1
"I didn't start out that way and I don't really have to stay that way, but distributors are going to have a murderous time competing with the convenience and ease of use offered by most pirating methods.",0
Hell has frozen over. Literally. #Texas2015.,0
"Day 4 ""joyous day"" #decemberchallenge #picture speaks for itself #costateguise #beach#peace#2nd home#... http",0
Yay for early morning protestors! #heavyamountsofsarcasm,1
I retweeted this so Chris Graham blocked me. http,1
@user Prepare to get mucked #imissedu,1
".@user Computing, the Internet, personal computers & smart phones were all invented by that ""pond scum"" @user",1
#adanisJet lol @user: Irony committed suicide jumping from Adani's jet! #LoveJihad & #Gharwapsi orphaned! http,0
They are working on hormones to add to the chickens that shrink our penises and make us bad drivers so that they theses stereotypes will be irrelevant in the future.,1
Had to take a #PatioPics - snow falling still. This was totally clear when I went to sleep. #WCCO http,0
The of how worst films become must see #films: http,1
@user Did I really need to put a hashtag? Oh dear!,0
Always forget how good the F.E.A.R is by Ian Brown #singingoutloud #TUNE,0
You are using stereotypes to fight racism.  Bravo,1
The of taking a break from reading about #socialmedia to check my social media.,1
I need new boots for my birthday.. And by new boots I mean like 3 or 4 pairs #ineednewboots #boots,0
@user Cheers bro! Top man,0
"I think just as tons of more ""liberal"" people have been twisting the Pope's words for sensationalist headlines (and then when corrected seem to blame anything or anyone other than their own initial misconception), this is also a pretty sensationalist headline from the other side.   I think this article is *slightly* more honest than the NY Times or Huffington Post was (not saying much), it still misses the point entirely.   Vatican Headline:  ""Pope: Lord save us from the subtle conspiracies of worldliness"" AsiaNews Headline: ""God save us from the ""hegemonic uniformity” of the ""one line of thought"", ""fruit of the spirit of the world that negotiates everything” even faith"" Free Republic Headline: ""God save us from the ""hegemonic uniformity” of the ""one line of thought"" (Slams progressives)"" The Gateway Pundit (posted to r/Christianity): ""POPE FRANCIS Blasts Progressive Movement – “The Fruit of the Devil”"" And of course the latter will get more pageclicks, just like ""Pope Says Church Is ‘Obsessed’ With Gays, Abortion and Birth Control"" got way way more pageclicks than ""A Big Heart Open to God"".     *Worldliness* is the Spirit of the Devil.   Some progressives consider any proverbial ""move forward"" as being more important than their own fidelity to the Faith.   (You can see this sometimes in other threads on r/Christianity--""the church needs to 'catch up' to the rest of the culture on ______ issue! "")  This is a product of worldliness.",1
@user#it shows you that APC is a free and fair party#run by intellectuals#and this is what we call democracy dictatorship#,0
I'd rather see her in a leadership position in Congress with a strong whip rallying the Democrats behind her.,0
@user @user can't wait to see ya both,1
"Too late, thrown the #PS4 out of the window last night cus i couldn't play http",1
Really love when the @user is over five minutes late on the cold days. Feels like Metro!,1
@user @user Yes I remember a little. But then an entirely new lineup came in? Is that what happened?,0
@user @user let's #not #forget the #origin of a #diamond in #relation with #humanrights #bigdata,0
"#Exclusive -- #Indonesia: #AirAsia #crash #probe #focuses on #timing of #request to #climb, #weather. http via @user",0
Glad there's not a typhoon where we go on holiday in 4 weeks. #fml,1
father sent me down to buy ingredients cos he wanna fry some noodles up i remembered everything else but the noodles #somuchwin,1
ugh I hate how they act like they care about veterans day,0
@user hmm... let me think about that #sarcasm,1
I'm pretty sure I have a snowman problem.,0
I just love freezing rain.,1
I'm fricken peachy today!!,1
"Indian society teaches how ""Not to get raped"" rather than ""Don't rape"" #Sadhvi #MufflerMan #Indias30 #Rohtak",1
@user oh my fingers stick together,0
Event technology session is having Internet problems. #HSC2024,1
@user @user world's greatest fans...,1
It's currently Fair and 4℃ outside.,0
"Ahhh 7 a.m bedtimes, how I've missed you #examproblems",1
Wow I love having 3 essays due in the next 3 weeks,1
Small amount of lads with birds nests' for hair cuts #ha #3allover,1
How do I make more money now in my business? Loral Langemeire's best seller The Millionaire Maker. Get your copy http,0
@user Kohli showing all the guts of Scooby Doo. #CaptainCourageous,1
Most useful algorithm I've learned in class so far is finding a substring by using the fast fourier transform,1
If you are under 100% of the federal poverty level you do not qualify for a subsidy.  If your state did not expand medicaid you do not qualify for that.  You are SOL.,1
"@user #ChrisChristy will do well among republican voters.#JebBush, I think he could do well, democrats don't like him.",0
How the fuck do u come out of a commercial injury break w a delay of game? #Redskins,0
@user @user By definition placing money on the outcome of anything is gambling! Choosing to deny this is self delusion,0
"And 50 years ago a kid would be terrified to let their parents read their diary.  The web isn't the problem, nor are the parents.  The fact of life is that kids do things their parents don't like, and no matter how those things are recorded kids would always prefer some privacy.",1
"All we do is eat, watch movies and kick the shit out of each other' #RelationshipGoalsAccomplished",1
Well that's me living till I'm 200yrs old!!! #sarci #wit #low #constant http,1
#indonesian#czech#mix#girl#with#my#boy#elvis#im#single by mcrodyn http,0
I wouldn't be surprised if the Park service tried to claim 'eminent domain' next.,0
http #CHRISTMAS #GIFT #BLESSING #Santa #follow #TheInterview#BharatRatna #CallMeEva... http,0
"If I carried on the way half the men do on here, I'd be getting called a crank (amongst other things) and be asked if I had #PMT...",1
I love when half the group is really committed and the other half just doesn't give a crap! #perfection,1
@user: You want to see something Irish!!Of all the reasons to be closed http #irony,1
"LOL and now you cant see when blocked, best thing you can do is install a different browser @user @user",0
"It's not even all that miraculous, the chalk dropping on his clothes and then rolling away is well within the realm of possibility.   If the chalk floated down to the floor like a feather or hovered in mid-air then we'd have something.",1
Well this is great.. #sarcasm Illinois Passes Bill That Makes It Illegal To Record The Police http,1
@user Can you come shovel my driveway? You owe me for helping you become the man you are today. #givingback,0
I keep telling my friends I'm busy they need to stop blowing me up but they just can't stop http,1
Pretty Shitty day I'm gonna be soaked and full of mud and clay #iliketogetdirty #notreally #sarcasm,1
"I'll keep this smile on my face to get myself through this bullcrap, instead of breaking down like usual.",0
Merry Christmas to all those soldiers out there that couldn't make it home! I love you all,0
@user I have the box set of The Complete Steptoe and Son. That should cheer you up,1
#instacraze #addiction at http,1
@user was completely sensationalized. Inferring that Cubs weren't serious about winning until Wednesday is a joke.,0
"@user Caffeine free coffee? Yeah, I'll have that next time I have a slice of sugar-free cheesecake... :P",1
Will put corporate racism and sexism back where it belongs: Face-to-face @user: Execs think twice http,1
", on the Same day, the 50th anniversary of the #FreeSpeechMovement, a brave critic, was abandoned by our conformist #Press.",1
"Here's an ""It's cold and I had to scrape windows so I'm sad"" selfie...gotta love living that hotel life http",1
"When someone on a conference call talks about ""housekeeping items"". Grrr.",0
My dogs like to be nice and toasty while relaxing at home #adorable #puppy #socute #icant http,0
to be an Ass but ohh Yeaa!!!! http,0
"It is the difference between me knowing that you are an idiot, and you thinking I am evil.",0
"Worse, it's a fire in the house that we both live in.",1
"#Hunger #has #vanished #from #our #affluent, even #overweight, #society – http",0
"""@user: Arizona Coyotes forge deal with BMW http But, relocation!!!",1
Flooded basements are always a fun thing to deal with,1
"They're voting for the constituents that matter, the ones that give them money.  Dollars &gt; Votes.",1
"You have to be careful not to allow unqualified to vote.  Since Florida has so much trouble with voter fraud, they should not allow anyone to vote.  That would solve the problem.  Can not be too careful.",1
"So now its Hamilton on a Monday night? Thanks @user for all those evening games you give us, saturday football is overrated!",1
Today has been a blast,0
"He's obviously making this up.  He may not realize that, though.",1
Republican = bad politicians and Democratic = good politicians?,1
@user Latest album is Free The Universe #SupersonicWithGionee #Mumbai,0
Choose your words carefully hurting someone feelings is not the right way to go.,0
@user Tamir knows Mike Brown raised his hands & was shot dead. He wanted cops to see he had a BB Gun & was still shot dead.,0
"@user yup gotta keep up with my ""frantic party lifestyle"".",1
#notcies #eu End to fish discards delayed - End to fish discards delayed Copyright EP 2013. From: Eu Reporter Vie... http,0
Why does Zayn look like a Spanish flamingo dancer,0
She did two marijuanas and look what happened. Don't #LegalizeIt. #Merica () http,1
@user @user #apologies *scoffs humble pie*,0
Hold It Bub! >> http >> #cartoon #comics #funny #jesus,0
I was happy to see McCain come out and rip him on that comparison.,0
@user my favourite day of the year !!!! http,1
"Just in case anyone was wondering, Veni Vidi Vici in Spanish is Vine Vi Vencí #studybreaks #UMDFinalsWeek",0
@user I actually think he needs to use the youngsters in this reincarnation #irony,1
Laptop speakers are too quiet for music & simply too loud for porn !#Irony,1
I'd rather you know and be upset than hide it for you to only question things later,0
I added a video to a @user playlist http Modere Beauty Box Review + Giveaway,0
Damned if you do... http #communication #truth via @user,0
@user lol .. Will let my kids know when they get up in the morning.. Thanks for the tip,0
@user please do..i need the second hand embarrassment so desperatly on my phone,1
Studying history;reading #gameofthrones #asongofice&fire,1
"""@user: Electricity generated in Kashmir can illuminate whole India: PM"" but it's only not illuminating #Kashmir",1
#All #And #For #Hot #Rachel #style #fashion Please RT: http http,0
"There's millions of autobot & troll accounts on Twitter that post dumb sh*t for RT's, then people call them stupid & naive.",1
Uhhh can't sleep someone like n I'll text u my phones dry ass fuck fr #am #a #boring#person,0
"Mmmm RT @user: !!!! @user: Faved. @user: If Southampton wins, I'll post a nude..""",0
Bored? Check out> @user newest article - each word is linked to a ridiculous website! Try it out! http,0
"If we win against Poland and Scotland, does that put us 65th in the world rankings. @user @user #Sarcasm",1
"Have you ever seen the like?? 'Republican move' that will 'effectively rob the royal family', Kate's 32k meal #irony http",1
@user I thought it funny ;p,0
There's nothing better than the feeling of being loved lol nothing,1
One of the most embarrassing losses @user Ever. #WTF,0
Thanks for the AWESOME support on our #instagram page. Much appreciated. http #women #motivation #rolemode,0
doesn't convey what I want though. #twitterproblemsforme,0
My favorite thing is waking up at 4 and driving 20 minutes in the snow just to see this bitch ass #Not #PaneraProTeam http,1
What a B.E.A.utiful day in Scotland!! :) #rain #gales lol,1
Lol my timehop guy though. http,1
"btw, dummy, 140 limits @user @user @user @user @user @user",0
Togepi do shed their www.MonsterMMORPG. com #shell. fally by #MonsterMMORPG #bagon,0
This is the weather i just love walking to work in #worst #weatherbomb,1
@user It's not work if you enjoy it #eh,1
"@user feeding your own flesh and blood/making an alley way smell terrible = same, same. #90ssarcasm #thesun #thingsthatarewrong",1
"Skanks, the lot of them.",1
glad to just find out we had a quiz due yesterday and I didn't even know thanks for the notification blackboard,1
It's brrrrrrr kinda feel & who would go to the kitchen to make coffee ...,0
"@user I know, but in the big spot (the only time I've watched him) he choked! Haha! Must mean he sucks, right?",1
@user rollins was so pissed off haha,0
@user @user but $7 at a big guy like sephora or Jcpenny is killer!,0
White people are irrelevant at this point. The black community needs to rise ABOVE y'all are in control!!!!!! #truth,1
@user haha cannot wait for monday at it's best.. cheers,1
"@user logic is an invention by the kuffar, everything makes perfect sense. () Like monkeys stoning she monkeys",1
"@user Hey, he DOES have the word ""ban"" on his home page like two or three times though. #AcknowledgementIsFirstStep",1
I would have never hired Trestman. RT @user: I would fire Trestman tonight.,0
"@user @user @user I'm trying to decide if that cover says ""lonely widower' or not.",1
"@user yup, more is definitely MORE! #fosho #merrycuteness",0
FIND SXY LOV ON YOUR MOBILE >>> http #twink #engine #goldenkrust #greensmoothiegirl,0
"I'm the guy for you Brooke Davis. #OneTreeHill this story is sad,thrilling and confusing. But I love it!",0
"Don't you just love when you say hi to someone in the hallway and they completely ignore you? Yeah, I love that too.",1
Corey Brewer looks like he is ready to not be in Minnesota anymore... You can see it all over his body language. #TradeBait,0
"Well I suppose as long as I keep my chain saw on idle and don't point it at anyone I should be able to walk around town with it and nobody should be concerned, right?",1
"We need a #Democracy #CoPocracy!!! #Police, #MorningJoe! #BlackLivesMatter #DemocracyMatters #Ferguson #EricGarner",0
@user what for ? waste of time...:),0
Dan said he's going to have a sign for me at the airport when I fly in lol #SoCute #3MoreWeeks,0
Thanks for shutting the city down..,1
@user I guess I'm the one who supposed to say that.,0
"yup, amazing how that is, isnt it? @user @user @user",0
Putin deserves it FAR more than Comrade Oblowme...,0
Painting all cops with a broad brush because of the actions of a few is the same logic racists use. #Irony,1
@user how do I give feedback on some food I've just. happy,0
"""The Papal Octopus"" would be such a cool band name.",0
Don't you just love those people who won't shut up in class then hold everyone back by asking the teacher to repeat answers? #sarcasm,1
Thank God the #Knicks re-signed Carmelo. #TheBullsCanHaveHim,1
: Entertaining journalists collecting facts about annoying dentists. #Entertaining=#Annoying #FactAboutDentist,1
@user No reasons given. Some waited expecting a call but only found they were not chosen from media announcement,0
"@user @user sure! ""wow, Nintendo has achieved what Sony already did years ago""",1
"@user @user hahaha good 1, you might own a stadium then rather than the local council ;)",0
"If you remove the ""christian"" qualifier, you can see what a self-evident statement that is.  Progressives are consistently at the forefront of social justice?  YOU DON'T SAY!  [How come this headline gets to be President of Tautology Club?? ](http://xkcd. com/703/) Huh?  ;]",1
"The NSA can spy on the *future*!?   Okay, this *is* getting scary.",1
"When do we start using the word ""Treason"" when it comes to these people?",0
#Fears #for #female #Saudi #activist as #detention for #driving a #car is #extended http via @user,0
"Wow thanks for the good vibes right before my exam, parents.",1
Do you like quality #dancemusic? Go to http for some great FREE downloads #UK #NightClub> @user,0
Hahaha! @user enjoying the #selfiestick I got her for Christmas! http,0
Sick on Christmas YAYYYY #not,1
...except we have no hot water. Naturally no one would be in the office to take my call. I fucking hate it here.,0
What an amazing start to the weekend! #ohgoditsfridayagain,1
today is just starting out fabulous,1
@user What do you know about #iubb? Tom Crean is a coaching genius !,1
"@user @user good old JK landing people in trouble again, ffs William i thought you were more savvy than that",1
@user what is your argument? 1/$12.5 for Butler > 2/$17 for Morales?,0
Just entered the @user competition for tickets to the final! Fingers crossed @user,0
"@user Would be also great if David teamed up with his old man again at the Carols, similar to a few years back.#Greatdou in both cases",0
Listened to Gimme Shelter while driving in the rain,1
I am so ready for Monday. #sarcasm,1
"@user It took 4-5 hours but in the end, Morosi was right and Nightengale's sources were wrong.",0
Thank you; it wasn't working for me.,0
"@user Those ""waves"" are epic! He he",1
It's a comforting thought:every tax payer will b reminded of #OCARE being rammed in2 law when answering questions on 2014 tax forms,1
Such . You still have to #praisehim ;),1
"Family time is nice and all, but I'm ready to be back at work on this fine morning.",1
Today should be fun,1
"we need to stop using the words ""racist"" & ""racism"" @user @user @user @user @user @user",0
@user Gotta love those racially based awards! #not,1
Should've made a joke about sending her off to Pakistan or being honor killed for embracing western values.,1
Stuck in the traffic at 7.55am. Yuppy -.- #happytuesday,1
@user #pantsdowntiggy was his crime. Pixelation #moot or #irony,0
@user @user @user #WatchOutForThis Hold the line,0
"@user @user The link says ""The requested page could not be found."" Was the intentional?",0
"@user Advertising an online special with an expiry countdown, yet you cant order anything or check your postcodes validity.",1
So excited for work,1
watching Elf was a prime decision tonight,0
"If the government is shut down for a week, it should automatically trigger dissolution of congress, an emergency election and a CR for the time between dissolution and the new election.",0
@user excited for 2015 its gonna be a good year for music ur gonna smash it #Ed,0
Sorry this doesn't make any sense why make it even more tough? That's going to produce more players.. http,1
"Whatever happened to the Guano Apes? Did they ever make it ""Big in Japan""?",1
Looking forward to mine and the boyfriends 2nd Christmas together!!,0
Oh how I love working in Baltimore #not,1
So there used to be a crossfit place here... #irony #pizzawins http,1
Favorite @user if you love Romance Novels. http #Love #Drama #Romance,0
Also it's amazing how a shower and Taco Bell can make you feel like a new person. @user,0
#Heisenberg Uncertainty Principle: Whatever you study you also change. #JurassicParkTheLostWorld #JurassicWorld #BreakingBad,0
The fans needs to be heard tho RT @user: @user @user WENGER WILL NEVER QUITT.SORRY LADS. FOR FEW YEARS..,0
@user I don't recall dalai lama talking about busty girls and celebs but apart from that...,1
@user yeah not to bad been asleep most of it my backs been playing up so been on strong painkillers that knock me out,0
"Found my motivation... Aka the back of my eye lids, by accident. Boy, me and @user are some winners. #not #senioritisisreal #losers",1
Cheap and expensive http,1
Since when did train fare get so expensive?? Jesus! Might aswell of drove... Shame I'm drinking,1
"Tomorrow's afternoon #NFL sked in #PanamaCity area: WECP 12p #KCvsPIT, 3:25p #INDvsDAL; WPGX 12p #ATLvsNO.",0
"I often worry that wealth doesn't have enough influence in society, so pleased to see this being addressed http",1
Filmmaker and writer Nicole Franklin is on Twitter @user. Pls follow. #EConvo #Film #Director,0
#elf #why not moving http,0
"oh yeah, that was funny as hell too, @user @user @user @user @user @user @user",0
"""I'm going to Finnish all my homework and get caught up on everything over the break"" http",1
"I believe nothing the Obama regime tells me, I believe a lot of what the Iranian one does.  [**Iran threatens widespread retaliation against US and allies**](http://dailycaller. com/2013/09/10/iran-threatens-widespread-retaliation-against-u-s-and-allies/#ixzz2lo2bVVso)",1
Haha who the fuck says that to someone#TrueGentlemen,1
"What a steaming pile of horseshit.   I guess democrats have all the answers to all the world's problems and republicans have nothing good to say whatsoever.   We can just dismiss them all.    This kind of thinking is what's wrong with partisan politics, and as a matter of fact it's what's wrong with most religious thinking as well.   ""We have all the answers and we're not going to talk you because you're wrong. ""  It's so childish.",1
.@user Alert the media! Some guy on twitter has un-cited proof that evolution is wrong! Let's get his Nobel prize ready!,1
"the ""2/3=75%"" is also in the top 10 LOL @user @user @user @user",0
That's comfortably the most stonewall penalty I've ever seen.. What are these refs on? #hadone #Stoke,0
@user - absolutely love this song! #CantStopSinging http,0
Love it when your typing at work and a spider comes out from the keyboard and hangs out between your fingers...,1
"Agree with that... #we #are #not #mind #readers #haha #Repost 9gag ⁰You may think we are, but we are... http",0
@user Oh funny. I saw that crowd! We were just there for dinner.,0
"You'd hope that a film like that would lose relevance after a couple decades, but nope.",0
Oh this will end well. RT @user: Military-Style Tech Finds Way Into School District Safety Measures http,1
Why are GMOs considered so bad?,0
I love how I'm completely wide awake,1
@user There will be no next employer in NFL for Trestman. He was a disgraceful hire and never stood a chance.,0
@user is it squirt or squat?,0
"Secret Santa for one of my er...""hotter"" work colleagues.. http",1
Farting like the world is ending,0
"@user so if they undo the affordable care act, and I should expect my insurance to decline 33%? #Not #Gonna #Happen",0
Thank you Aidyn and Adele for getting me sick.,1
Foxy Lady..#waynesworld #excellent,1
"We were miles apart,but you found me, now we are close enough, still apart #irony",1
Lunch today. #fakelobster #lifestyleoftherichandfamous #worldofswede http,1
"""The two constables -- Veer Pal Singh Yadav and Avnish Yadav - did not have any criminal record."" - NDTV",1
Oversleeping is the bestttt.,1
"The worst is when they consider things like ""conservative tribune"" as a credible source of information. Totally not bias.",1
@user happy to be of some small service ;) @user @user,0
Seriously has the #BBL04 got the tallest on ground interviewers of all time #talltowers #sevenfoot,0
This is what we called OTAK LETAK KAT LUTUT. #melayu http,0
"It's okay, you know playing loud music during quiet hours is perfectly fine.. #somepplhavetostudy",1
"No need to act like I'm the fav child, I know this already.",1
"2AM on Christmas Day, and we're heating up Pizza and Breadsticks. #theboysarebackintown http",0
wow what great banter from @user,1
I'm surprised they  discussed it in a positive light.,0
What exactly is your interpretation of Stand Your Ground?,0
"@user @user Wow. Catch up with the news. ""False intelligence"" found to be not false. See Wikileaks and other sources.",0
2 and half hour walk #Proud,0
@user Wow! I can now afford that holiday I've always wanted!,1
"I have a small jacket on , with a big coat for later , I'm back at the train stn going back into town , work Xmas do #joy",1
About as relevant as Michael Sam and Jason Collins. RT @user: Major League Baseball umpire Dale Scott comes out as gay.,0
Heading to my nanas place its going to be so fun,1
#Canned #Food #Lot #Of #Space #InteriorDecor Please RT: http http,0
@user @user Even better let's see if Wadi Camacho man's up and fights @user,0
"Lovely first day of 2015; friends, family swim, sort & cleanse, curry, less time on social media, more time on others #startasyoumeantogoon",0
What a difference 4 years makes #bestfriends #changed #one #bit @user http,0
@user @user @user @user Ha ha! Christmas cat looks well impressed,1
@user but in term time my son...,0
"@user Oh, BELIEVE me. I agree totally. My tweet was pure #sarcasm. We need MORE #guns, not less. Santa is bringing me one. #2A",1
Lesson learnt? Herd of sheep who fought over TVs on #BlackFriday struggling to sell them http #irony #capitalism,1
Just got the message I need to start working at another location. Brilliant! now rushing towards second location. Oh god I hate Mondays,1
"@user @user hitting the big issues, champ.",1
"""@user: So happy I got an offer from Trinity Laban, I'd take Greenwich over Leeds any day"" leeds is where it's at",1
Absolutely love being harassed by a group of twatty adolescents on a late night shop,1
Because a field trip two days before finals is exactly what I need #not,1
A burned tongue is a lovely way to start the day #sarcasm #ouch,1
"@user @user accordng 2 lawyrs, evidence supported both sides, could hav supportd many differnt scenarios, warranting indictment",0
@user @user The kindness of strangers!,0
