text,label
@user I saw a leaf blowing in the breeze. You could yell at that if you wanted to?,0
@user @user Well it's not any worse or better than 'Stark Raving',0
#Ministers #criticised #over #train #deals http,0
@user HOW DARE YOU HAVE FUN AS CHRISTIANS! WE ARE SUPPOSED TO BE BORING AND HAVE ZERO FUN! HORRIBLE CHRISTIANS! LOL #MISFIT,1
@user The person who wrote that is clearly a bit of a tit,1
it's International Human Rights Day #irony,1
"not that I have a problem with the message, but al sharpton isn't the sort of person I want fighting my fights",0
Christmas shopping on 2hrs sleep is going to be fun!!!!!,1
Porygon2 #are found in the www.monstermmorpg. com #wild. bulbiest follow @user #working,0
I don't think you guys are on-board with how important it is to get every bit of carbon out of the ground and into the atmosphere.,1
Enabling the Windows Firewall is a perfectly reasonable thing to do to package in a software installer. #SCCMAdmininHealthcare,1
@user > matters we may exert or influence a change. But friendships aren't progressed this way. Some natural affinity is needed.,0
Don't you love when guys try to give you their number? Keyword TRIED. #backupoff,1
I know who I am. I am not perfect. I'm not the most beautiful woman in the world. But I'm one of them. #women #not #perfet -Mary J. Blige,0
""" ""@user: Penguins cancel morning skate, which was an optional, due to icy road conditions.""",1
Painting all cops with a broad brush because of the actions of a few is the same logic racists use. #Irony,1
@user I'll bring it to work. The hoops one is a hit http,0
History check anyone know what this is? http,0
@user #spinless#gutless acceptable,0
I love that my body can't handle school stress and makes me physically sick.,1
"@user I infer that you are besmirching coffee, but that can't be right",0
Just found the picture of lisazamorano trying to kill me #bff at our #seniorbrunch @ Moutain Meadows http,0
much!!,0
"@user @user I thought it was, what I call, the wet look lol",0
@user where's me boots happy,0
Body Language for Confidence - the easiest thing you can do to make a difference: http via> @user,0
@user @user #goodgrief he may already have gone a little too far with those eyebrows!,0
@user i don't like yellow but most of my things are yellow. hi kapitana!!! Nagaaral kmi ni @user ASDFGHJKL HUHUHU,1
"Well, his ""liberal eugenics"" argument just firmly placed him in the same category as the tea party as he makes up shit that sounds scary and appeals to the uninformed.",0
Making the most out of my last vacation day. #not #tvandsleep,1
The Republicans can go fuck themselves.,0
"@user @user we've grinded for our gear and now they're worthless, thank you",1
@user @user Khan is doing to Brook what Mayweather is doing to Khan. Making poor excuses to avoid the big fight,1
What an eventful weekend,1
@user BREAKING: #realjournalist bullying major problem in nation's high schools.,0
"Tell that to the executive branch, who have violated established law by continually making alterations and exempting people from it.",0
"Well, back to Firefox then!",0
"Day 9 ""something your reading"" #decemberchallenge #lovehistory#lovenonfiction.. @ Our Cosy House http",0
Extending trade and not telling the people about the extended trade. Best idea ever!,1
@user @user Junior got a rim shot for a 'rim job' joke.,1
Down or Not is down right now. That's for ya http,1
You should do a post on your past experiences on navigating without health insurance and then your experiences on the ACA process you've so far encountered.,0
Most important thing I've learned in school http,0
Uh-oh. Better head for the hills. #storm #clouds #seekshelter http,0
It's hard to take people seriously who can't spell and think grammar is a type of cracker.,0
The only people offended by the Redskins are white liberals and Obama.,0
Pediatric Grand Rounds on statin therapy and the dyslipidemia of obesity. Breakfast on offer is 2 grand platters of donuts.,1
I'm not staring at your boobs hun..I'm looking at your heart #relax,0
Love people that don't act like adults.,1
"""the environment"" ...  another strawman",1
@user Asalamoalekum... kesay mizaj ? Thank you so much. It was posted on 2nd December 2013. Already there.,0
LIBERAL/#LEFTISTS USE #RACIST/SEXIST #LABEL FOR #DISLIKES MSNBC host Ed Schultz said RACIST #NOT to SUPPORT demand for #MINIMUM WAGE #SAD,0
@user I get paid 4 posting stuff like this on TSU! YOU CAN TOO! go to http #FOLLOWBACK,0
Such quality customer service today by @user for the Xbox One #thisiscrap #nothelpfulatall,1
"Salt n Peppa's Geico commercial is literally the best, ever. Only one that beats it is Hump Day.",0
"Ã¯""?#Depression and #Abuse are sadly a part of many people's testimonies My Monster of a secret: http #DamonLeroi",0
So glad i work mornings now,1
"@user If #BJP joins with PDP, then CM will be of PDP. Only way to have a #HINDU #CM is to take support of Abdullah family",1
"Don't think for a second I'm out to drown your memory, you ain't worth the whiskey",0
Getting ready to ship surplus ink cartridges out to Nunavut communities- yup that's a great use of time/resources! #sofulfilled,1
#Analysis -- #Economic #issues #whip #up #Israelis #in #chocolate #pudding #election. http via @user,0
@user are actually going to contact me rather than just apologising via Twitter?,0
When I'm lacking inspiration I resort to scribbling angry/pretty things. Great start to the week! #sarcasm http,1
Twitter Keeps Insisting I Follow Someone Who I Rather . .,0
I think about Disney World just about every day. #missit #myhappyplace,0
@user MK1 Shadow Shift was so much fun. @user,1
"I can't stop laughing at this. The fact that they specialize in ""Viral Marketing"" is especially amusing. ... http",1
So kind of occ health to book my tb skin test on my day off uni. I am thrilled,1
#BBC #News -- #Thailand #crown #prince's #wife #resigns #from #royalty. http,0
Listen to Paranard #my mix by polosweets #np on #SoundCloud http,0
Looking forward to doing my 4 page essay tonight seems like fun,1
@user @user journalism at its best,1
"The last day of the year and I will be tweeting on my major highpoints of the year ...good, bad and ugly",0
Why am I wide awake right now..,0
I'm not calling him progressive until he at least openly discusses the Vatican's policy of covering up charges of child molestation.,0
"@user @user ""I can't look at a bridge without crying now.""",0
And then there was none. Goodbye beard (of sorts) #MensFashion http,1
"@user Great,& not sure if i've seen that actual pic! #not just for girls : D",0
Putin deserves it FAR more than Comrade Oblowme...,0
And that's a wrap for 2014 shows kiddies. Ending in the Berkshires. #BoseL1Model2.,0
@user @user Actually Israel's demand renders it antisemitic acc to your mate's favourite non definition of antisem.,1
I didn't know the story of Noah had transformers in it. Man the modern biblical tale killsssss it. #whatarethelivingrockpeoplefor,1
"If it's NOT? then it IS! Hand Crafted Artistically Fashionable, Connect @user for #fashionblog #thoughts http",0
@user It's ok...thanks for telling me. Passed the idea on to a sydney friend :),0
Love waking up early in the morning #HockeyTournament #RefLife #Zebras,1
@user I just texted you. Now I'm going to sleep-not ignoring,0
final labs coursework submitted!! now to treat myself by catching up with the whole semester's lectures #winning #not,1
Love being called into work on my morning off after not even 6 hours of sleep. #thanks #splitshift,1
I see the #irony of MY LAST 3 TWEETS COMBINED was lost entirely on a certain someone... Faith in humanity: -3% :(,0
@user Niagra Falls tho... Really? #irony #LOL,1
All the more reason to cut billions from food stamps.  Darned freeloading starving seniors.,1
.@user @user oh look an Audi driver breaking the law...how strange,1
"If the goal of economic policy since 1980 was to consolidate as much of the currency from the pockets of many into that of the few, job well fuckin done.",1
"There's millions of autobot & troll accounts on Twitter that post dumb sh*t for RT's, then people call them stupid & naive.",1
"Nothing like waking up to 50+ financial formulas! Yay, for corporate finance comprehensive finals! #finalsweek",1
"http Because, progress... #AnEyeForAnEye , #PeshawarAttack #Taliban... Surely this will bring peace and justice?",1
"@user yup gotta keep up with my ""frantic party lifestyle"".",1
I think this sample size is shit.,0
@user @user more people are in prison because of drug related crimes. But you know gun crime is up #sarcasm,1
"People complain about my backround pic and all I feel is like ""hey don't blame me, Albert E might have spoken those words"" #sarcasm #life",1
@user @user but $7 at a big guy like sephora or Jcpenny is killer!,0
That 2-hour sleep put me into hyper mode,1
"@user Unfortunately not, hey. Daddy didn't think his daughter'd be into gaming or FIFA. youraveragedaddysgirl",0
Falling asleep to the sound of rain is so relaxing,0
Company profile FORGET ME NOT PET CEMETERY - http #FORGET #ME #NOT #PET #CEMETERY,0
"@user @user Paul believes Rubby, Webster, Kelly, etc. are bad players based on '15 projections. I believe in their upside.",0
MB forgot to move the elf on shelf and now 10 is asking me if Christmas is real. @user,0
@user I have the box set of The Complete Steptoe and Son. That should cheer you up,1
"ROFLMAO yeah, OOPS is right @user @user @user @user",0
So far today is going AWESOME. #fuckoff,1
HEY LOOK THERE!,0
really not sure I want to be in this place today #SoMuchBadNegativity #SmileYouFuckTards stop dragging my day down !!!,0
Incredible. RT @user: The Red Sox have an agreement with Justin Masterson.,0
"It's being 200 yrs since the west had their industrial revolution but in 21st cent Ghana, an industrial de-revolution is happening.",1
Trying to eat crackers on the quiet floor likeee.. Maybe if I chew slower no one will notice..#not,1
"Well, weekend is over! Now it's #TwitterTime again :D Have a nice monday!",1
@user Doubt I was the first to block you. But you pretend good. @user @user @user @user @user,1
As a little girl I would dream of shouting instructions repeatedly and being completely ignored. #motherhood,1
@user ugh... painful for sure. can't win em all I spose... but you shouldn't ever look like that.,0
#page#found#404 http,0
"@user @user @user @user it was an In progress list of ""MN of the year""",0
i can't believe all the shits for the past days are finally over!,0
"@user I'm relaxed, and waiting for the facts to come out. But I've listened to Blaine hammer on players for doing similar before.",0
"@user @user of course, Not!",0
@user will tweet you when I've got it back up and running.,0
I mean if Obama can win one...,1
Nothing is better then an 8am class.,1
"Few #relations are by #chance, few are by #choice and few are by #Facebook!! #irony",1
You decide to go on vacation without me sleep? Reaaaal nice. #considerate #not,1
Happy Birthday to me! #imgettinold #not #ionlygetbetter ROLL TIDE! http,1
"I was hoping it was Renee Elmer's, myself.",0
ÃƒÂ¢Ã‹Å“Ã… Find out about some of our Hip Hop mixtape promotion packages http,0
I'm not really sure how I'm still alive and writing this paper right. Napping instead of sleeping on the weekends isn't cutting it #finals,0
@user oh mature girls,1
@user There's a surprise.,1
@user How do you score on someone?,0
@user kabhi I'm messier than usual messy wesay I need chai & I'm resting for last 2 days. May be this is the reason.,0
"I'm a college professor.  Incorrect attribution isn't what happened here.   He plagiarized.    I'd report him to the university, and he'd either get expelled or at least put on academic probation.",1
"@user gee, that's SO hard to believe.",1
Thank you OCC for being concerned enough about my safety driving to school to cancel classes...,1
RTed that because yeah that totally makes sense,1
"@user ha yeah which is your opinion, which like mine, means nothing ;) they're in.",0
"Cheney will live forever, because only the good die young.",1
Catching up on the RHOA!!!!#love the drama,0
Oregon marching band playing @user music. #awesome #OregonDucks #OregonvsFloridaState #RoseBowl2015,0
Love working and be exhausted all the time,1
@user Way to lay out yesterday and put it all on the line #GoodLeader #Sarcasm,1
"@user, You ARE pretty so I better play your ""free"" #SkinnerBox game. I'm sure it won't ask for my money after a few levels.",1
Have you gotten your tree yet? Xmas tree nail wraps available at http #nailwraps #nailart ... http,0
Lazying about in a hoody #WinterTimes,0
Can't believe it's been nearly 11months since my mum passed away miss her so much more and more everyday,0
"I think my friend just sent @user a snapchat of me drinkin water, cuz she's fun like that #sarcasm #rehydratewhenyadehydrate #brat",1
http What Day is the Sabbath? #follow #Jesus #Christ #FBC #FBCJAX http,0
http so Ugly *Size SMALL* Christmas Sweater Cardi Basic Editions Holiday Vintage http,0
#Lance #Stephenson #not #traveling #with #team #on two-game #road #trip: Stephenson is still unable to run fully... http,0
Being ignored is still in my top ten things I love. #sarcasmtweet,1
"Get on the work bus, driver turns his music on and the first song on is 'another day in paradise' #irony",1
My current Christmas song obsession. Played it non-stop all weekend http via @user,1
Just flossed and then ate right after #inconvenient,1
...A teen named Bud Weisser was arrested by cops for breaking into a St. Louis party store...http,1
Love it when my mans on a cleaning spree.. Saves me doing it,0
@user the resemblance is uncanny! #firefly @user http,1
then that means it HAS to be square to him @user @user @user @user @user,0
The most exciting way to start a Friday: a presentation on structurally deficient bridges. #sarcasm #lobbyinglife,1
@user @user sorry I forgot LMAO,0
My christmas gift... i have sweetest friends :) #blessed http,1
@user Frisky at 2am? That's nothing new.,0
@user but it wasn't as bad as that picture seemed to indicate. You're still a very horrible person.,1
Loving life.,1
Yeah this is so cool just fucking woke up,1
We still got alot of moonlight left,0
Gotta go back to work tonight,0
Sweet United Nations video. Just in time for Christmas. #imagine #NoReligion http,1
"May be cold tomorrow, December 28, 2014! A low of -7â„ƒ - dress warm!",0
@user try Naheed akhtar & nayyara noor too. gOLD stash.,0
@user: Your opinions don't affect me. I'm going to keep living my life.,0
"I probably wont see you until after new years, so thats Christmas and new years, plural, im trying to say happy holidays to cover both.  Sorry for starting a war on Christ",1
@user @user Can we bring back Youkilis? Remember when 30 year old Youk charged mound & 19 year old Porcello dropped him? #RedSox,0
Why do I have to have a good game then a bad game and then a good game then a bad game again.,0
Tomorrow is the day I'm coming back to Florida for good ... :( unless something changes in the next 24hrs which I doubt #ready,0
50 mph winds make a great hair fan for a photo shoot.,1
"studying up on narcissism. the more I read up, the more I'm afraid I have this disorder!! #centeroftheuniverse",1
@user so I gave up and am now heading for bed orz,0
Security Engineers are not Security Guards. : #Hackers #security,1
I'm so different when I'm back home... I blame the work crew #rowdy #banter #toomuchlove #360family,1
"Apparently my youth group thinks ""Are you kidding me?"" is my default expression--or ""nomal face."" #areyoukiddingme http",0
There was a shooting in my old neighborhood where my family lives. Praying everyone is okay and stays safe,0
So fucking excited to be the 5th wheel for another New Year's Eve!!!! Can't blame anybody but myself for being super picky re: men,1
@user not always. They've found them in $500k homes,0
I love it when people try to tell me that Oakland is so much easier than other schools #not,1
I didn't know it's your territory I really. .. WHAT ARE YOU DOIN- no. . Please don't shoot at me I. .,0
"Wings? I don't have wings! ""Of course not... You're a boy!""",0
@user @user the upper deck definitely seemed like Philly South.,0
@user Damn. That would have made excellent thing to recount in autobiography ;p,0
#yes they're all are our brothers/sisters when you speak that way you are Our Father In Heaven child either,0
So Jeremy Irons and Alan Rickman are BOTH in Marrakech just one week before I'm going there #everythingisfine #not #sonot,1
Some #tblightning action along the boards at @user in #Tampa #fuji #x30 #boltssocial #bethethunder http,0
"Poor people need food, not Paul Ryan.",0
Does it restore much needed snap benefits?,0
"Wishing everyone a Happy, Healthy, and Prosperous New Year!!!",0
Can almost smell the turkey #hungry,0
Yay for early morning protestors! #heavyamountsofsarcasm,1
Ouch that hurt,1
@user Just put it in first gear and they will move. Liberals won't ever give their life for a cause. They will just destroy yours.,0
How dare Charles Barkley have an intelligent conversation about race. #sarcasm #CharlesBarkley,1
"I have an idea, how about 911 operators don't ever describe race? And police have to wear color blind glasses?",1
@user @user 3 more nights 3 more nights #londoncalling http,0
Good thing he was born in Canada.,1
@user yeah stressed isnt the word could easily punch someone in the face right now,0
Beautiful way to start my morning.,1
@user I dont know what it is but I'm in love your products Christmas heaven! #love #skincare #beauty . http,0
Hi @user not a single vote was polled in 3 polling stations of Kulgam #Kashmir & im tuned into @user :p thnx #KashmirBoycotts,1
SEC crew doing some quality officiating in the penn state game. . How do you miss that terrible block in the back?,1
@user: COD AW SERVERS #OFFLINE,0
"i may have played a part, but i wont take sole credit ;) @user @user",0
Its gonna be a loooong day.. but yolo lets have fun,1
"@user Oh no, I've tipped Gamergates hand. Now you know our end game!",1
"LOL and now you cant see when blocked, best thing you can do is install a different browser @user @user",0
Wow I feel great,1
#MY #Husband is your concern #StopTxtnHim its #NotOk #youknowwhoyouare!!!,0
@user your tongue in cheek @user weigh in does nothing but instigate breed specific hate. Stick to reporting on tuques. #yyj,0
Welsh devolution? How's this for starters... http,0
The winner goes to this stocking! They bribed me. ;) http,0
@user I was only clarifying for my LEGION of other followers. #NotForTheIntellectuals #DrHandsomeDennis,1
"Like @user? Visit http for articles and also win a free puppy!! 1 puppy per visit, 6 puppy maximum #ATL",0
"I prefer it!  I'm a Texan and a while back I had a HORRIBLE kidney stone but I didn't know what it was because I had never had one before, I went to the ER in EXCRUCIATING pain and they treated me wonderfully!  I got three, count 'em baby three, shots of morphine through an IV, that is an experience I have never had before but enjoyed and would recommend!  Then I left with a handful of prescriptions after a CT scan (is that right?  Some kind of scan! ) and went home and was high as a kite for a few days and then it passed and we were all good again.  Woo!  So then the bill comes and it's $8000!  So at first I was all like ""woah, shit"" so I called and complained because while in the ER I had specifically ask, repeatedly, how much the scan would cost and had repeatedly had my question refused to be answered by the doctors, nurses, radiologists (or whatever they're called) and even the lady who came in to get my personal info and ask me for a credit card to pay ""as much as I could afford right now"" (I authorized 50$ because she wouldn't explain to me what exactly it was I was paying for ""right now"" and I finally decided they just wanted a card on file).  Sooo when the bill comes the scan ALONE was 6000 bucks, just the scan, the entire rest of my treatment was only 2000 which I would probably have paid gladly after the wonderful care I got (and I knew I was uninsured going into this and I knew ERs are expensive and at the time I was in HORRIBLE pain and scared shitless by it so I didn't care).  I made my choices and would live with them but 6 grand for JUST THE SCAN?  That seemed unreasonable to me and I also found out later that scans like that aren't necessary for kidney stones and often aren't done unless you're peeing blood, so wtf?  So this is where the fun starts, I called to complain about this scan cost, I was quite clear that I would pay a reasonable about for my care and was happy with my care but I couldn't afford 8000 total and that 6k for the scan was nuts, so they ask me to fill out some paperwork to see if I qualified for ""financial relief"" from my bill.  I explained again that I didn't want charity, I just wanted a reasonable bill (and BTW, 2000 for the three shots of morhpine and the 10 minutes the doctor spent with me seems a little out of whack too, 800 of that is called an ""ER fee"" and is apparently a charge you get just for walking into the ER regardless of what happens next, but hey they took good care of me and I don't know what the fuck morphine costs).  Anyway the only option I had was to file for the charitable relief, well ya see I am currently a ""stay at home uncle"" my brother abandoned his two kids with our mom, she can't afford day care (you would not fucking believe how expensive day care is) and since I made less money than she does, I become the stay at home parent.  We all live together now, she pays the bills and I take care of the kids.  It was weird at first but it's actually kinda rewarding and fun now (most of the time).  So technically I'm single with no income and have been for about a year and a half now and my tax returns reflect that.  Actually do have some income for contract IT work with people who knew me before I quit, it's all under the table though.  Soooo I got FULL relief.  I actually have some money and my mother actually makes ""ok"" money and we were willing to pay a reasonable amount for the bill (my hope was to reduce it by half to 4k and pay it out over time, lower is better of course but I had braced myself to accept 4 grand if I could negotiate hard enough to get there).  Instead I paid 0$.  And I learned a valuable lesson, if it looks like you have no money you can go to the ER for freeeeee!  Wee!  So suck it tax payers I ripped you off for 8000 bucks and I have three pain pills left over for a rainy day!  Now stupid Obamacare is going to make me pay for my own insurance :( boooo That's going to be like 70$ a month.  EVERY month!  You even have to pay in December!  Come on government, it's baby Jesus birthday, fucking dicks.",1
I am so happy that Thad (the Lead Multiplayer Designer for Hardline) followed me XD,0
So that went well,1
"""@user: Things to complain about on Christmas day. ""I have a pimple in my ear"" @user #ThanksObama"" #LegitReasonToComplain",1
Well today has just started off great.,1
Drinking a Southern Triangle IPA by @user at @user -- http,0
#Cuba #sees #long #struggle #ahead #before #U.S. #lifts #embargo. http via @user,0
"#RedSox RT @user: Meanwhile, in Caguas, Rusney Castillo goes 4-5 with mammoth HR. man, Alex Cora loves this guy",0
*looks at blackboard* *calls life alert* Help my grades have fallen and they can't get up,0
@user Home page at 8:30am shows Dow -51.44 but it's +102.75. Can you make your home page stats more real-time pls? http,0
"Just in case anyone was wondering, Veni Vidi Vici in Spanish is Vine Vi VencÃ­ #studybreaks #UMDFinalsWeek",0
@user @user I don't think I've ever seen Love Actually all the way through. I tried once last year. I don't remember it.,0
...except we have no hot water. Naturally no one would be in the office to take my call. I fucking hate it here.,0
IS IT FRIDAY? *heavy sigh* Nooo. It Is totally Wednesday~! What a MESS. Wait 2 more days.,0
@user there wasn't room for #LoveYouBro,0
@user - Russell Brand discussed today how much his London mansion is worth..and Marx was married to a baroness #scum #weak,1
Visit #Tripplebeam #Music #Promotions @ http #Michigan http,0
"Myself and @user having to walk to Civic Offices to get bus muttering to ourselves""wouldn't you think they'd pay their water""",1
#np #NowPlaying #NowListening #Music Of Dying On Your Birthday by #Senses Fail from the #album: #Let It E... http,0
wow they seem to be so turnt,1
My fingers smell like lavashak :),0
Patrick Kielty hosting Radio 2's Comedy Awards...,1
Me: So yall forced me to call in to keep my price the same? BH: *silence* Me: *where is google fiber* #ilovebrighthouse,1
The downside to working in fisheries and conservation is that you can rarely afford the cool things that promote your job,1
I doubt this week could get any better.,1
"""Its so hard to choose between the pleasure and the pain "" #Girl #December #Love #Dream #Strong http",0
"the best comment is the out of place ""9/11was an inside job""",0
@user illridewithyou,1
Thank you Aidyn and Adele for getting me sick.,1
Hafeez's slider is TOO much of a mess. Bowling it from 'back-of-the-palm' & that too at ~90kph require EXTENSION http,0
"This person has an interesting view of what ""traditional"" means.",0
I don't know what's worse...the fact that McDonald's is open on Christmas Day or that people are actually in there eating it right,0
"@user why yes, because being some man's property is such a privilege @user #ironagethinking",1
Been at the ER now since 10... #yay #not,1
At least I don't have to clean the floor,0
@user but you can't expect us to hire one in only 3 weeks. Who moves that quickly on a coaching search? #sarcasm,0
Finished the year strong with a good bike workout! Missed a lot this year resting my shoulder--hoping for better in 2015. Happy new year.,0
So they waste billions a year that cannot be accounted for **and** penny pinch by pirating software?,0
