text,label
"Sounds good to me, won't happen.",0
Si Ms. Educ hehehe clear my ignorance,0
"What a steaming pile of horseshit.   I guess democrats have all the answers to all the world's problems and republicans have nothing good to say whatsoever.   We can just dismiss them all.    This kind of thinking is what's wrong with partisan politics, and as a matter of fact it's what's wrong with most religious thinking as well.   ""We have all the answers and we're not going to talk you because you're wrong. ""  It's so childish.",1
Decemberbessen #not #fail #footprint sorry... http,1
"""@user: @user great seing u mate, thanks for the cheap shot safe trip back "" Dry train why we lost",1
"@user add some ""Your Baby Can Read"" DVDs...ya know...just in case lol",0
"The UofL student ticket policy is such a well thought out plan, good job SGA. #ihateyou",1
"Even though their support is at an all time low, their press coverage, and funding, will not be.",0
http #TeenAnalCasting #Top Top 50 Christian Songs For 2012,0
Gotta love the sound of rain beating against the window on Christmas Day.. #whereswinter,1
@user do you not work at the dirty bird no more?,0
"Awake this early on my only day off before christmas...feeling ill banging head, bunged up, shivering... Just what I need!!!!",1
"This is what looks like, right? http",0
One more all nighter and the semester is done,0
Westbrook 16 points on 42 shots ok ok I see you working,1
"Considering President Obama's first term began in the throes of the Great Recession and recovery stimulus was compromised down to be less effective, it should have been clear to all from this beginning what the conservative goals were, and what they were willing to do to achieve them.",0
".@user, Michael Bloomberg will be wearing his speedo for the #GlobalWarming with his bodyguards. @user",1
I just LOVEEEE finals soooo much . And not getting any sleep is the best part about them,1
I'm ready for @user's first headlining tour of North America! Tickets/info at http #lunatic2015,0
One of the most embarrassing losses @user Ever. #WTF,0
"OP, you should post this to /r/militaryatheists",0
The Chicago Firehouse Restaurant caught fire this morning. http,1
Why isn't there a playoff legend Romo? @user,1
"The Rondo, Ellis, Parsons, Dirk, Chandler starting line up would be one of my favorites in league. Mavs should go all out for Rondo.",0
Makes perfect sense to get mad about something that happen 4+ years ago.,1
".@user is the first to cut to ads during primetime to proudly announce that they're ""putting journalism first"". #Irony #NLprimetime",1
"@user at $8.25 per day those are definitely not Costco socks! I must say this "" funky sock"" movement is kinda cool.",0
"Obama, the Presidential train wreck.",0
@user @user @user You're arguments are obviously very impacted by the fact this family were TSI in appearance.,0
"Check out> @user¢â""¬Â¦music that makes you feel something. #London #UK",0
"@user So when Tory stood up and thanked Ford for his service to the city, I wanted to barf.",0
@user yup it must be good to be ivy league Educated because it does alot of good,1
7 am. Pilates Now I get to go home and get ready for work! AMAZING!,1
I may need to reread the books but did we ever find out what Draco's Boggart was? @user #HarryPotter #dracomalfoy,0
@user thanks for leaving the dish for us #badbusiness,1
I wonder what Rob Portman would say about that...,0
I've honestly never even watched A Christmas Story. I've only seen random parts.,0
@user You seriously bought a giant TV to play in the box?,0
#politics is not my cup of tea says #sonakshi @user of #lingaa fame . #sonakshi dad #shatru is our top #bjp leader,1
trivia crack is taking over my life.,0
Andrew Luck is some kind of QB... Wowzers. #INDvsCLE,0
Couldn't agree more! RT @user: Nothing makes me feel more special than receiving an automated DM.,1
@user absolutely shocking that the lamestream media hasn't picked up on this #mediabias @user @user,0
It's so easy to focus on what's at hand when you have a million other thoughts running through your mind at the same time.,1
@user: It's really difficult not to bark back at my pms-ing daughter. When bae tweets about you <,0
So how is to any different than the Regan and Nixon masks worn for decades?,0
"I don't understand why anyone watches these bowl games. They don't matter. Great, a team outside the top 4 dominated. #dontcare",0
Nobody can deny this. #career #gita such a #profound word. http,0
We cram 5 minutes before an exam and get a tag of qualified person.,1
@user Saturday at 11:00? Damn...there goes my secret news paraphernalia... telling,0
You're great at keeping a conversation. .,1
"Come on, it's lovely weather for a sleigh ride together with ewe. http",0
Wish I was still in bed with @user #ICouldSleepForeverRightNow,0
Long Gold Layered Pipe Necklace Set $20 Leave email for invoice http,0
"The word ""#Trust"" coming out of the mouths of #Holder or #Obama is just rich with and #hypocrisy. #IRS #racebaiters",1
Is the same sponge bob that they were hating on for climate change a few years ago?,0
So the question during their Twitter Q&amp;A about washing the sleaze off with a regular shower or with baby tears has been answered... it's baby tears while removing candy from said baby.,1
"Rodgers needs to go man , didn't think I would ever say it but he has bought some shit players there #good #enough",0
"May be cold tomorrow, December 28, 2014! A low of -7℃ - dress warm!",0
On #HumanRightsDay #Manchester takes first steps towards independence http .@user .@user #NotOnwWell,0
"@user @user @user @user @user @user yet in Ferguson, MO the mayor and Gov are Dems. #irony",1
then you're gonna get kicked out of the tea party AND the Moral Majority AND the American Family Association and Pat Robertson will call a hurricane right down on your ass,1
"@user #ChrisChristy will do well among republican voters.#JebBush, I think he could do well, democrats don't like him.",0
Cold or warmth both suffuse one's cheeks with pink (colour/tone) ... Do you understand the underlying difference & its texture?,0
Why are babies constantly sick everywhere. It's like why can't u just keep the food you eat in ur belly and #on #the #floor,0
It's currently Fair and 4℃ outside.,0
"Jesus, Mary and Joseph. How sad to go through life suffering from deficiency",1
About to write my math final really excited #somethingrandom http,1
"I shouldn't lose a full day of work because of system updates, but it happened yesterday. #fuckingwindows",0
"not that it matters, a message board thread is not an authoritative source @user @user",0
waking up congested/not being able to breathe is a great feeling.,1
that is the face of a tired man hahahahah,0
"@user @user is it bad that after my ""happy Preds won"" dance my first thought was Donnie?!",0
"In other news, apples 40 times more popular than oranges.",1
@user @user the only scary Bollywood film I've watched is Bhootnaath,1
It ruined Paul Ryan's childhood because he's still a very confused little Eddie Munster.,0
A romantic candlelit dinner for two would cost less if you switched the lights on - ESKOM pic from the 1990's http,1
"Wow: Look what the NFL Rams player who did ""Hands Up, Don't Shoot"" pose has been arrested for http via @user #ferguson",0
"OK, OK, GEEZ! I KNOW ALREADY! @user @user @user #totally #repetetive http",0
people speaking of law to protesters who are fighting for justice themselves... #ModelTownNotForgotten #PAT #PTI #GoNawazGo,1
"On a side note:  Today I learnt  Psalm 137 mentioned in this article inspired ""By the Rivers of Babylon"" by Boney M - which was one of my favorite records many years ago.",0
"@user: In fight over overtime for Firefighters, DC viewed ruling from control board as permanent"" but appeals court says no."" #fb",0
I'm becoming more anti-Islamic by the day...,0
What do you all think of that Salt-N-Pepa Geico commercial? I think it's pretty terrible.,0
Merry Christmas @user @user @user @user @user @user @user XD Thanks for making #BFHardline ^_^,0
I just love being ignored #not,1
@user actually cropped out her daughter in this pic for a selfie #topmum http,1
"The appropriate response is for wikipedia to block write access from those schools and if the abuse occurs, to block read access from those same schools.",0
@user @user But it's not a time capsule! It' current in time,0
@user My Jambo buddy sees a more Scottish identity emerging for HMFC. The John Wilson types can travel to Govan.,1
I have had one for almost a year and I don't think that I have even ever plugged it in...,1
"see, that MIGHT show up on a background check, and you'd be denied its a catch 22 we have the right to self protection @user",0
Yep it is hard to get a good education and therefor a good job when you are home schooled by the home schooled.,1
"Hey @user, some of your geeky/nerdy followers need #sarcasm marker on posts like that. Otherwise, they'll start doing exactly the same :)",0
I bet a lot of people do not know about this..,0
"Regarding my #ATT case; I've contacted the BBB, FCC, and my States Attorney General. next... #WFAA #not #stopping",0
@user gotta love how honest kids are. #saywhattheythink,0
Grace: this is my barf bag. Me: why do you have a barf bag? Grace: because sometimes when i see people i feel like vomiting.,0
"This from the people who scream that Obama has taken their ""freedoms"" away",0
Rants about being pregnant and judged for buying a bottle of wine. Poses weekly for belly pics in front of wine rack. or #fail ?,0
The music is always on in the office. Currently listening to Kids Bop Hanukkah on Spotify. Any other recommendations? #onlyatnycr,0
"This is very likely to end well. More vaccines is exactly what we need -.- "" Health and Human Services... http",1
"It would have been nice for the photo to be captioned with an explanation of the infamous event being depicted: Ryan ""washes"" already clean dishes at a soup kitchen that he made reopen late for his photo-op.",1
@user buuuut fast iteration and prototyping to production-ready code!,1
The TPP is a knockout blow to US manufacturing; in its beaten state idk if US manufacturing can make a comeback.,0
@user #me and #change were not friends I still need #time,0
Mens Football clearly know how to have a good time... #archiesday #anychanceofasocial,1
Nicholas Sparks has been manipulating women to believe that guys (in reality) are as sensitive as the male characters in his books.,1
"None of the big, disruptive innovations in our lives have come out of brainstorming. -Bruce Nussbaum http",0
Had a nice 3 hour nap. Picking up my Chinese take-out and set to watch #GuardiansOfTheGalaxy @user I added water chestnuts to my dinner,0
"#Video on #Jesus and #Bulldogs which is #deep and #meaningful cough, #dog #dogs #bulldog #religion #vlog http",1
Wow Tim Hortons Cobourg is really on their A game today,1
Stop by and pick up Alexandra's book with a coupon! http,0
.@user @user oh look an Audi driver breaking the law...how strange,1
#034i #100 #Glitter #Inside #Just #Lamp #Of Please RT: http http,0
Agree with @user @user some people sigh so others will hear them. My husband sighs all the time. Around me. #Curious,1
"@user the hostel is fine actually but I've probs caught like 1000 germs walking around London, thanks for wishing me better",1
Hmm. Training for encouraging motivational change tonight. Don't know if I can be bothered to go. #burnout,1
"Which means a lot of ""superior"" officers are complicit.",0
#birthcontrol #lol #wtf #whatisbirthcontrol @user great commercial #sarcasm,1
"@user #PSA Hey Jay, I tuned in when u said ""why all the cocaine talk today...after tweeting coke joke saw it's Escobar's 65th",1
http #TeenAnalCasting #What What is the Creampie Crusade?,0
Security Engineers are not Security Guards. : #Hackers #security,1
"I'm actually kinda surprised that people still say ""NOT!"" after an 'ironic' statement.",1
Hanging out with my niece all day jokes,0
"Been the problem, actually. RT @user: @user tough road trip. cant win em all but coaching has not been strong.",0
"Wow thanks for the good vibes right before my exam, parents.",1
Taking a final then going straight to work. I'm just peachy about it.,1
Sourceforge has been going downhill for a good while now - it's time that everybody still on there migrated to GitHub or similar.,0
Here comes the universe. #TMLtalk #Leafs,0
Sounds like the complete opposite of Catholicism.,0
I posted this clip here months ago and was downvoted to oblivion.,0
What a great Christmas. #not,1
So kind of occ health to book my tb skin test on my day off uni. I am thrilled,1
@user of course not! Carding? What carding?,0
"""the environment"" ...  another strawman",1
@user @user @user because as long as she's a victim she'll have white knights trying to save that damsel in distress.,1
@user @user Can we bring back Youkilis? Remember when 30 year old Youk charged mound & 19 year old Porcello dropped him? #RedSox,0
"Obama whisked away to hospital, diagnosed with acid reflux http -Wow, that's some real news.",1
"Nope, this is not the view of the majority of Christians (either around the world now, or throughout history), but it is typical of what are called ""Dispensational Premillennialists,"" and they happen to have a pretty strong (but weakening) presence in the churches of America, particularly in the south.",0
#Happy young chap ashamed of my God and my savior #spreading the word of God n life of Christ #successful entrepreneur #MindOfGod,0
@user that's 4 steps. But I can dig it.,0
When will this girl learn... @user #it #is #everyday #Chezza #sometimes #do #work #andnotgetcaughtbyMR http,0
Your cyber Monday sale got extended? No fucking way! #stfu,1
"""Saturday selfies"" miss you guys @user @user jessica101xxx mark8 kiss each and one... http",0
"Irony died 1000 times during the climax of Sholay, when the police urged Thakur not to take the law into his HANDS. #Bollywood",1
@user @user That's fantastic up to date news. Also,1
crushes are great until you realize they'll never be interested in you. :p,1
Over a third *of Americans*.,0
Because standing by a board about dental hygiene for two hours is how I wanted to spend my birthday..,1
Always fun when buses don't turn up! It's my favorite waiting outside in the freezing cold for them for like half an hour,1
Getting damage control advice from Rush?,0
@user . #please email me captainpc@user.com or contact through DM myself or @user . #I #have #DM #Address #details #but #not#had#reply,0
@user @user They r no less than the BCCI and Arnab keeps bashing them on the news hour,1
What an eventful weekend,1
has anyone visualised the different colours and flavours of twitter streams? kinda lipmus test.,0
"Washington, D. C.  Surpasses New York, L. A.  as Fastest Growing Region of Wealth http://www. weeklystandard. com/blogs/washington-dc-surpasses-new-york-la-fastest-growing-region-wealth_767299. html 7 of the 10 richest counties in D. C.  http://www. forbes. com/sites/tomvanriper/2013/04/25/americas-richest-counties/",1
Fuse blown in the media room! Too much hallway vacuuming. Chaos about to break loose. #CanCup,1
@user @user Second prize is TWO signed copies of Boris' book. #onlyKidding,1
#pick #up #linez to use Boy:When u smile its like the sun Girl:Awe Boy:because ur teeth are so yellow ;),0
I enjoy stealing my husband hat every once in awhile #heyyall #GoodMorning http,0
My grandpa just gave me a credit card for christmas...he has no idea. Lol,0
@user worst mobiles in india. Every 1 looks the same. Every model hangs from 4th day onwards. #samsung #recommended,0
@user #sarcasm is a service I offer.,0
Believe In Boegarts. RT @user: The Red Sox must really believe in Xander Boegarts as a SS if they're going with a GB theme.,0
@user I swear we must be twins,0
Fully charged my #Anker portable charger...it lasted 1/2 an hour. Awesome #Fail,1
"@user #ISIS flag above ""Merry Christmas"" is just to much #blackHumor and .. prayers to hostages!!",0
"lol, that's one big massive steaming pile of r/shitpoliticssays",0
"@user @user ""I encourage you... to educated yourself""",1
MVP goes to Concordia Wifi.,1
@user the good old days!,1
"But wait bitcoins arent real nothing was really stolen...  people pirate virtual information, music and software all the time... its all virtual..... why pay for software?   So why should it be wrong to take bitcoins..... :P (sarcasm)",1
I love waking up and not being able to sleep anymore :),1
I didn't realize Boston Coach also operated in Chicago #irony #brands,1
Hey look!  Someone who thinks The Administration is actually in charge.  How 90s.,1
Illinois just made it illegal to film cops? I guess that's a step in the right direction. #wtf,1
I think about Disney World just about every day. #missit #myhappyplace,0
@user good thing we had enough #whitewine and #christmastrees to survive if needed. #chardsohard #fashion ;),1
WAIT the GA I have a crush on and emailed me and told me it was great to have me in class he totally loves me,1
Photo: 3pc Lace Corset Size: small-2xl Price:$40.00 Leave size and email for invoice http,0
@user#it shows you that APC is a free and fair party#run by intellectuals#and this is what we call democracy dictatorship#,0
I wish more of my fellow Tennesseeans would vote against her when we have the chance.,0
What I did for my food at the Spanish party! http,0
"Good job @user...""@user: Same-sex marriage harms free speech, new Ontario judge wrote in 2012 http",1
Coin ! WatcherOnAWall: Anyone else find it sad that we have to remind Conservative Republicans that Torture is wrong? #TortureReport ...,1
Soooo deep #narrowminds #stopwatchingthenews #andstoppreachingoffyoutube http,1
It was a greaaaat night!,0
@user because I find people with different ideas and ways of life interesting.,0
"HELLO Sunday! BY THE WAY IT'S December 28, 2014 at 02:15PM! (just a random information)",0
Well it's the only way to stop that awful health care bill that they couldn't stop at the ballot box or in court.,1
"@user I don't think, I know x",0
Sneaking in a round of mini golf at #hollywooddriveingolf at #universal #citiwalk before the kiddos... http,0
A design firm's holiday card skewers corporate jargon. Hand biting mouth? #jargon #design http,1
"If this even gets to 100k, you know that some whitehouse aid will  respond with bullcrap about surveillance and security and the administration's supposed stance on the NSA revelations.  And of course, oh yeah the book report; education is good.",1
@user & @user cut a promo then @user states he's facing @user oh yay!!,1
So not okay with DB's racist jokes.,0
"@user @user wow. That here though, sorry grandpa, we use mac these days #WelcomeToTheWorld #NeverArgueWithFools",0
whoever runs Yeovil Town FC twitter account should be fired. their starting line up looks like a mxit fantasy league team,0
IT'S DEFINITELY NOT FRIDAY. THE REASON IS: It's Tuesday~! Yesterday it was Monday so why should it be Friday.,1
Totally been killing it with my assignments lately #socollege,1
going http,0
#LOL with all due #Respect to #KobeBryant .. he is #MJ ^_^ but damn near #Close !! #Legends http,0
Look good feel good! #not #TeamNoSleep #cantopeneyes,1
Gael 'pro at presentations' Anderson #not #choke,1
#All #And #For #Hot #Rachel #style #fashion Please RT: http http,0
MAMA - a Korean awards show that will be held in Hong Kong and will be headlined by an American artist,1
Lighting now setup on the #Malawi #Aquarium... Water tomorrow! #Cichlids #NoFilter #MarineWhite http,0
.@user Alert the media! Some guy on twitter has un-cited proof that evolution is wrong! Let's get his Nobel prize ready!,1
Yay its fucking Monday life is so perfect and magical I love everything,1
"@user Im sorry chode, my phone broke ;)",0
I love putting Flobeam mechs back together.,1
It's brrrrrrr kinda feel & who would go to the kitchen to make coffee ...,0
Loving how dominant the SEC is #Pause ... #Not,1
"Heh, and fat, too. #ShotsFired",1
How many of these people support the Commander should stay the deciding person to keep good order in the ranks?,0
I hope it doesn't need food stamps..,1
"Well, back to Firefox then!",0
@user one old fart to another: are you ever too tired to get up and go to bed? #allthetime,0
"While we applauded ourselves on getting to the Moon, Carl Sagan spoke a truth we all denied. #irony http",1
New shirt #new #shirt #im #sorry #its #just #i #literally #do #not #care #at #all http,0
"so, sane peoples would talk to themselves in twitter because they can't find other sane humans to talk to. that #retweet#ifagree",1
Taking a hour to shit is always a good thing. #not,1
"""@user: I can't stand watching a #UKvsLOU game with a Louisville fan! They're as bad as Steelers fans. #BBN"" @user",1
@user @user yeah this happens to me every time I want to like a video :(,0
"Just noticed that I crossed 500 followers in past month. Guys, I hope you enjoy the sarcasm b/c we all know my value added is nil",0
@user thanks for the spoiler!!!! #not,1
Love working and be exhausted all the time,1
Planned on an early night last night.. Oh yaa course that happened.. #gotinterupted,1
I guess waking up every couple hours is cool #not,1
I just love being in charge of comp music,1
"@user The badger crusade continues. ""Gloucestershire badger patrols triggered by illegal trapping fears"" http",0
"Giving 200 Cr. Water Subsidy to ""Public"" is a CRIME & Wasting 200 Cr. On Advertisement is DEVELOPMENT...Waah ji waah http",0
Nose is stuffed.Awesome.,1
@user @user @user His tweet in the context of his history is what makes it a clear bait.,0
@user I think you should go get checked out,0
Days when you just want everyone to leave you alone #in #a #good #mood #noHunting,0
@user I wonder what % of that 43% agree on what a private cloud is,0
"Update! Punt an Ostrich ? http January 2, 2015 via @user",0
I love working for an hour and not getting paid for it,1
"@user Nah, I don't think he says 'f*ck' enough on that album! #angryman #oldschool",1
This asshole is going to be responsible for the deaths of millions of Americans.,0
Isabelle sends me the nicest texts,1
@user this Friday lit,0
We're on t'last train @user @user #wemarchon #saintsfc,0
@user @user @user We Agree #NHSENGLAND needs to #Publish #AandE figures over #HolidayPeriod #Sarcasm from #JeremyHunt,0
@user I don't believe you!!!!,1
"Watching the move 'Begin Again' and the verisimilitude is overpowering, it's like I'm back in the 90s music business again.",1
Finals Week is draining my body so much that it's ruining my life in other places. Lovely...,1
"@user @user Porn!? Where where?? Move that naked woman, I can't see where the porn is! #games",1
Yep this sure is a Republican Shutdown   /sarcasm off,1
I think #Stars are just the most gorgeous things in this world,0
So let me get this straight he was going to sign with UFC no matter what wifey said? #HappyMarriage,1
"Stop living like a king, you're not one So using this in real life. #ExodusMovie",0
"What an Irony! The Police divide us, The Terrorists Unite us! #Terrorism #PoliceBrutality",1
Haley approves of her new hammock #ratsofinstagram http,0
We still got alot of moonlight left,0
@user No reasons given. Some waited expecting a call but only found they were not chosen from media announcement,0
I've completed Day 3 of the 30 Day Ab Challenge workout. Join me and download the app at http,0
Literally cried when I woke up because I know what this day has in store for me #TheStartOfTechWeek Ready #JustShootMeKnow,0
": When some naturopaths sell ""aromatic"" herbs the way apothecaries sell noxious poisons. #Naturopath=#Apothecary #Herb=#Poison",1
Harry's literally such a good person it hurts my heart BYE #InternationalHarryStylesDay,0
Alright who was dreaming about me last night because I could not for the life of me fall asleep http,0
Sysdig Cloud - The Fascinating World of Linux System Calls < reminds me of my Solaris dtrace days in early 2000's http,0
@user tried the pizza tonight we got from @user down here in #Pensacola. #YUMMY! Great job :-) http,0
i just enjoy throwing up #not #hatethis #sick #wanna #go #to #school #for #once #take #me #away,1
"No one talks like I do , No one thinks like I do , No moves like I do #ConorMcgregor #Ufc #Quotes",0
@user @user @user @user well played Matt. Well played.,0
OH and now the District line has major signal failures and delays FANTASTIC!!!,1
Reid' and 'reasons' share part of a syllable; can't be coincidence.,1
"Rolls-Royce, as envisioned by the wonderful people at Mansory #rollsroyce #purple #customcar http",1
@ the hospital for a new allergy test... Love it.,1
Just entered the @user competition for tickets to the final! Fingers crossed @user,0
It's 8:46 and I'm ready for bed.,0
i'm so funny,1
"@user Personal protection, 2nd amendment. Nothing to see here. #SMFH",1
@user please do..i need the second hand embarrassment so desperatly on my phone,1
I find this farrrrr too funny #wow #can #u http,0
"Committed to you, your privacy and an open Web Please turn on JavaScript to display this page correctly. Firefox homepage",1
Haha who the fuck says that to someone#TrueGentlemen,1
Hey heyy!!!I...wanna be a rockstar #vscocam hero #vsocam #hero #spiderman http,0
Probably just scarred the cleaning lady half to death because she didn't know I was home.,0
When you're sick and you feel bad for your cells cause they're fighting hard for you. #blessed #appreciative #sarcasm #kinda,1
Obviously my day is going to go fantastically well,1
Ah @user soul show making my Sunday morning at work more bearable #cold yet #happy,0
"@user happy birthday young one, have a gooden lad!x",0
Republican = bad politicians and Democratic = good politicians?,1
Just snap chatting my sister a few times.. #shelovesitwhenIsendthatmany http,1
My boy has another cold and spent the night coughing and sneezing all over me #sexy,1
@user @user see you in Burnsville at 5pm!,0
