text,label
"@user you realize you just tweeted out advice the other day on how not to spill your coffee, right? #sloppy",1
Why everything must b turned into a disaster to avenge another disaster?What's so gratifying in forgetting tht we all are humans/Pakistanis?,0
@user happy new year to you too!! Thanks for the reply,1
@user Probably a Nigerian.,1
@user find me one of those costumes for him and we will,0
@user Ask a liberal and he will tell you Obama got us out of Iraq and won the Afghan war...and no one ever died under his watch.,0
Christmas shopping on 2hrs sleep is going to be fun!!!!!,1
Absolutely love waking up to snow,1
Sanjay Dutt asks for parole to meet his wife whereas other husbands want parole from their wives but there no body exist to grant it.,1
"@user: You think my mom and I would get along better, she's a middle child too. #irony #middlechildsyndrome",1
When you're in the doctors waiting room and hear a baby in the back screaming her lungs out is always a reassuring feeling #not,1
What a good way to start the New Year..,1
@user @user @user @user @user @user @user @user @user All the best 2015,0
If I had a ton of money I'd turn this into a commercial and have it run in prime time over and over and over,0
I love waking up at 8 am on a Saturday morning after going to bed at midnight,1
@user nice to see you admit your errors slightly different from your earlier stats for 2014! @user,1
"@user Thanks, that'll help loads",1
They seemed to have found an alternative use for the bible #Hotel #NewYears #Religious http,0
Listen to Paranard #my mix by polosweets #np on #SoundCloud http,0
"On the train and surrounded by posh people, I'm so at home! #not #stickoutlikeasorethumb",1
D-1 test first day #read #book #งวย 5555 #doing #home #work =_=,1
The whole world can never get me on my level,1
"Oh materialism, how I've missed you.",1
"Must be a ""racist"" too.  /sarc",1
Weather bomb. Weather. Bomb. I applaud the media's innovation in helping to sensationalise the usual autumn climate,1
"Keep attacking the one world leader who stands up to fags, guys.  Whoever said conservatives are their own worst enemies?",1
4:30 an opening my first beer now gonna be a long night/day,0
@user: hey sorry im late i didnt want to come #myperiod,0
Check out some things I've been really loving recently during the holiday season! http,0
"@user i am okay with a trade, but they better get a darn good package and it better not be in the division",0
I'm knitting a scarf. Yes. Knitting. A scarf. Because manual dexterity and I like knitting. Problems?,0
She's got something you just can't trust It's something mysterious...,0
Thank God that the wait for an appointment is only until February.,1
I wish it was January already... Not because of school but because I'm having major withdrawals #Arrow fair wtfwasthat,0
Abraham was actually from modern day Iraq (Ur of the Chaldea) @user @user,0
Oh god I just so happens that i love really LOVE slow internet #slowinternet,1
@user u might b d bigest fan of srk but i find u better actor than him sayng it just fr sayng but realy mean it#expression king,0
I feel she didn't love me :/ :( :( #im #ok,0
Merry Christmas love Instagram http #gifts #spam,1
Reading a Victoria's Secret Fashion Show recap with a plate of French fries in front of me,1
"@user happy birthday young one, have a gooden lad!x",0
@user @user So is he banded from wearing the clothes? #Karma,1
"@user congrats , so cute :)",0
"Sony got hacked again? Oh man, big surprise... : http",1
"Life was never be so easy as it seems, till u come and bring u'r love inside. with me",0
"For the republicans, probably a crazy fuck that has zero chance of being elected in a nation race, but will pull in tons of cash when he runs.",0
I am so glad that I woke up early for this office visit to have to the mother not show up! #not,1
Wow I feel great,1
"Ouch.  Don't hold back, tell us how you really feel.",1
Going to watch a movie about murder. Merry christmas ;),1
@user @user and how many animals does peta kill every year. #hypocrisy #idiots might want to point CID inward!,1
@user this is my new fave thing on facebook #sexpest http,1
The moment you realize that what have you done in this whole year .,1
"Oh crap, Mac shutdown corrupted iPhoto so hours of rebuild ahead, so might as well eat and drink! #FestiveFattyBumBum",0
Mondaiiis to fridaiis without Huweyyyyyy #do #NOT #like http,0
Angry-face #Leo #Kids #Fun #Face #Angry http,0
Don't forget the oral sex!,1
Thank you behh! Loveyou! :) @user #bestfriends #behh #beh #sweet #love #distance #to #far... http,0
Write cover page of thesis. Laptop commits suicide #thankgodforbackups http,1
@user yea we was we too only a couple schools played black & not its a black dominate game,1
Darwinism would greatly conflict with Hitler's master race.  It would mean that the master race has evolved from some lower beings.,1
I asked God to protect me from my enemies .. shortly after I started losing friends or #naah,1
"Yeah, she just confirmed it.",0
I now have ZERO resect for DeMarcus Cousins.,0
@user I liked .. Don't regret anything that made you smile... Ha ha,0
"""Everything You've Been Told About Copywriting is BS."" http",1
#BBC #News -- #Thailand #crown #prince's #wife #resigns #from #royalty. http,0
Gym and I are gonna have a reeeaaalll nice date tomorrow. #imgoingtostruggle #VSFS2014,1
Twirra is NOT a place. RT @user: Twitter a place where virgins will be tweeting sexual & hoes will be forming saint...,1
@user My Jambo buddy sees a more Scottish identity emerging for HMFC. The John Wilson types can travel to Govan.,1
@user Doubt I was the first to block you. But you pretend good. @user @user @user @user @user,1
It seems horribly unfair - and it is - but if we didn't keep paying them - or if we paid them minimum wage as others have suggested - then the wealthiest politicians would hold out forever until they got what they wanted and people who weren't already rich would be disincentivized to run for office at all.  The 1% would be even more grossly over represented than they already are and have even more of an advantage than they already do.,1
My babygirl has an imaginary friend it's so cute to watch her talk to it.,0
@user I also support instantly murdering 12 year olds with fake plastic guns in public parks...,0
I wish religious fundamentalism would be officially regarded as a mental illness.,0
Today I'll lecture on CRM investments & shareholder value ... So excited ... I'm sleepy,1
"""He looks a decent bowler. Not really a 5th bowler, but, in a balanced side potentially 6th bowler"" Styris on HSohail. #pakvnz",0
Can almost smell the turkey #hungry,0
I'll just assume Rex Grossman is starting.,0
Thank u to all u beautiful ppl that talk extra loud when I'm trying to watch tv I love you guys so much #srslyofALLrooms,1
"@user wow, that is some fluent finnish",1
Worked both jobs between 545am and 830pm w 15 minutes between jobs. Already planned to sleep immediately after work tomorrow.,0
@user @user What does PTI do apart from whining? #Youthiacrasy,1
"Zuma reads the quote ""People are not fighting for ideas, they fight for material benefits. To live in peace."" #Irony #YCLNationalCongress",1
"Can we trade McCain? Biden helps Republicans more than McCain. In any other time, McCain would be a Democrat. http",0
My glasses are blinding me.,1
"Well, my nmu computer just took a poop on me :/ hopefully it will start back up later.. #whatDoIExpect #NMUComputersAreTheBest",1
"Is ""I have to go...my gelding is struggling with dystocia"" a valid excuse...I just want to see the (lack of) reaction #whenyouseeit",1
"Extended cut ""NICHA"" http #trailer #spoof #film #dramatic #action #film2014 #youtube #fightscenes",0
The perimeters around this relaunching were kept incredibly vague so the administration would be able to call any outcome a success.,0
The ones that caught me by surprise were the ones I didn't expect #duh #redundantredundant,0
""" #Congressmen Admit to reading #NDAA before #Voting http "" <3;-}><3 Via @user <3;-}><3",0
Happy Birthday to me! #imgettinold #not #ionlygetbetter ROLL TIDE! http,1
@user Obama and Hillary convinced Ukraine that they would protect them if they essentially disarm. Need to keep at least one promise.,0
Some days are just better than others..,0
"Turtle guy, who said his primary goal was to deny Obama a second term is reasonable and willing to negotiate now.  Yeah.... and I'm a Chinese jet pilot.",1
American Kids starting playing and now I'm super missing #summer2k14 #kennychesney,0
@user okay went to court the case got adjourned till January.. My backs been playing up so in some pain wbu? X,0
This photo of @user 's pool via @user has really brightened up my morning... http,1
Gotta love being lied to... #not,1
just our problem - The Express Tribune http,0
"Transhumanism is a morally questionable set of ideas, at best, but this article is put forward by a few crazies from backwoods USA.",0
i wanna be at home already,0
This is not the moon. Pictures like the moon is made of light bulbs. #the #moon :) http,0
"In hell, along with the other false gods.",0
@user @user @user hmmmm. I wouldn't say she has tits,0
"@user thanks for sharing Mike, your opinion means a lot to us. #orisit?",1
I love it when people ignore me. #sarcasm,1
@user really showing me the fastest LTE around #speedtest http,1
Photoset: leupagus: itsxandy: thefingerfuckingfemalefury: sevenpoints: getting paid enough to put up... http,0
#BBC #News -- #China -- #Shanghai #crush: #Xi #Jinping #orders #new #year #investigation. http,0
@user @user @user please reply to this gentleman on behalf of all of us here @user #jokles #gotrealworktodo,0
"The home team always hears cheers from the crowd, even in their worst seasons.  They wouldn't even know they were losing if it weren't for the numbers.",1
Main issue with the walking dead- you forget to breathe when you're watching. So bloody good #WalkingDead,0
Meanwhile in Zimbabwe the South African imposed government promises to stamp out corruption.,1
Cocktails tonight yep why not! had one in over a year! !,0
It's amazing how Democrats view money.  It has to come from somewhere you idiots and you signed up to foot the bill.  Congratulations.,1
"If this is love i don't wanna be loved , You pollute the room with your filthy tongue #getscared",0
@user I typed it with a lisp too! Hahah,0
Days when you just want everyone to leave you alone #in #a #good #mood #noHunting,0
@user Re: Jamie Grace has Tourette's? Thanks for sharing. I'm about to research her & post my tribute to this Young lady Gospel singer,0
"&gt;$7,000 fine It's insane that one of the largest businesses in the world would refuse to pay this, but it's Walmart.  Is anyone surprised?",1
"So beware, when the cult ends, it's not usually by everyone realizing how silly they were and retreating to sanity.",0
"So Ally McCoist hands his notice in and gets a pay rise,he really has Rangers best interests at heart",1
@user Because we all know that a house is a hermetically sealed environment! @user @user @user,1
i can always count on freshmen to make the library loud. THANKS,1
"@user man, there is too much in this tweet.",0
FOR SHAME .. THIRD TIME ... Pregnant Duchess wears designer dress for the THIRD time in New York http via @user,1
What difference at this point does it make!?,0
@user @user @user too much of that herb. New trend of potheads contributing to society maybe? Darn that,1
Speed cameras in Whipton by village shops. & yes it Takes 5 police officers!! #waste #of #money #does #not #take #five #individuals,0
@user Duly noted ;p ;p ;p,0
"The whole #Misogyny thing is hanging in there with Women from the right . A cat fight now ?, imagine pulling that on the left #pmlive",1
"Tell that to the executive branch, who have violated established law by continually making alterations and exempting people from it.",0
Just found out I have my making babies final on Thursday. Good thing I have so much time to study,1
Lmao I may be drunk... But my level of maturity is at it's all time high lmfaoo.,1
"Ask not what you can do for Supply Side Jesus, ask what Supply Side Jesus can do for you.   All by buying gold from my ministry's website!",1
Surprised SJWs haven't tried to get call of duty banned. You can make male & female guys so you have men KILLING women #Misogyny,1
@user it's no fair that u get to have a lie on & I'm up early for College and it's bloody freezing #fair #lucky #duck,0
Bruh. I just realized I'm wearing her shirt. The chick who dumped me. Lmfao,1
"So when they went to private ownership, they just magically developed over night a deep knowledge of crops, animals, environment, and farming techniques?",1
I cant even watch anime in japan...,1
@user @user def understandable.i'm ok with that. trying to find anything up here on this has been impossible.,0
@user But still bothers me that I see now follow up report.,0
Horses are just hornless unicorns :O #enlightened #mystical #wow #on #drugs,0
My body refuses to sleep. #fucccck,0
What was the last picture you took with your phone? -- a pic of syresatt vatten of Ikea's bottle http,0
@user and a strut to boot,0
@user hahaha yeah I think so too cause you know how she loves her with all her heart ... #NOT .,1
Why YES! Of course I use a lot in my day...because violence is illegal.,1
This is hardly Fox News...  (I'm here all week. ),1
Finals Week is draining my body so much that it's ruining my life in other places. Lovely...,1
"There's a reason I don't tell my parents anything, cause I always get THE most positive responses",1
..what a great start to my day,1
If they keep this up I might actually start watching Fox again.,0
I love waking up at 4am everyday and then running 5 miles.. favorite part of the Army :),1
Throwing up on Christmas morning is my ideal way of spending it.,1
"@user draw, @user draw, @user going to lose, Pelle on my bench in fantasy, been a fucking shit night for me.",0
@user @user see you in Burnsville at 5pm!,0
@user: Wenger slams referee http (Sky) #saintsfc ha ha ha ha for being too blatantly bias towards them?!,0
good luck finding someone to take the other side of that bet LOL @user,0
Bitches be like ... #more #appointments #please #not#crazy#enough ... YET @ orthodontist http,0
"FALSE, slavery was based on economics, @user @user @user @user @user @user",0
And both are at the forefront of delusion.,0
"Because the House cannot vote on a bill unless the Speaker allows it, and Boehner and his compatriots have been planning this shutdown all year long.   Why would they allow such a vote to take place until the country can be sufficiently damaged and he can start pointing fingers everywhere else?",1
I love not being able to sleep right now.,1
this music is for the people and not for the money. peace and love. http #KINGLIFE,0
"This is very likely to end well. More vaccines is exactly what we need -.- "" Health and Human Services... http",1
"Thanks @user, for nothing. All my family were flying with you from KL to attend my wedding. #everyonecanfly #AdelaideRouteCancelled",1
I love when I'm taken as a joke...makes me feel so good about myself!,1
Happened in my culture competency class...I couldn't continue to argue with ignorance <- my face in class http,0
Watch amazing race contestant talk juicy! http,0
"Ugh, I would give your first-born for some Pepto Bismol right now. #upsettummy",0
No response always seems to attract response. The ! #aintnobodygottimeforthat,1
I guess my cat also lost 3 pounds when she went to the vet after I've been feeding her a few times a day. #Eating #food #WorkingOut,0
@user @user Lovely on Carnoustie beach this morning... #soggybreeks,1
then that means it HAS to be square to him @user @user @user @user @user,0
@user only children at home status. Woohoo Isn't it fun...,1
J Cole has a song about being a Virgin and then not being a virgin. #musicalgenius #innovation,1
On the other hand condolences to @user and @user for the draw...,0
People who don't get : you are THE BEST!,1
"Every you're a fucking cunt, lying cunt did I say cunt song is about you now. How cute is that #defo #not #pissed #off #nope",0
I'm not usually a fan of anything #pumpkin or #pumpkinspiced but OMG. These are the best cookies I've... http,0
"Rush rush rush, all done and then POW, a football through the window.#glasseverywhere #boyswillbeboys",0
You know actually think Audi Murphy was cool though.,0
@user what is it with whales this morning http,0
My beautiful Belles #3daughters#lucky #me #havefun @ Wicklow http,0
"@user Re: Xmas: ""Christmas"" is itself an abbreviation of ""Christ's Mass."" @user http",1
@user Yeah someone with Hayek and hockey in their name calling someone racist #irony @user,1
HEY LOOK THERE!,0
@user you cant score goals sitting on the bench or 15/20 min max its hard pal fill sorry for him,0
How much were they given in the bailout?,1
"@user: It's 2015. Why am I still manually turning on/off WiFi, Bluetooth, NFC, etc..? #fb yep",0
Company profile FORGET ME NOT PET CEMETERY - http #FORGET #ME #NOT #PET #CEMETERY,0
@user @user They r no less than the BCCI and Arnab keeps bashing them on the news hour,1
@user Alone Tonight cause its a personal song which helps me to imagine myself beyond another world. #GoSupersonicQuikr @user,0
Next day makeup just looks so hawt,1
"It's a good thing Obama opened up Cuba in his first term, and didn't wait until all his elections were over. #cuba",1
"Tax & NI on your wage slip is like Jim Bowen on bullseye goin ""look what you coulda won"" #rubbingitin #crap http",0
It's funny how you can sit for 15minutes And not be noticed. #MTVStars Taylor Swift,1
Waking up with your cat attacking your hand is always delightful... #not,1
"#Video on #Jesus and #Bulldogs which is #deep and #meaningful cough, #dog #dogs #bulldog #religion #vlog http",1
It wants to keep the drug companies healthy.   Why cure when you can treat with medicine for the rest of ones life and get revenue all along the way.   That teamed with the bureaucracy and snails pace of advances sums it up.,1
I've got a right thirst on... #NewsYearsEve,0
my life won't be complete until I meet @user,0
http <-Video $ #SmartPhone can pay you to post! #iphone #samsung #S4 #S3 #ipad #tablet #mlm Start@ http,0
"Same as what Whoopi said about rape of 13 yo by Roman Polanski. Not ""rape rape"" b/c she was drugged. http via @user",0
posting any tweet doesn't mean i don't use twitter !,0
@user thanks for noticing me,1
Yay for days off. #coffee #HarryPotter #christmasbreak #morning http,0
Taylor wrote a nasty note on my car today. #we #are #friends,0
UK PM making sure child abusers are brought to justice. I can assume people will be brought to justice #lies http,1
"@user thanks babe, hope you have a good one too",0
True http,1
"@user for the #yoga people out there, this is a Down Faced Dog dinner! #MerryChristmas http",0
"http Because, progress... #AnEyeForAnEye , #PeshawarAttack #Taliban... Surely this will bring peace and justice?",1
Pretty sure I just sat behind @user in the McDonald's drive through and peeked to see movie what was playing,0
"Hey @user, some of your geeky/nerdy followers need #sarcasm marker on posts like that. Otherwise, they'll start doing exactly the same :)",0
Can't say no to that @user try now. Lets go @user we can do this #COYQ,0
@user doesn't get more #indiefilm than #miboxzombie http :-),0
"@user aww bless ya. Enjoy your break babe, yeah it was great thanks.. Finally recovering from it. How's Ya tash going?",0
"""@user: .@user @user EVERYTHING IS AWESOME!!!!!!!!!!!!!!!!!!!! :) http",1
where in the article does it say he has a faith in god?,0
Fuse blown in the media room! Too much hallway vacuuming. Chaos about to break loose. #CanCup,1
"People these days are so loving, accepting, and nonjudgmental. It's great.",1
That moment you drop your phone right after your kid gives you a case for Xmas but before it's actually opened and put to use.,1
Patrick Kielty hosting Radio 2's Comedy Awards...,1
Photo: 3pc Lace Corset Size: small-2xl Price:$40.00 Leave size and email for invoice http,0
Lol... That's real cute,1
Mary is not having that shit whatsoever. #done #shesdone http,0
dats how u kno its winter http,0
I don't like clowns but I'm going to be one.,1
Learned to play 3 string notes on the guitar #pro#idiot,1
I wonder what Professor Iaukea has to say about the new Disney Princess...?,1
The pope is meeting a cruel dictator.   Likely won't address his cruel dictatorship.   Boo.  At least he isn't blessing Rebecca Kadaga like the last pope.,1
"@user nm, I'm silly and didn't see the website.",0
I mean if Obama can win one...,1
I feel the most comforted when the misinformed are the most vocal. #pleasedontspeak,1
"The religious party should read their bible (James 1:19), ""Everyone should be quick to listen, slow to speak and slow to become angry"".",0
"Irony died 1000 times during the climax of Sholay, when the police urged Thakur not to take the law into his HANDS. #Bollywood",1
Tomorrow is the day I'm coming back to Florida for good ... :( unless something changes in the next 24hrs which I doubt #ready,0
@user not always. They've found them in $500k homes,0
It's #cute to be awake right now,0
@user More proof you'll never lose $ betting the under on the intelligence of the electorate. How can anyone believe a word she says?,0
"My whole life is just ""oh ok"".",0
#Dallas #traffic I sure missed you! @ Downtown Dallas Traffic http,1
@user Ew you really did it?,0
Ed Sheeran smashing out his tunes on the Victoria's Secret catwalk. Ginger legend!,0
"Change is a Process, #Not an Event dafuq you thinking",0
Is there a basketball game on today? I'm not really sure. #ESPN seems to not be promoting anything about it. #sarcasm,1
@user @user it's like you're in the Maldives #seaandwhitesands,0
"Utah:  Our Jesus can beat up your Jesus.  Can I get ""In Javier Morales We Trust""",1
"@user street lights on during the day in Clayville, Olifantsfontein. This should not be happening with #loadshedding problems. -on",0
14 units next semester plus work yes so excited for that!!!,1
"@user What do you order at Kona Grill? For ""fast food"" Sushi, that place is delish.",0
"@user @user not playing out in the provinces like, oh, Mississippi.",1
you can't fixed stupid.,1
"@user this made me think of you ""@user: (330): I need vodka mixed w a bit of holy water right now""",0
"Day 9 ""something your reading"" #decemberchallenge #lovehistory#lovenonfiction.. @ Our Cosy House http",0
"@user happy new year, da! Thanks sobra for this year",0
Companies you use to have the freedom to boycott.,0
"Stay in school, kids.",1
I was watching birds fly during this photo. http,0
"Come on, it's lovely weather for a sleigh ride together with ewe. http",0
"season 6 episode 3 carries outfit, simple & chic http",0
Loving how dominant the SEC is #Pause ... #Not,1
"Thanks CBO, but we already saved $4 billion by taking food out of people's mouths.   We're good.",1
#np #NowPlaying #NowListening #Music Of Dying On Your Birthday by #Senses Fail from the #album: #Let It E... http,0
feeling well,0
Girls won't answer their phone when I'm calling them bc they think I'm calling them in early but I'm actually calling to cut them #irony,1
I need a misadventure form because I broke my hand practising and rewriting this english essay 500 times,1
@user I think it's a safe bet it won't fit the crime.,0
"Dad and step mom bitching at each other, now it's Christmas #ugh",1
@user your last retweet though,1
love studying for anatomy,1
Gotta love the sound of rain beating against the window on Christmas Day.. #whereswinter,1
Is the same sponge bob that they were hating on for climate change a few years ago?,0
"@user :/ still Q10, still one of the best :D",0
you have no argument because you're insane @user @user @user @user @user @user,0
@user @user I don't think I've ever seen Love Actually all the way through. I tried once last year. I don't remember it.,0
"Some ""new"" vinyl on the turntable tonight. Here's to you Joe. @user #JoeStrummer #Sandinista http",0
@user The Raiders are. I guess we'll see how things play out tonight.,0
Because your bullet doesn't need to agree with a bunch of other people's bullets before it kills anyone?,0
I believe it is about #indoctrination & religious indoctrination either; but indoctrination into the future groups of #Lefties.,0
@user @user he captures the spirit of devolution so well,1
"look for the girl with the broken smile, ask her if she wants to stay while, and she will be loved.",0
@user but hey we could just kill their kids in a drone strike cause that strategy seems to b working so well and #not,1
"In the last 2 movies I've seen Alan Arkin in (Argo, GrudgeMatch) he has had me absolutely rolling.",0
@user has the best pickup lines,1
Your Jedi mind tricks don't work on me service guy. Glad I dropped the car off for the oil change instead of Av.,0
@user why? university always helping,1
"&gt;get off Ohio's dick and let them do what they want to do And while we're at it, let's let the south have slavery again.  Frankly, there should be a constitutional amendment protecting a person's right to do what they want with their own body, particularly prior to the point where they are carrying another *viable* life.  No state should be able to write laws that make it more difficult to get an abortion under the guise of ""protecting women"" when it is a fact that abortions performed in the developed world are among the safest procedures in medicine.",1
I just love being told that I wouldn't have gotten hired if my boss knew I was pregnant.. #ha,1
"All I want for Christmas is..the complimentary coaster offered by the title insurance company if I generate a ""Quick Quote"" to myself.",1
#working.blues.enough.vacation.days http,0
[I am shocked! ](https://www. youtube. com/watch? v=nM_A4Skusro),1
http #fOLLOW THE #MONEY #HOMEbiz NOT #mlm *** NOTE YOU CAN GET PAID FOR POSTING ON ... http,0
