text,label
Worth a read. On #Christians and the persecution they face. #equality #respect #sectarianviolence #countyourblessings http,0
The Chicago Firehouse Restaurant caught fire this morning. http,1
http #CHRISTMAS #GIFT #BLESSING #Santa #follow #TheInterview#BharatRatna #CallMeEva... http,0
"@user @user I just want learning from this group. Development. And to turn Green, Bass, and Thornton into assets.",0
@user is it squirt or squat?,0
@user so ...still no response from @user #greatcustomerrelations,1
Look really awake and like I've made an effort today,1
"Hey man, I'm sure you just missed the memo, but ""capitalism"" is now defined as the government telling us we have to buy something and then narrowing the definition further, by telling us we don't know what we want and they need to show us.",1
"I love seeing a guy go 50 and texting in a school zone, #soproud #gpabdrivers",1
Most useful algorithm I've learned in class so far is finding a substring by using the fast fourier transform,1
The fact an officer would threaten to throw a mother in a squad car lamenting over her dying child's wicked/absurd! http,0
@user stoked...,1
Responsibility = the ability to respond To control yourself and be in charge of your life,0
"Well now the festive season has begun, let's take a moment to reflect on how much more royalties Slade and Wizard will get #sarcasm",1
"Oh, I'd march straight into his office, and use words a lot less pleasant than ""shit"".",0
I can't even begin to explain my frustration.,0
@user is this a new/recent release?,0
@user @user there are more lawful ways the lawmakers whould av gone about gaining entrance not by breaking the law kind of,1
"Contemplating responding to @user's tweet saying ""what remains of their pride"" but not sure how well that will go down",1
"@user @user I had never heard of them before, but I quite liked it!",0
Imagine if it was a man his age going after 17 year old girls with substance abuse problems.,1
"@user @user .@user has warned @user about Bassem.Heck, they might already know him! #Ferguson #NYC",0
i decided to become my own boss to have more free time.. now i have no time left whatsoever.,1
Sarcasm is the only thing i like. #sarcasticbitch,0
"@user Hey, he DOES have the word ""ban"" on his home page like two or three times though. #AcknowledgementIsFirstStep",1
"#Ukraine's #President to #meet #Russian, #French, #German #leaders, #rules #out #offensive. http via @user",0
If you give a mouse a cookie...,0
"The ultimate ""How to"" book... http",0
"Call my cynical, but I am guessing they didn't 'fall' for anything.",1
"@user wow, Rickman really looks a lot different with blond hair.",0
@user The pace of KCRoyals activity at the Winter Meetings is giving me vertigo!,1
"@user not surprised, it was epic.",0
@user sounds like the LA end of days!,1
@user Part 2~ ARTICLE ~UEXPECTED http,0
@user @user @user but of course it was. Cops could shoot a black man in front of a hospital & I bet you he'd still get no aid.,0
*ahem* SPONGE BOB IS A FUCKING CARTOON!!!!!!,0
Great start to the morning #flattire,1
How Badly Do You Need That Burrito? (That's sounds naughty) http #burrito,0
@user No! I rarely drink at all. Got a stomach bug :-(,0
2015 prediction: Putin ditches the Ruble and adopts Bitcoin,0
"&gt; â€œWe need to move on and take whatever we can find in the debt limit. â€  Holy shit, do these guys not learn?  ""Hey I pissed on the electric fence over here and it just about blew my dick off, but hey, I bet if I piss on it over *there* something else will happen"".  Fucking idiots.",1
"My whole life is just ""oh ok"".",0
review,0
@user I don't think. I know!,0
This needs to go viral.,0
"Pain is inevitable, suffering is optional #Anonymous",0
Sat on yet another stationary @user train for 15 minutes with no explanation from the driver. Your service is just top drawer.,1
"&gt;In dentistsâ€™ and doctorsâ€™ offices, hearing aid centers and pain clinics, American health care is forging a lucrative alliance with American finance.  A growing number of health care professionals are urging patients to pay for treatment not covered by their insurance plans with credit cards and lines of credit that can be arranged quickly in the providerâ€™s office.  The cards and loans, which were first marketed about a decade ago for cosmetic surgery and other elective procedures, are now proliferating among older Americans, who often face large out-of-pocket expenses for basic care that is not covered by Medicare or private insurance.  American exceptionalism.",1
@user doesn't get more #indiefilm than #miboxzombie http :-),0
she needs to take a dirt nap soon..,1
@user @user I sure hope ev1 vaccinations are up to date! #GoBolts @user @user @user,0
"Well, we could have electronic voting machines that have fully open source code, and use cryptography to verify results, but of course, there's no money in that.",0
@user @user @user @user don't forget @user and @user (they're as smart & kind as lovely),0
I'm pretty sure I have a snowman problem.,0
Yay for days off. #coffee #HarryPotter #christmasbreak #morning http,0
"I think just as tons of more ""liberal"" people have been twisting the Pope's words for sensationalist headlines (and then when corrected seem to blame anything or anyone other than their own initial misconception), this is also a pretty sensationalist headline from the other side.   I think this article is *slightly* more honest than the NY Times or Huffington Post was (not saying much), it still misses the point entirely.   Vatican Headline:  ""Pope: Lord save us from the subtle conspiracies of worldliness"" AsiaNews Headline: ""God save us from the ""hegemonic uniformityâ€ of the ""one line of thought"", ""fruit of the spirit of the world that negotiates everythingâ€ even faith"" Free Republic Headline: ""God save us from the ""hegemonic uniformityâ€ of the ""one line of thought"" (Slams progressives)"" The Gateway Pundit (posted to r/Christianity): ""POPE FRANCIS Blasts Progressive Movement â€“ â€œThe Fruit of the Devilâ€"" And of course the latter will get more pageclicks, just like ""Pope Says Church Is â€˜Obsessedâ€™ With Gays, Abortion and Birth Control"" got way way more pageclicks than ""A Big Heart Open to God"".     *Worldliness* is the Spirit of the Devil.   Some progressives consider any proverbial ""move forward"" as being more important than their own fidelity to the Faith.   (You can see this sometimes in other threads on r/Christianity--""the church needs to 'catch up' to the rest of the culture on ______ issue! "")  This is a product of worldliness.",1
"@user claims the man was peaceful, when he was violating HR of orientation. making a free speech argument over an HR issue.",1
"Galliani already jumping into the changing room, likely discovered what Seedorf told him all along ... same thing Pippo is saying now",1
"@user You need to, it's an experience to say the least",0
@user thanks for all your help Giles,1
@user @user so glad I bought a diesel car 2 years ago,1
"From user tilio who deleted his comment after realizing how stupid it was,""as the other side of ""independent,"" i feel the exact opposite.  we're 17 trillion in debt with over 70 trillion in unfunded liabilities (medicare is once again, almost bankrupt).  instead of making efforts to work these down, democrats are piling on even more debt.  it's clear that many democrats / fiscal authoritarians have not looked at this from our point of view.  republicans, tea, and fiscal conservatives in general want spending cuts and deficit reduction.  as long as we stand firm, we win.  either democrats cave to our demands (giving us the spending cuts we want), or democrats drive us off the cliff, destroying the US credit rating, forcing spending cuts because they won't be able to borrow nearly as much money.  the only way we lose is to agree to let democrats / fiscal authoritarians to keep spending.  you may dislike this point of view.  but it is inescapable fact. "" Your joking right?   That debt is largely a legacy of the last president and his two wars, which we had to continue.   Conservative fiscal ideas are what drove us over the edge.   Furthermore, we know your position, but you lost, the majority of voters elected representatives that support the ACA, as evidenced by the wast of time that the republicans tried to remote on it and lost every time.   This is a democracy, just because the majority disagrees with you doesn't mean you get to shut down government and act like a bunch of spoiled children.",1
"It's the crackhead uncle of the HBCU family ""@user: Every HBCU in Alabama looks at Alabama State sideways lmao!""",0
"@user just lost a fiver already on the early kick off, cheers Forrest :)",0
Please instagram all your xmas presents I'm dying to see them #nobodycares,1
work Wednesday-Sunday .. #yay #not #moneytho,1
@user you mean... it doesn't mean 'so much hate'..? ... oh... orz,0
Who tf wants a Christmas elf tattooed on them? That's the dumbest shit I've ever heard of. #sorryimstoned #inkmasterfinale #inkmasterrivals,0
"Here we go again, thanks to all that claim to cover WVHS hoop #NOT Highlanders beat Parkersburg 76-75 on last second shot by @user",1
They are in the banking industry - it goes without saying.,0
"@user #SC3stars CARDALE JONES. Third string QB, Big10 Champion and MVP.",0
My grandmother got $59 and they just sent her a letter knocking it down to $23.  I am very grateful that she has us that can provide and help her.  I can't imagine those who rely on it a great deal.  Thanks government.  Fuck up the only program that was doing well with a very small amount of fraud.,1
Online shopping with no credit card #Umm.. #JustBrowsing,1
Morning #monday people long know keep working hard! #MakeSussexSafe 01273276865,0
Lady in red #ootd #im #the #mom #the #godmother #lol #athenakairalyn #baptism #love... http,0
Cramming 200+ psych pages into my brain even though we learnt that cramming isn't effective,1
My Com professor keeps talking about Twitter. Lel,0
Dead supportive family I've got.,1
Turning in my paper then coming back home and studying #perfectday,1
@user isnt it obvious #Sadhvi case and #Rape cases are 2 different things. You cannot co-relate both thngs to 1 sentence,1
Favorite @user if you love Romance Novels. http #Love #Drama #Romance,0
Lol at people saying they're turning 13 this year when did I start following kids #sorry,0
Totally been killing it with my assignments lately #socollege,1
Shoutout to my mom for being hella supportive of me,1
Would like to thank my nephew for giving me his horrible cold & sore throat etc.. Much appreciated!,1
I'm getting excited about Mexico now.,1
"Oh my god what a headache listening to her!   You know what though?  We're going to hear this same stuff from Republicans for the next few weeks.  It's a ""serious investigation"" they are undertaking...  Presented by Miss South Carolina.",1
Having to be up in four hours sounds great,1
I don't think it's the last time ;-) #hobbit #onelasttime #cinema #ov #3d #48hfr http,0
@user When are you buggering off out of the country,0
@user There's so much less controversy now that the BCS has been replaced.,1
This time last year...shiid was hella funny...unforgettable #khwaaaa,0
Sad that when someone drinks they treat you like shit and won't talk to you.,0
@user @user Love her. please publicise her more.,1
"The only thing I took away from this article is that if a writer as terrible as this can get a column on HuffPo, I'm obviously not trying hard enough.",1
Ah @user soul show making my Sunday morning at work more bearable #cold yet #happy,0
new shoes. kinda in love with an inanimate object. http,0
"Thanks CBO, but we already saved $4 billion by taking food out of people's mouths.   We're good.",1
@user @user empty threats even #TheBear supports #united http,0
My luck just keeps getting better and better,1
"When j need the mailman to come late, he's here at 8a. When I can't wait for the mail to come? 7p.",1
you're so sweet,1
@user: don't say anything... just retweet it http @user @user @user,0
If that's Man U at its best they have much bigger problems than us ;) #saintsfc. Then again we're still 5th #noproblem,0
"Stay in school, kids.",1
"""@user: @user IT HAS THE WORD MAN IN IT!! Just as sexist as saying mail man instead of mail carrier. "" #MichiganMan",1
They working me so hard tonite,0
"Rogers, that smile just so accurately captures my reaction when I receive an extra high phone bill! http",1
"@user Tx, i saw that. must be a great shot to defend oneself from a fierce attacking giraffe. #HungerGames",1
"Great, I've got a lung infection. This is fun. :/ #notfun #miserable",1
Decide that you want it more than you are afraid of it. -Bill Cosby #irony,1
Cooper's been busy today http,1
The Champions League is overrated anyway!,1
#politics is not my cup of tea says #sonakshi @user of #lingaa fame . #sonakshi dad #shatru is our top #bjp leader,1
@user you are by far the funniest prick in the world at the moment. Can you please come to Geelong? We have a normal mayor...,1
"It is very simplistic to think it is just the money.  It is more all that unconditional love and support that they are getting from US that enables them to behave like a spoiled child.  It is all those [**US-vetoed UN security council resolutions**](http://www. jewishvirtuallibrary. org/jsource/UN/usvetoes. html) .  If they had to deal with their neighbors in a fair and civilized way (as all the other countries in the world do), and in the absence of continuous US partial interference, they would be forced to reconcile and co-exist with them.  The US unconditional love and support in the long-run is doing Israelis more harm than good, not mentioning the rest of region.",1
Scalia couldn't be effective without help from the other 4 corporate justices.,0
"If daily beatings turned out to be the best incentive for artistic production, Valkvinge would be all for it.",0
@user must b in the #blood lol x,0
Wondering weather to have a few drinks tonight or not,0
I love watching liverpool truly inspiring,1
I love procrastinating but I hate cramming.. -_-,0
The oh-so-classy [] @user also belittled the #ALS #IceBucketChallenge in his disgusting little video. #NotInMyWallet,1
@user I also support instantly murdering 12 year olds with fake plastic guns in public parks...,0
the struggle of writing this article and studying for this journalism final is killer.,0
Si Ms. Educ hehehe clear my ignorance,0
@user @user #apologies *scoffs humble pie*,0
Yay yet another week with a child home from school ill! Just a hint of #Sarcasm to brighten my day.,1
8.30am conference calls. #love,1
"#Daesh,#Taliban all need to become part of 'The religion of ""PIECES"" My heart goes out to all the of the victims of #PeshawarAttack",0
I think the new sweater I bought is a maternity sweater. Oh well. Its super cozy,0
"@user Personal protection, 2nd amendment. Nothing to see here. #SMFH",1
"Mirror mirror on the wall, when will I find happiness?",0
"@user @user A lot of factors at play but I think you do retain him at max. Hopefully the FT's hurt his market a bit, selfishly speaking.",0
Read at http the news '#Obama: #The #American #way #of #life #is #not #a #gift',0
Stinker of a day... Nothing has gone right. Got worse as the day went on... #Ahhhhhhhhh #Depression #CantWaitForTomorrow,1
"I wonder what happens if you take a group of armed men in a foreign country and then tell them that a) you're not getting paid and b) no, you can't leave.",0
"- during @user criticism of @user , a promo for a special featuring #BillCosby ""#rape victims"" airs. #Hypocrites",1
@user tried the pizza tonight we got from @user down here in #Pensacola. #YUMMY! Great job :-) http,0
Same #Soundcloud dl: http Follow> @user #ATL #ConsciousMusic http,0
@user Because we need an excuse to pop it open! My dream is McDonalds and Grand Cru. #ChampagneExcuses,0
"Oh well, looks like we are back to square 1. Batie and Bridge. This is going to go so well #BoldandBeautiful",1
I am just hoping he will get center to right Catholics to think.,0
Now who is going to have the balls to ask the WH about it??,0
"@user I've had three boys, breastfed them all for about a year each and never had to do it out when I was out! necessary",0
Sort of what happened to occupy wall street?,0
can you not understand that not EVERYTHING is about the President? @user @user @user @user,0
"@user gotta hand it to them, really.",0
"If you wanna look like a badass, have drama on social media #not",1
They thought I was gone ! These vegas niggas gone respect me and know I been doing this shit too ! & I... http,0
@user Psssst. You spelt 'thing' wrong,0
The dude who told me money isn't everything is arguing with his son over money. In public.,1
Fleury with 5 shut outs so far on the season. He's still not good though,1
BBC News - 'Skywalker' passport cancelled because it was 'frivolous' #trademarks http,1
[As opposed to the father of the Protestant Reformation... ](http://en. wikipedia. org/wiki/On_the_Jews_and_Their_Lies),1
@user @user he captures the spirit of devolution so well,1
3 hours of sleep is sufficient to tackle this day. #timezoneproblems,1
@user don't know how#Monsanto # among 100 most sustainable Cos in the world sure all parameters are measured#net positive?,0
"@user yes, you got the point. :( it's like, as the time passes we're growing into some kind of beasts.",0
I liked a @user video from @user http 2015 Challenge! Style By Dani,0
never expected you would LIE as much as you do back when i first encountered you @user @user @user,0
"@user my mom told me not to do it, but I'm fine",0
"American Jews have pretty much never supported Israel in lockstep.  Rather, their support base in the states comes from the born again Christians and Evangelicals.",1
Nah instant 1950's tax rates.,0
At last I can quit work and enjoy life lol http,1
"oh yeah, that was funny as hell too, @user @user @user @user @user @user @user",0
Yay for cars having a case of the Mondays. #not,1
I #may or may be #watching #Rockos #Modern #Life... #ForeverA90sKid #ImNotTheWallabyIusedToBe,0
Turns out a sausage butty from burger king is just a burger. Really enjoyed eating that at half 8 in the morning. #feelshit,1
"@user @user you can't reason with someone with a bio as moronic as his. ""So should everyone else"" #SoDemocratic",1
I hate plane rides but I wanna go to so many different countries,1
"Check out> @userÂ¢Ã¢""Â¬Ã‚Â¦music that makes you feel something. #London #UK",0
My dads letting me drywall with him for Christmas. Just what I always wanted.,1
I'm fricken peachy today!!,1
"She heard Him cry and His little fingers & toes were counted and Mary exclaimed ""He's PERFECT!"" Oh Mary, you so cray cray.",1
"Sarcasm incoming: This weekend is going to be such a great time being grounded with nothing to do but homework, gunna have a blast!",1
"@user ok thanks,one more question: does a Computer Scientist take the same salary as a Computer Communication Engineer?",0
@user @user missing the bants at work today #ha #ha #ha #shitbants,1
Fun fact: I have a color guard rifle named Stitch after I got stitches from it plus Stitch is my fav!,0
Why couldn't I just stay sleeping,0
"The Interview has been cancelled, not because of north korea but because the immense comedy would blow our mortal minds",1
Happy Monday! Hate mondays.,1
"She's a uniter.   Most people, regardless of political affiliation, can agree she's horrible.",1
I love how when I'm stressed my body decides to react by causing me massive pain.,1
I keep telling my friends I'm busy they need to stop blowing me up but they just can't stop http,1
Earn cash by Posting & Tweeting! http Get started at http #homebasedbusiness #LOL,0
"This assumes Warren runs, but I'm not sure she will.",0
"Boehner, the perfect example that you (anyone) will not get the government you need, but the one you deserve.",0
Lol my mom can't text and talk at the same time,0
#All #And #For #Hot #Rachel #style #fashion Please RT: http http,0
Kid who tried stealing tools from me is now mad cuz someone took his hot sauce out of the fridge at work #Irony,1
"I like how people freak out when they hear I'm still getting paid while I'm off for over 2 weeks. Join the military, duh.",0
http << Don't know how this didn't get to number 1! #accounting #absolutetosh,1
"@user kids don't need schools! Schools just turn them into gay atheists, gaytheists, if you will. #sarcasm",1
"Walking down the mall in front of a group of guys and hear ""even the momma got it"" Jesus lol everyone loves polly",0
"Isn't this blaming the victim? #sarcasm RT @user Every year, 600K college students are injured while drunk. http",1
..what a great start to my day,1
Dark grass does rustle. www.MonsterMMORPG. com #brakiest by #MonsterMMORPG #mt121 http,0
@user @user not bad for a kid from Az. Hockey doesn't work in the desert.,0
Oh the @user .@user You would not need to take to twitter to peddle piffle,1
Ay after 2 hours nareceive ko rin yung message haha thanks globe,1
"I have a feeling the ACA will be that little taste of actual health care that makes the American Public say fuck it, I want Universal Healthcare.",0
Is there a basketball game on today? I'm not really sure. #ESPN seems to not be promoting anything about it. #sarcasm,1
"""I love that when a female expresses herself in an emphatic manner, it's always attributed to her menstrual cycle."" -Mags #PMS",1
New homeschool year. New Marketing business. Clickbank University. Wealthy Affiliate. Writing the book finally. #holyschedule #needanapp 0_0,0
where in the article does it say he has a faith in god?,0
then there's this @user @user @user @user @user http,0
@user: One day I want to travel with my bestfriend http DONE DID TRAVELED DA WORLD!! @user,0
@user @user @user @user @user Probably folks like #FullMcIntosh who don't buy games. #gamergate,1
make up hours sound fun.,1
@user buuuut fast iteration and prototyping to production-ready code!,1
Woke up crying because of the nightmare I had... gonna be a great day,1
@user ****ALERT**** PLEASE CHANGE THIS... ITS ME>>> #NowPlaying Relentlezz @user - Who I Be :: Tune In: http,0
@user what time is the UFC press conference tomorrow with names of numerous fighters getting cut,1
@user @user Hey maybe you can reach the scoreboards and fix their latest issues,1
Cool to know I have people I can talk to when having a shit night.,1
No one up? Okay cool #not,1
Imagine if schools spent $70 million on education.,1
@user @user @user that wasn't a choke hold the officer was trying to keep #EricGarner from falling forward.,1
why do a lot of his sentances end with '*mas*'?,0
Lol RT @user: Wouldn't surprise me if Soldado bangs in a hatrick and we win 0-3 against Chelsea tonight .. The legend is back,0
@user oh so someone got in trouble for making fun of the people who behead innocent people...nice,1
@user @user @user is this your first visit to a comment section?,0
I love how sometimes I am skipped over so the greeting replies are just towards Odin but not me.,1
Gripping new ebook not for the fainthearted or politically correct. Please visit site http,0
"Honking at me whilst you drive past - so romantic, it makes me want to trace you through your number plate and be with you forever",1
@user this is not real life. believe me.,0
@user nice. We make it in a pot with butter & Himalayan salt. Sometimes with infused salts for a change.,0
Xmas on the blog feat @user and @user * Read our story and share the LOVE Click the link... http,0
"tried to export an azure vm, well that went ok #sarcasm #vmcorrupt #thankyoumicrosoft #startalloveragain",1
"What I want to know, what has he down that 37% of people approve of?",1
Just snap chatting my sister a few times.. #shelovesitwhenIsendthatmany http,1
Every inch of you is perfect from the bottom to the top UNLESS YOU'RE SKINNY #Shade #Sarcasm #TheMoreYouKnow,0
ugh I hate how they act like they care about veterans day,0
So ill. It actually hurts to breathe. Still that nice long walk to the station did me the world of good #not,1
Funny your the broken one now Im the only one who needed saving.,1
http now in the MALLS! TAKE YEARS OFF YOUR SKIN! SEACRET Minerals from the Dead Sea!!! http,0
"danniella westbrook went to a food bank she should have gone to Iceland, oh yeah she fucked that up too #freedomofspeech",1
Write hundred tweets on Kejriwal every day and then go on to declare that he is irrelevant when it comes to Indian politics!,1
Seems like all is forgiven regarding the Republican brinkmanship caused government shutdown.,1
@user we don't have a good enough singles depth atm to even account for doubles the problem has never been doubles always singles,0
seeing ppl walking w/ crutches makes me really excited for the next 3 weeks of my life,1
These girls can wake up people from the dead! #worth #watching,0
@user oh lordy! Eating out was the hardest or going to someone's place. Esp as I don't eat meat.*eye roll* what can we feed her?,0
Pretty sure I just sat behind @user in the McDonald's drive through and peeked to see movie what was playing,0
that is the face of a tired man hahahahah,0
Girls who dip>>>,1
Well you just have to look... Don't you ?? #wrestling #SportsEntertainment #wwe #raw or #smackdown #co... http,0
#Dallas #traffic I sure missed you! @ Downtown Dallas Traffic http,1
This is also the kind of shit that'll be on r/cringepics,0
We may be some time. #Hibernot #Not http,0
"@user @user @user @user @user Come on lads, you're fucking better than this shite you keep showing",0
This favors aetheists so its religious discrimination either way,0
Follow> @user and get your FREE DEMO of their industry buzzing app seen at http,0
Yes it is much more logical to support criminals & attack police officers for protecting life & property. #HandsUpDontShoot,1
So there used to be a crossfit place here... #irony #pizzawins http,1
