text,label
@user - Russell Brand discussed today how much his London mansion is worth..and Marx was married to a baroness #scum #weak,1
I like listening to dads truck drivers tell me about them going to the strip joint and their old lady getting mad at them over it,1
Hi @user not a single vote was polled in 3 polling stations of Kulgam #Kashmir & im tuned into @user :p thnx #KashmirBoycotts,1
I think you mean people that they will be hiring in a few years.,1
@user definitely consult a tax professional on that one.,0
@user I'm hurt but I still love you,0
maybe i should delete my facebook tab- cause then i'd probably get more stuff done and be less distracted,0
"Day 4 ""joyous day"" #decemberchallenge #picture speaks for itself #costateguise #beach#peace#2nd home#... http",0
"Spiky popularity of the name ""Spike"" in the U.S. RT @user Baby name . #dataviz Source: http",1
@user @user For the masses. I love it.,0
Cannot wait to be home but gonna miss alot of people ah roll on the new year #sligowillbehithardagain,0
Thirst will make you settle for a grenade bruh,0
I love it when adults act like children. #eyeroll,1
650 return flight. Why I love my family. #familyvacation,1
"Then they are printers, not journalists.",0
internet got me like #stillalive http,1
Eskom load-shedding hammers the Rand again: http Current spot rate USD1=R11.45 http #VivaANCviva,0
@user: http #fitfam #fitness #health,0
People aren't as beautiful as they look #people #beautiful #look #walk #talk #personality #love #care #share http,0
Shoes on make-up done ! I'm ready,1
Thank you for all your Retweets @user #TopForm,0
Still time 2 enter my @user sample #giveaway on my @user channel! Check it out here http #modere #bbloggers #beauty,0
Christmas alone how nice #not,1
"The whole #Misogyny thing is hanging in there with Women from the right . A cat fight now ?, imagine pulling that on the left #pmlive",1
College Freshman tells his teacher he will be 'more cautious' with his homework...,1
"The Bay Area storm is so big that tons of people's work was canceled today, causing me to be early to mine. #irony #stormageddon",1
Porygon2 #are found in the www.monstermmorpg. com #wild. bulbiest follow @user #working,0
Aren't you just loving the snow? #Stockport http,1
Those that are #BritishRoyalty should Not presume #Titles or do any #PublicDuties,0
@user @user @user @user @user @user - Dutch+Northern theres combo not speaking yr mind,0
"Welcome to metro RT @user: ""Thanks to Seattle Prep for finally removing their starters up 34 with 3:30 left. """,1
"Why is it so hard for people to cover their mouth when they cough?? Specially old people! Wtf, isn't it common curtesy? #coveryomouf #nasty",0
"And that would make you a homophobic, regressive douche bag with a gay child.",0
Everyones full of ruddy xmas cheer here,1
"whoever just did the hunger games whistle on the quiet floor, I applaud you on your originality and cultural relevance #oldjoke",1
Sneaking in a round of mini golf at #hollywooddriveingolf at #universal #citiwalk before the kiddos... http,0
Something like a CVD type 3D printer?,0
"again, your myth of ""racist DNA"" is still only a figment of your delusional imagination @user @user @user @user",0
@user :)) thank you so much. Such a generous display of kindness from your side.,0
sea-tac and seattle are not the same place just so you know and that will not effect seattle workers as the headline implies.,0
Cheap and expensive http,1
Watch father and not his daughter FUCK http #Old+Young #father #and,0
#sotrue #ihavenolife #misshim #lovehim #haveabetterone #Justin #no #justinbeiber by grandtheftauto_five_troller http,0
"They decided 2 change King's trunks 2 gold, his logos 2 green & his tights to blue. How creative. .",1
Video: #im#not#the#only#one#you#think#im#crazy# ahhhhhh http,0
"If she has aides that update it for her, they could be on furlough.",0
"@user ""Dirk's got a lot of moves I'm trying to steal."" - Kevin Durant on his one-legged fadeway",0
The fans needs to be heard tho RT @user: @user @user WENGER WILL NEVER QUITT.SORRY LADS. FOR FEW YEARS..,0
I feel she didn't love me :/ :( :( #im #ok,0
@user @user @user @user @user @user I am so immensely sad about this.,0
@user @user But it's not a time capsule! It' current in time,0
"Irony died 1000 times during the climax of Sholay, when the police urged Thakur not to take the law into his HANDS. #Bollywood",1
"Facebook owner, Mark Zuckerberg, says ""dislike"" to creating a dislike button http",0
"Woke Up , showered , made a lunch and got ready for work only to realize that I have the whole weekend off.",0
@user @user @user @user @user @user,0
Yay time to clean... so tired,1
@user when dad calls me by this name we often go into a fight .. You want a fight ?,0
Turning in my paper then coming back home and studying #perfectday,1
@user Do you think Mary's parents believed the bubbemeinseh that she was still a virgin?,0
First nigga to grab it from behind No homo,0
"you do know the ""hands up, dont shoot"" thing has been proven FALSE right? @user @user",0
"@user Technically, we aint muzlamics until we believe in a guy lost in a cellar as our saviour. #TrueStoryFam",1
@user I see your response time on your DM's is as good as your phone lines.. just no hold music. Legendary service guys.,1
Love waking up early in the morning #HockeyTournament #RefLife #Zebras,1
@user @user spawn of Larry Ellison aka World's Worst Human,0
We hold these kids back... #RUT340,1
Wish I was still in bed with @user #ICouldSleepForeverRightNow,0
is when someone has been quite vocal against liberals but at the same time supports @user :),1
Yeah this is so cool just fucking woke up,1
Your Jedi mind tricks don't work on me service guy. Glad I dropped the car off for the oil change instead of Av.,0
"Let's just hope Nene isn't too hurt. Day to day instead of week to week, please. #praying #basketballgods",0
Bitches be like ... #more #appointments #please #not#crazy#enough ... YET @ orthodontist http,0
Dang my selfie game is on point when I'm drinking #actuallysorry,1
Check this out! so #ugly #christmas #sweater #ebayipad http,0
@user wtf where did you go,0
@user @user @user @user true that! We just keep giving them with no return #charity,0
@user I think you should go get checked out,0
It is always nice when I am taking a cig break at like 2am at my house and I hear weird creepy noises and its really dark,1
Love being called into work on my morning off after not even 6 hours of sleep. #thanks #splitshift,1
"Seriously tho if you need me anytime over winter break just shoot me a text. Probably won't respond cuz I'll most likely be eating, but hey",0
"#notcies #eu Liverpool workers ""miscarriage of justice"" victims http",0
"None of the big, disruptive innovations in our lives have come out of brainstorming. -Bruce Nussbaum http",0
@user @user @user #WatchOutForThis Hold the line,0
I love how when I'm stressed my body decides to react by causing me massive pain.,1
: Historians collecting correct facts about wrong abuse. #Correct=#Wrong #FactAboutAbuse,1
"Love the way @user says fault from last night will be fixed by 4pm, only to see a man in a van pull up at 4pm to fix the fault #irony",1
- Road safety campaign donkey killed by car http,1
"Think i almost just died, or burned my face off! #hategasbbqs",0
"Quick feet in slow motion ! Never stop loving , knees high , arms moving ! Still a lot more to be done... http",0
Kiwi Heineken? - Drinking a Steinlager Pure by New Zealand Breweries Limited @ Raglan Golf Club -- http #photo,0
🇱🇱🇴🇼 THIS: #TSU website now worth $1.5 Million! You get paid for posting! http http,0
It's too early to be awake!,0
Cannot wait to go to the dentist later!,1
#MY #Husband is your concern #StopTxtnHim its #NotOk #youknowwhoyouare!!!,0
The perimeters around this relaunching were kept incredibly vague so the administration would be able to call any outcome a success.,0
I couldnt help myself.. I am a bad person... http,1
"@user: "" It's the freshman semester of my first year..."" #ohanya #finalsamiright",0
@user @user @user @user @user @user mmmm,0
"Grandma's coming over, yay money. #lol #kidding",1
"Um, really @user? #nothanks #UVA http",1
Oi na how am I functioning right now #sleepdeprived,0
@user get around them,1
Carbon everywhere :) #carbon #hood #sticker #strips #down #red #automotive #dope #cars... http,0
"@user Aww, you poor thing, I feel so bad for you being in sunny Florida. I don't know how you can handle it! ;)",1
How were your #holidays? We'd love to hear all about them!,0
@user and if Marathi man speak hindi to Chu*** samajhte hai #irony,1
Kisses to you bc you lose wisdom today...from your mouth #clever lol I love you text me when you're able http,0
I find this farrrrr too funny #wow #can #u http,0
"@user wow, that is some fluent finnish",1
There's nothing like almost rear-ending someone because they slam on brakes for no reason to get you alert and ready for an exam!!,1
@user and yeah I set it at 130 not 150 because overworking your rookie pitchers is totally okay,1
@user Is Naughty Dog going to be there? #TGA,0
My favorite color is every color.,0
I have three test and a two dance performances tomorrow!! #EasyDay,1
No one up? Okay cool #not,1
Nose is stuffed.Awesome.,1
@user There's so much less controversy now that the BCS has been replaced.,1
"@user I don't blame you bro, if i was married to @user I too would support Milan http",0
"Perfect example: me.  I pay about $6000 per year for health insurance.    Never had to use it until this year.   (Pain in kidney area, trace amount of blood in urine, dehydrated a lot, working outdoors in the south) Gee, I bet I have a kidney stone...  Google agrees $6000 insurance $1000 deductible $1000 in co-pays, 20% of bills for cancer tests, two rounds of x-rays, ultrasound, etc...  $8000 paid so far.   Guess what?   I have a kidney stone.  Good news, there's a procedure available that smashes the stone, but you have to be anesthetized, needs more tests before we can put you out, bloodwork, EKG...  Another couple hundred dollars.  And the procedure?   I will owe 20%, which is $3000.  I don't have another $3000, so I can't really afford to have it done.   Am I risking future kidney function?   Possibly, yes.  Total bill for kidney stone:  $5000 $6000 for insurance $11,000 Total, if I want treatment.   If not, suffer.   I can't currently afford it, so....  Awesome, huh?  EDIT: Oh BTW, my deductible re-sets at the first of the year, so if I don't get this done before xmas, it will cost $1000 more next year.  TL:DR Fuck you America.   Get your shit together.",1
@user Warwick Davis is more than twice the man Tony Blair is,1
"The counter argument... RT @user: If OSU lost last night, Baylor would be in & we'd all be talking about benefits of no Big 12 champ.",0
My prayers have been answered WE OUT,0
... @user slaying in Igloo Australia's home country lol RT > @user: Nicki is SLAYING New Zealand! http,1
Soooo deep #narrowminds #stopwatchingthenews #andstoppreachingoffyoutube http,1
Quit lying paying less tax is not welfare and cutting food stamps is not a tax increase.,0
because learning for the finals is fucking amazing.,1
"When someone on a conference call talks about ""housekeeping items"". Grrr.",0
"Second day in a row that I'm late to work. Thanks, @user. Service definitely worth a fare hike. http",1
"Even if you don't believe in God or Psychics, you gotta follow your gut man.",1
"""Meh...i don't think I'm a suit person."" ~ Neil Caffrey #TvQuotes #WhiteCollar",0
That 2-hour sleep put me into hyper mode,1
@user @user I will let @user know - I'm sure he is shaking/quaking in his boots. #not,1
I'm sure it will pass..,1
Time for babygirl and I to get our beauty sleep,0
Gotta love being lied to... #not,1
When all else fails... http #relationships #needs via @user,0
"*rushes to take the ""Which Christmas cookie am I?"" personality test*",1
Photo: Orchid Tassel Chain Mermaid Dress $39.99 Onesize Leave email for invoice http,0
Officer #Jenny is a single www.MonsterMMORPG. com #entity. cestas follow @user #dancing,0
"@user she went from a faded orange mess to a dark brown with red streaks. I, of course, forgot to take pictures.",0
"Breaking news! RT @user: Mario Balotelli isn't a team player, according to Adel Taarabt http",1
Brother we don't look alike #not #frère #family #lovehim http,0
I wish I could make people like my personality,0
@user oh my fingers stick together,0
"can the next person who wants to educate me on any point please be very bloody educates before they speak to me, getting bored now",0
@user Its called @user,0
"Quel domage RT @user: No Canada: Bills in TO series, which was a colossal flop, has been cancelled http #CFL #NFL",1
@user @user hahaha u talk abt policies..just check delhi dialogue page..are u from another gola lol,0
"@user yep, that's what they say.",1
I enjoy stealing my husband hat every once in awhile #heyyall #GoodMorning http,0
"@user @user @user My,Nephew stopped a lot. His long hair. looks like a drug dealer. Never smoked anything Pills?not an aspirin.",0
@user I hardly think @user give a shite about the fans tbh,0
Can't wait to work with the dream team again today!! #delilyfe,1
I think I might be an artist #flowers #pretty #love #beautiful #painting #art #nature #lchs http,1
@user @user @user #Already dividing One from another! Good,0
"@user @user You're familiar with Matt Bubsy, #then.",0
"I used to joke around about my cats being able to open my doors, never expected it happen.",1
Love coming to school knowing I have tests all day,1
"@user Hey, now. Her profile says ""I Heart Jesus"" so she can't be all bad. @user @user",1
@user wtf thanks for saying bye,1
Over a third *of Americans*.,0
"Salt n Peppa's Geico commercial is literally the best, ever. Only one that beats it is Hump Day.",0
I just loooove arguing with the Insurance company.,1
I love 14 hour shifts,1
I feel a nap in my near future. #NapTime,0
people speaking of law to protesters who are fighting for justice themselves... #ModelTownNotForgotten #PAT #PTI #GoNawazGo,1
"""@user: Love randomly waking up at 5:43 am "" me everyday multiple times",1
Lesson learnt? Herd of sheep who fought over TVs on #BlackFriday struggling to sell them http #irony #capitalism,1
Ugly Christmas Sweater ;** #uglychristmassweaters #happyholidays #merrychristmas #kissesandhugs... http,0
Have you lost your zing? Working too hard? Check out my latest quickie: http #habitually #internetmarketnewbie,0
Left my lunch at home. Swansea canteen outdoing themselves with this generous and well priced portion of food http,1
"Why?   We've got more money than we know what to do with in the USA.  We've got people paying $5,000 to sit in the stands at Fenway to watch a ball game where a 29 year old pitcher is getting paid $2 Million Dollars....  We're not broke, we've just got our priorities all wrong",1
"A woman wearing a t-shirt on @user that says ""Act like a Lady""..",1
Image via We Heart It http #boy #funny #girl #K #mad #ok http,0
there are things we are made to go through to harm us but to given us a lesson to teach to someone weaker,0
!! @user #2n1Edition @user @user @user http,0
@user is that ?,0
"Stop trying to make me post my location, twitter. I don't want to post my location. Stop.",0
#ff By ideiasdebolosdocesedelicias. Such a different twist to the regular #frozen cakes :) We love this one! ... http,1
marty posts FACTS with PROOF you? you make shit up @user @user @user @user,0
Who accepts this challenge? Who's Next? Ends Soon. Be A Ten Executive & Founding Member. http,0
"I'm a college professor.  Incorrect attribution isn't what happened here.   He plagiarized.    I'd report him to the university, and he'd either get expelled or at least put on academic probation.",1
I hope we get an ice palace and an invisible car #SPECTRE,1
@user @user Ya cause their country is calm and peaceful from Everyone arming themselves,1
Insanity is doing the same thing twice and expecting different results,0
I'm over these white hoes,1
"Because the House cannot vote on a bill unless the Speaker allows it, and Boehner and his compatriots have been planning this shutdown all year long.   Why would they allow such a vote to take place until the country can be sufficiently damaged and he can start pointing fingers everywhere else?",1
@user for the brothers ah-ite. http,0
For some reason I feel the classiest when I'm wearing $3 fake pearl necklaces. ? Lol,1
love taking the subway alone at 2:40am,1
"Take me to church...,.",0
"I need to get up, but Sasha is way too cute!",0
"@user @user I mean Zach is a teacher, amirite?",0
This photo of @user 's pool via @user has really brightened up my morning... http,1
Air Passenger Duty for under 12s to be abolished. AT LAST! Something to help the homeless and impoverished! #AutumnStatement,1
Aw thanks mother nature. Merry Christmas to you too!,1
"@user #ChrisChristy will do well among republican voters.#JebBush, I think he could do well, democrats don't like him.",0
@user: Looking back on Saturday night like... http @user You about Thursday,0
imagine if there was a virus that would wait until the computer is idle and 3d print a very detailed penis for you to find when you get back to your computer?,0
So there used to be a crossfit place here... #irony #pizzawins http,1
@user @user @user hmmmm. I wouldn't say she has tits,0
Photo: Tuxedo Jumpsuit Sizes:Small-Large Color:Black Price:$65.00 Leave email and size for invoice http,0
"@user just check out the buttons, see what they do. And follow me back",0
@user you are by far the funniest prick in the world at the moment. Can you please come to Geelong? We have a normal mayor...,1
Is there a basketball game on today? I'm not really sure. #ESPN seems to not be promoting anything about it. #sarcasm,1
Good thing we have an ace like Clay Bucholz who is proven to be durable and consistent... HAHA.,1
My favorite thing is waking up at 4 and driving 20 minutes in the snow just to see this bitch ass #Not #PaneraProTeam http,1
Today has been such a shitty day,0
Uhhh can't sleep someone like n I'll text u my phones dry ass fuck fr #am #a #boring#person,0
"@user feeding your own flesh and blood/making an alley way smell terrible = same, same. #90ssarcasm #thesun #thingsthatarewrong",1
@user a day or two after.,0
When u callin I'm tappin lol sorry,1
@user get ready for another one on Saturday,1
"#Sagittarius know what they want, if they can have it, and they always keep on thinking bigger.""",0
@user @user So is he banded from wearing the clothes? #Karma,1
Today is already shaping up to be fabulous,1
Love people that don't act like adults.,1
"Don't be offended when you hear #HappyHolidays when people refer to #Christmas. The word 'holiday' is derived from ""Holy Day"". #fb",1
"The Interview has been cancelled, not because of north korea but because the immense comedy would blow our mortal minds",1
@user Sorry butt,0
"sorry for being female, I didn't mean to interrupt your perfect little man-world.",1
"@user No, voting somebody in because they're from Latvia is way more important than voting for the best players.",1
"We need a #Democracy #CoPocracy!!! #Police, #MorningJoe! #BlackLivesMatter #DemocracyMatters #Ferguson #EricGarner",0
.@user yeah. Tones are the most obvious things in tweets.,1
"Workaholics: if you're sick, don't let that stop you from bringing your germs into the office. We all appreciate your commitment.",1
Stupid #doctors visits is gonna bury me!! Now that's #irony,1
Americans love guns more than ever! http #Chicago #Detroit examples of strict #gunlaws yet have the most crime,1
This nigga knocced back 6 shots of Henny lastnight ! @user http,0
"@user @user wow. That here though, sorry grandpa, we use mac these days #WelcomeToTheWorld #NeverArgueWithFools",0
@user *kisses you cheek* that's enough. im not a love bot.,0
"not that I have a problem with the message, but al sharpton isn't the sort of person I want fighting my fights",0
@user heh as if @user and average work in the same sentence!,1
"Does anybody remember during one of the debates how Obama said he was proud to call it ""Obamacare""?",0
"@user as long as it's for taste purposes, that works for me. Are there any meats you like?",0
"@user Not going this time, we might have a chance! Fool me once, shame on you, fool me twice... #fuckthat",0
@user @user I'm surprised my coanchor hasn't already nominated me for the worst list.,0
Some days are just better than others..,0
"The silence in #TimesSquare for #EricGarner last night is only broken by #NYPD siren. , watch on ifussss app. http",1
@user wow.. she really touched them with that tweet.,1
Scalia couldn't be effective without help from the other 4 corporate justices.,0
"@user yes, we officially try that. #Gamergate",1
@user @user The Greatest Unsolved Mystery = God!,0
I'd rather you know and be upset than hide it for you to only question things later,0
Happy Birthday to me! #imgettinold #not #ionlygetbetter ROLL TIDE! http,1
"He's obviously making this up.  He may not realize that, though.",1
"I have a feeling the ACA will be that little taste of actual health care that makes the American Public say fuck it, I want Universal Healthcare.",0
"Ouch.  Don't hold back, tell us how you really feel.",1
Another @user moment. We can't be bothered to fix your broadband problem but would you like to buy an Iphone6 of us! HELL NO!!,1
@user my 7-year-old got it for me! I think Macy's http,0
@user @user I accept him the way he is...,0
"What the hell has happened to Shahid Afridi in last couple of days? Left alone more bouncers than played, got a review right. #pakvnz",0
Towing company commuter car being towed. http,1
"@user, @user told to stop work under crew contracts #irony http",1
"#Russia #says #new #U.S. #sanctions #may #hamper #dialogue on #Iran, Syria. http via @user",0
Acronyms because we're cool as fuck. Judge me. http,0
"@user @user Darn, my sock joke needs fixing?",0
"HELLO Sunday! BY THE WAY IT'S December 28, 2014 at 02:15PM! (just a random information)",0
Flight diverted over boiling water incident http,0
Throwing up on Christmas morning is my ideal way of spending it.,1
"Looking for @user practitioners... Anyone out there, or recommendations?",0
Loving how dominant the SEC is #Pause ... #Not,1
Haha who the fuck says that to someone#TrueGentlemen,1
"#OrionLaunch go, no-go, go, no-go. I'm getting dizzy... Imagine if there was a crew in there - how stressful would this be?!",0
Another day just livin the dream #needmoremoney,1
@user the good old days!,1
What a golden morning. #not,1
"From our upstairs neighbors deciding to do a load of laundry at 12am, to the 1:30am freight train, falling asleep is working out great!",1
A very powerful statement by Rob Hustle on a growing crisis. #ICantBreathe http,0
"@user FUT14 ofc, the corners <3___<3 they where faaaantastic",1
#finalsweekgotmelike Ugh. Make it stop. #finals #finalsweek #EWU http,0
I'm so ready to get drunk tonight,0
@user Thanks for pirating my music! :D #not,1
@user tis the season for unwanted gifts!,0
@user BREAKING: #realjournalist bullying major problem in nation's high schools.,0
"BM ""gives me"" from 3 pm to 8 pm with my son today, that's fair huh? #NOT!",1
"#Love is far more important than #money! The problem is, you only know it once you have money! #life #humanity",1
"It is the difference between me knowing that you are an idiot, and you thinking I am evil.",0
Going to my class #fuckyou important,0
: Entertaining journalists collecting facts about annoying dentists. #Entertaining=#Annoying #FactAboutDentist,1
@user @user @user That is fine company!,0
"@user Unless rogue theatres start showing it, or it gets sold online?",0
"@user if you don't want to upgrade your iOS or keep many pictures, yeah it's great",1
Stop being the fan. And be the person blowing minds.,1
"Sony got hacked again? Oh man, big surprise... : http",1
Normalizing relations with Cuba? Huh. Get ready for more of this crap. #ThanksObama http #bad,1
Pulling my books out to prepare to organize my new bookshelves caused me to forget to bring my book today. #irony,1
When someone with retrica wali picture complains about how many filters someone has used in their picture to look pretty..,1
I love context and large ensemble Fridays!!!!! Der my most favourite #Sarcasm #GetTheFuckOut,1
#TortureReport trending; I wasn't aware J.K. Rowling released her new book.,1
RTed that because yeah that totally makes sense,1
It's super duper fun waking up and immediately shoveling your car out of your driveway for 20 minutes #fuckinsnow,1
Hiding in plain sight. By #MichaelBeerens (http #graffiti #streetart http,1
"If he wants to keep it secret, the word wouldn't get out.",1
@user To the officer's defense...that was a very scary looking phone. #BlackLivesMatter,1
Worth a read. On #Christians and the persecution they face. #equality #respect #sectarianviolence #countyourblessings http,0
@user @user Answer 2- More than 150 artists #WinSunburnPasses,0
"when you refer to yourself in the plural, you'll get that @user @user @user @user @user @user",0
Having nothing you studied be on the test is just fckn greaaat,1
"Been the problem, actually. RT @user: @user tough road trip. cant win em all but coaching has not been strong.",0
"Christians can't be Republicans either, but you don't see that affecting them.   Jesus was all about helping the poor, giving out free healthcare, and kicking the moneychangers out of the temple.   He was also pretty cool with taxes, very anti-war, and non-judgemental.    Doesn't seem to stop Christians any from supporting the political party that's completely Anti-Jesus.",1
People in this school seem to amaze me..,1
So they waste billions a year that cannot be accounted for **and** penny pinch by pirating software?,0
I can't even begin to explain my frustration.,0
waking up congested/not being able to breathe is a great feeling.,1
