text,label
"Appreciate @user that he has spared suspending our accounts, only blocked us.",1
"Yup!  Don't know why more Christians don't follow this.   Oh, wait,  its not hateful and it doesnt further their agenda.",1
Wow I feel so bad that you had to actually do your job as a teacher. #stopcomplaing,1
You are using stereotypes to fight racism.  Bravo,1
@user it's been over a year since you tweeted. #DoinItRight #MaybeNextYear #NewYearsResolution,1
hmmm. I do wonder why Astec has one fewer employee? #lol,1
"@user @user What on earth does that mean ""Cloud vs Mobile""? It's Cloud-Mobile - or basically Client-Server 2.0",0
"And right after this [someone in the audience fainted](http://www. youtube. com/watch? v=7J80mVXvs64).  Obama was able to pick them out in a crowd of people, diagnose the issue as not serious from the stage, and then get them some water.   How could anyone not love such a compassionate and caring leader?",1
@user I wonder what % of that 43% agree on what a private cloud is,0
That was the cutest thing ever,0
"Yep, true patriots all. http",1
Nailed it #yesimreadingthisbook #catsofinstagram #catstagram #ilovemycat #pawproject... http,1
@user @user I love button pushers!,1
I liked a @user video http The Ubisoft Graduate Program - Gameplay Programming,0
"2 a.m., just went to bed #Twitter #Sleepy #2am http",0
I love waking up with migraines,1
"""@user: I can't stand watching a #UKvsLOU game with a Louisville fan! They're as bad as Steelers fans. #BBN"" @user",1
I keep telling my friends I'm busy they need to stop blowing me up but they just can't stop http,1
"I believe nothing the Obama regime tells me, I believe a lot of what the Iranian one does.  [**Iran threatens widespread retaliation against US and allies**](http://dailycaller. com/2013/09/10/iran-threatens-widespread-retaliation-against-u-s-and-allies/#ixzz2lo2bVVso)",1
http so Ugly Christmas Sweater Women's Sz M http,0
http://en. wikipedia. org/wiki/The_System_Has_Failed,1
Omg @user didn't tell @user he was in town #trueFriend,1
@user At 2:30am? Who's gonna favourite it? An owl?,0
I loved the laugh of restraint we saw the other guy give when he spewed this shit.,0
Well it's always a good time losing at the Bay... @user @user @user,1
much!!,0
@user thanks for the wake up wrap and coffee this morning!! #CheapBastard,1
Library computer has frozen again #shocker,1
"Maybe, but my gut tells me these elections aren't being bought by the local versions of American Crossroads and Restore Our Future.",0
I would be more in favor of a flat 20% tax on all income above $25k usd no deductions or exemptions or credits.,0
@user Home page at 8:30am shows Dow -51.44 but it's +102.75. Can you make your home page stats more real-time pls? http,0
@user @user aren't most legislators' list of legislative accomplisments the past 8 years short?,0
"Patriotism?  We're Christians, not patriots.  I love all of humanity, not just 'MURICA.",1
: #BlackOnBlackCrime comitted by #BlackLivesMatter #Protest in #FERGUSON ? http RTs @ http,0
#what#matters#to#me#is#gym#holidays#work#the#hell#out http,0
@user @user trading a SP for a defense-only SS? Brilliant trade.,1
"K should give us a famous bf, some fan need an entertainment apparently",1
Plan on using the last 16% of my battery on listening to @user @user get through the day #big☆now,0
"Today I'm standing at the front of Tesco wearing an Elf's hat, saying hello to customers and getting ignored. #dreamjob",1
This is what you get when Republicans control your state legislature.,0
I am extremely excited to know what Reza Aslan and CJ Werleman think about what happened in Pakistan #PeshawarAttack,1
"@user @user I wish son. like I said, twitter, wit on twitter and the magic of photos that are 3D = smoke and mirrors effect.",0
"@user #PSA Hey Jay, I tuned in when u said ""why all the cocaine talk today...after tweeting coke joke saw it's Escobar's 65th",1
@user I don't think the Hereditary Baronet wants to encourage a something-for-nothing culture :-$ #irony,1
"So Ally McCoist hands his notice in and gets a pay rise,he really has Rangers best interests at heart",1
@user malay mo. its his real name haha. but still nice joke about na richard two. bagong bago hahahhaah JK,1
I just saw another person wearing a heavy winter coat with a hood up encouraging,0
If i were to ask. I want to stay here for as long as possible.. #thinking,0
Must not be much going on for Congress this week.,1
"don't hate the player, hate the game?",0
A voice of reason crying in the wilderness of hysteria. http via @user,0
What a pleasant way for Minneapolis' most prestigious publication to describe its female audience. http,1
The routine texting irks my nerves the most but I guess it's the thought that count #needAnewRoutine,1
"Cramps in the front, husbands knee in my back. Yeah. Sleep seems possible tonight. #suckitmothernature",1
Would they take it back?,1
"They aren't crazy, they're stupid.",0
I think this sample size is shit.,0
#Fact: #StarTrek adult onesie meets clothing requirements 4 Walmart employee. Just put on yr vest & a smile. http,1
@user He was caught attending...*gasp* a Latin Mass.,1
I don't think you guys are on-board with how important it is to get every bit of carbon out of the ground and into the atmosphere.,1
"No reply day! I mean, week! #Happiness",1
Wow I love school http,1
Little cutie #Chico #Dog #Doggy #Puppy #Sweet #Cute #UK #Black #Biscuit #Not #Mine #Mini #Miss #My http,0
In case somebody breaks in our apartment http,0
OMG YES. 7:30 FINALS ON A FRIDAY ARE MY FAVORITE.,1
I need to get out of this car before I kill my dad.,0
@user because it's much more important to unilaterally remove restrictions on oil and gas sector.,1
"http nope, you do NOT fit that definition @user @user @user @user @user",0
Love it when you can see people have read you facebook private message but they just don't reply,1
Stinker of a day... Nothing has gone right. Got worse as the day went on... #Ahhhhhhhhh #Depression #CantWaitForTomorrow,1
that fits @user @user @user @user,0
@user @user @user sure that will end well,1
Thank you Aidyn and Adele for getting me sick.,1
"""the environment"" ...  another strawman",1
Si Ms. Educ hehehe clear my ignorance,0
Just got yelled at by proxy. It's going to be an excellent day. #sarcasm,1
@user Huh? It's a graphical representation of what's happening. Nothing is out there to take a photo!,0
Glad @user is excited to see me...,1
@user @user Chortle. Would he have liked Palmer?,0
What doesn't kill you makes you #stronger ...I'm #perfect #mybody http,0
This kid right here makes me so happy #nephew http,0
Sub is making class go by so slow that I feel like I am losing brain cells. #irony #substitute #MoveitAlong,1
@user @user By definition placing money on the outcome of anything is gambling! Choosing to deny this is self delusion,0
When I see Larry Flynt I'm always disappointed he isn't Woody Harrelson.,0
"@user That was the case, not the recording.So comparing the two is apple & oranges.",0
"What I want to know, what has he down that 37% of people approve of?",1
Oh ffs my body clock is f'd #iwanttosleep,0
@user mocking a spiritually precious holiday for millions is just so courageous of you... #shameonyou,1
"@user A British world champion in one of the most demanding & popular sports on earth. Yeah, of course I'm being sarcastic.",1
"""My future? I still enjoy it (playing football) too much and I play with passion"" -Totti...oh no the team is doomed... #asroma",1
http celebs takes drastic measures to look good... #whoops #CelebrityLeakedPhotos http,1
"Damn Ted, you must think gods a pussy.",1
Yay for my family leaving & going to Seneca & leaving me to fend for myself.,1
Sports rock so hard sometimes.,1
Not enough natural Ghz for gaming.,0
"When a teacher says ""come in tomorrow morning for help"" but they are never in their classroom #wow #thanksforthehelp",1
FOR SHAME .. THIRD TIME ... Pregnant Duchess wears designer dress for the THIRD time in New York http via @user,1
@user They say #not #responsible and your #NotWorthIt to offer even $10 #discounts for the worst #customerservice I have ever had!,0
#Lebanon #detainee #is #ISIS leader's #wife: #Iraqi #official: BAGHDAD – An Iraqi official denied Wednesday... http,0
@user: DONT SAY ANYTHING JUST RT http @user,0
"@user @user good old JK landing people in trouble again, ffs William i thought you were more savvy than that",1
"The joke is that there might be *more* innovative people.  After all, real genuises have tended not to be so interested in money as they are so overwhelmingly interested in their work.  Did Mozart or Einstein need a ton of money?  Did they cry about not having three swimming pools and multiple Porches?  What if we were actually closing off the very best talent or simply ignoring it?",1
@user and what will that achieve? Seriously?To be fired.all the guys who had the balls to call them out are gone..,0
"If Jesus destroyed satan for our freedom, why is there still evil, Tom, huh?  Huh?  Why Tom?",1
"Less than 5 hours sleep, fantastic",1
and as much as I want to connect .. I like only the people who dont want to .. #Irony #Why oh why?,1
"My professors moustache is so uneven, Mohstash would be ashamed right now",0
Hoar frost is challenging for some to spell.,0
"there is no such thing as ""racists"" because there's only ONE race, HUMAN @user @user @user @user @user",0
Two people got me socks. Clutch af.,1
Fuck getting a flat tire and my car dying coming home from work at 5am. Thanks god for my friends. Great way to end/start my day,1
Oh this will end well. RT @user: Military-Style Tech Finds Way Into School District Safety Measures http,1
Only ones in the cinema #putting #my #phone #on #silent @user http,0
SCRATCHING THE NIGHT OFF MY EYES,0
When someone tries to play you and you already know their game<<< #stepoff,0
#notcies #eu Moscovici quizzed on extra time for three EU countries to hit eurozone targets http,0
"#Kaley Cuoco-Sweeting #apologises #for #saying she's #a #feminist: Kaley Cuoco-Sweeting, pictured with her... http",0
Getting Final Jeopardy correct on Kids Jeopardy boosts my self-esteem,0
Just found out there are Etch A Sketch apps. #oldschool #notoldschool,1
"Well, whether the government does anything or not, that percentage is likely to go down eventually...",1
I feel the most comforted when the misinformed are the most vocal. #pleasedontspeak,1
This chap seems to be a bit of an over sexed out going extrovert ... Must be his overly masculine voice and demeanor.,1
"@user well, people did ask where would have been without McCormack, and here we are",0
"""@user:The stuff press write about it literally ridiculous!""Would it be harsh to point out the lack of literacy here? #ghostwriter",1
I highly doubt that speech will do him in if he runs.,0
You know its a gonna be a good day when your roommate comes in saying she just took her aderol and is about to have an anxiety attack,1
@user @user I'd prefer the slew of #Ferguson protestors across the US...they stop traffic shut dwn bridges,0
@user @user We can vote Republican! Their Civil rights record and their ability to empathize is amazing. .,1
Knock knock #sketchy #dignity #smile #funtimes #brotherskeeper #whosonfirst #holiday #shenanigans... http,0
2 a.m. trips to Walmart for mess are always fun.,1
Can always #countonmother to impart #wordsofkindness. Especially on a special day! !!,1
"ABC Takes A Look At ""The Turkey Song"" by @user - Make It A Classic #Thanksgiving - http",0
Just delivered @user #cronuts to @user hmmm its for a customer I hope!!! http,1
@user @user republicans suck more at identifying #irony than alanis morissette.,0
The #Gophers aren't nervous. #SammyCommentary #Gophers,0
"In hell, along with the other false gods.",0
Not sure if /r/conspiracy or /r/conservative,0
"A #sale is #not #something you #pursue, it's #what #happens to you #while you are #immersed in #serving your... http",0
"@user now, to remember which book... #goodluck",0
"you seem super smart MT ""@user: @user @user #NO #BLEEDING happening in #WaterBoarding = it's #Not #Torture""",1
"My entire career has been devoted to being a BOSS in beating corruption, but I get beat in a corrupt election #Irony #SoCloseTilden #1Vote",1
"Impossible.  Obamacare kills jobs, I heard it on the talky and the picture box.",1
#Indonesia -- #Four #large #parts of #crashed #AirAsia #jet #found #on #sea #floor. http via @user,0
"&gt;Congress shall make no law respecting an establishment of religion; or preventing the free exercise thereof...  You can practically *smell* those ""Biblical Principles"", amirite?",1
So far today I burned my tongue on my coffee. Saw a dead guy on the freeway and chipped the windshield in the truck #gonnahaveagoodday,1
A true left wing group only a mother could love,0
@user @user @user When / how did the ACL tear happen?,0
"Heartless Sanghi #Sarcasm""@user: #IndiawithPakistan because a dumb nation deserves to be taken for a ride again and again. #Lakhvi""",0
"Where is the promise of ""peace on earth"" in this? ""Lord, Thy Kingdom come, Thy will be done."" http #Advent #terror #irony",1
"Hey @user, some of your geeky/nerdy followers need #sarcasm marker on posts like that. Otherwise, they'll start doing exactly the same :)",0
@user rollins was so pissed off haha,0
One of my favourite things about going to fanshawe is walking to the Z building,1
One of my favorite things to do is to make people wonder...it was completely unintentional but buying Bogs mud boots in a dress will do it,0
"We should lift the cap, at the very LEAST it should be set at what we pay politicians 174,000k.",0
The Penguins cancelled their morning skate today...due to icy conditions. #butseriouslytheroadsarebad,1
Bored? Check out> @user newest article - each word is linked to a ridiculous website! Try it out! http,0
I have plans. I feel sick. What a surprising turn of events.,1
Can someone please tell me where the video is?,0
#adanisJet lol @user: Irony committed suicide jumping from Adani's jet! #LoveJihad & #Gharwapsi orphaned! http,0
"Just a hunch here,but I think Steven Gerrard is leaving,possibly going to the MLS #hesnodeed",1
More in winning a sweet hamper at a Christmas fete the day after a jellybean damaged a tooth!,1
Increase the sample size to the last twenty five terms.,0
Im pretty sure that no one takes that guy seriously,0
Such a fun day in the lib studying Econ for 14 hours.. can't wait to do it again tomorrow #ThisIsMiserable,1
Shhhhhh...nobody move...they're playing a NON-electronic game together...NICELY!!!... http,0
work should be fun today,1
"So beware, when the cult ends, it's not usually by everyone realizing how silly they were and retreating to sanity.",0
"If a foreign power hit Japan's embassy in NYC with a missile, not really an attack on US. In that sense, I agree with you. @user",0
Watching VT and Cincy - qb for VT with (GODS) down left arm (GIFT) down right arm. - #irony #howmanygods #punctuationmatters,1
@user Loving how Fulham looks like a playoff team. #NotReally,1
"It would have been nice for the photo to be captioned with an explanation of the infamous event being depicted: Ryan ""washes"" already clean dishes at a soup kitchen that he made reopen late for his photo-op.",1
@user Aren't humans the ones who are playing the sport?,1
@user @user @user All the more reason for it. Competition breeds innovation & the consumer wins.,0
@user funny,1
"Thank you for this, good sir.",0
What they said last time.,0
http << Don't know how this didn't get to number 1! #accounting #absolutetosh,1
Being ignored is still in my top ten things I love. #sarcasmtweet,1
Mondaiiis to fridaiis without Huweyyyyyy #do #NOT #like http,0
@user @user LFC worst start in 50 years and still above EFC... that is funny!!! #WishWeHadA28MilStriker,1
"On a good note, only 49 more days until #Scandal.",1
"I'm always amazed at how willing liberals are to admit that they agree with ""the ends justifies the means"".",0
"Well today is off to a great start, might as well be Monday",1
@user No! I rarely drink at all. Got a stomach bug :-(,0
clashupdate #not http,1
@user oh haha no they ain't you ain't even seen em,0
"#Net #neutrality: #Cisco, #Intel, #IBM #warn #FCC #to #crack #down #on #ISPs: More than 60 #technology... http",0
@user I am sure this has made your day. LoL,1
Happy 2nd anniversary to me in SGV. Happy OT here in client. Woohoo. I loooooove my job. Super. More years to go!!!!!!!!!,1
"Cool, we can keep the governorship and take her congressional seat!",0
I give people a break 2 say that without my supporting cast that none of my works would of made it is tosh. Did nobody get #Extras,1
#Warn them that your degree of #sarcasm depends on them in this #funny tank top! Order now at http http,0
@user Feds doing studies of gays as if they are a different species. Add word lesbian before your study and double your grant $$.,0
one essay submitted now to start the next one :') #thirdyearlife #loveit,1
@user then I completely suck as a sub! Haha! going!!,0
Going to go into central for last minute present shopping #soorganised,1
@user Please follow me. I have a technical question. Thanks.,0
Who wanna hit the slopes? http,0
Be Blessed friends. Merry Christmas to all!,0
@user @user what???? No verbal submission?,1
@user @user @user @user @user @user @user @user 9 Followers and now he's relevant?,1
"@user Great job on reporting on a mentally unstable man and calling him ""drug crazed""",1
@user you mean... it doesn't mean 'so much hate'..? ... oh... orz,0
Did he talk at all about how he places personal religious beliefs over the civil rights of others?,1
#notcies #eu End to fish discards delayed - End to fish discards delayed Copyright EP 2013. From: Eu Reporter Vie... http,0
"@user happy birthday young one, have a gooden lad!x",0
@user #ThingsBetterThanTitansJags napalm hotwings #bigjoefavorite love the show #keep it real,1
@user Adrian was raised that way and he made it to the NFL. Maybe he thought that would motivate his kid to get there too?,1
I am so glad that I woke up early for this office visit to have to the mother not show up! #not,1
Another fantastic day,1
"they dip, we drip #fat #sumo #hippoes #happy #like #so #turtle #googlemapcibae #love #bij... http",0
"Race 5 at Sandown dogs tonight sponsored by ""Dandenong Budgie Club"" Hope that's a joke. Love a seat at that table #nerds #getalife",1
I already can't wait for Julia to come back.,0
so 93 million lose coverage so that the 45million who dont have coverage... can maybe get it,1
I just love being wide awake at 4am,1
"#A #tax #per mile? #Americans #should #not #allow #GPS #tracking #of #cars, #trucks: Watch out – as the new year... http",0
ayee love your lips trying to sound creepy http,0
It's not possible to have enough time,0
i just enjoy throwing up #not #hatethis #sick #wanna #go #to #school #for #once #take #me #away,1
Sadly his congressional district will keep putting him in office until they nail the box shut.,0
@user Ahem... yeah.. something like that ;)#irony is one of the few things keeping sanity when facing RU propaganda. #CrazyIvan,0
Someone needs to stop me before I kill someone love waking up in the worst fcking mood #Not,1
Your friends will bring you down because they fucked up what they had males & females me fool !,0
"@user transfer fund of £250,000 is given to ... Nottingham Forest a team with a transfer embargo.",1
Kitty aaaaint happy #cat #happy #today http,0
Loooovvveeeeeee when my phone gets wiped -.- #not,1
"I am anti-Catholicism and Protestant, but that does not mean that I am anti-Catholicism because I am Protestant.",0
@user I'm smarter than most people who lie to me. I have fun picking the holes in their stories.,0
I believe it is about #indoctrination & religious indoctrination either; but indoctrination into the future groups of #Lefties.,0
Who said that birthday girl can't celebrate the next day??? #celebrating #always #nighout #birthdaygirl... http,0
"@user Careful, Cayce. That's almost a racist statement. @user @user @user",1
25 Historical Images That Normalize #Breastfeeding http via @user. We're so more tolerant now...,1
isnt it the best when youre really tired then when you finally get in bed youre wide awake? I LOVE IT,1
"The funky taste of chocolate with the Chunky Monkey all just in a cup . George of the Jungle,Cup and a Lick",0
Stuck in traffic!!! #mondays #athensbyrain #traffic #ontheroad #ontime? #sisters #COOLURSTYLE... http,0
When you're in the doctors waiting room and hear a baby in the back screaming her lungs out is always a reassuring feeling #not,1
Anamorphosis:placing objects so that viewed from a certain angle they create an image. By French artist Bernard Pras http,0
Love #hiphop mix tapes or have a mixtape to promote check out http follow them on twitter #undergroundhiphop,0
Ooh! Someone knows how to click the 'Unfollow' button. I'm impressed! #beforeCoffee http,1
@user#it shows you that APC is a free and fair party#run by intellectuals#and this is what we call democracy dictatorship#,0
@user: Pick it up one more time for the homie in the back that's stickin right with us thanks for answering my DM #realmvp,1
Still feeling sorry for myself about being to ill to go out last night!!! here's my memories from... http,0
"#Mahathir, one of the godfathers of Asian values, Malaysians are ""stupid"", don't know how to run an airline #irony http",1
"hula hoops, hot chocolate and law revision. my breaks in work are filled with glamour and fun.",1
"Always ironic to see a guy like Reich, who's already made more money than he'll ever need, lecture the ""New Rich"" on how they are too greedy.",1
@user @user @user @user @user Probably folks like #FullMcIntosh who don't buy games. #gamergate,1
"@user Steve, Steve, Steve. That's Data. You'll never win any hearts and minds if you don't appeal for the poor polar bears",1
.@user Yup. That's exactly how we do it,1
So glad y'all can be awesome now..,1
Well on a positive note if I can stay awake for another hour I can go get my blood work done! #positivenote fun stuff,1
@user @user Yeah thanks for that!,1
"@user Hey Alex, thanks for the support. My FB page is : http and success to you.",0
"well now that i've listened to all of into the woods, i'm going to listen to some FOB #nosurprisethere",0
@user illridewithyou,1
in #Iowa. Anti-Union Governor #Branstad having inauguration & ball at #CommunityChoice Credit Union Center. A slap to #AFSCME #Homan,1
"1 bed flat #ToLet £550 pcm (£127 pw) Humphrey Middlemore Drive, Harborne, #Birmingham B17 http",0
@user yeah that's it,1
"replurks acatholicprayer: Lord Jesus Christ, Son of God, have mercy on me, a sinner! #Catholic #prayer http",0
My boy has another cold and spent the night coughing and sneezing all over me #sexy,1
Chill #Repost #Dead #Dominos #Haha http,0
"""The two constables -- Veer Pal Singh Yadav and Avnish Yadav - did not have any criminal record."" - NDTV",1
I still love the newsroom regardless of what everyone else thinks,0
"@user but if you feel like it's relevant don't worry about the word limit man, at least you're doing it",0
Gee faculty at nicholls are so helpful,1
Just a @user article re: a robot arm you can control with your mind. Meh. Nothing huge. #sarcasm #science http,1
"Whether or not you agree that what they're doing is necessary or good, you've got to admire their willingness to stick to what they think is important.",0
"Stop living like a king, you're not one So using this in real life. #ExodusMovie",0
Watch the wog head I will have after Christmas then #last #hair #cut #for #christmas,0
Andrew Luck is some kind of QB... Wowzers. #INDvsCLE,0
I know who I am. I am not perfect. I'm not the most beautiful woman in the world. But I'm one of them. #women #not #perfet -Mary J. Blige,0
"@user Wow, that is just so funny...",1
@user @user Well it's not any worse or better than 'Stark Raving',0
"""Too bad her cube doesn't have a door."" - @user #bestcoworkersever @user",1
"See, this is why you shouldn't use version control! #notjustWordPress... http",0
Photoset: leupagus: itsxandy: thefingerfuckingfemalefury: sevenpoints: getting paid enough to put up... http,0
Who would've imagined that #jakeplummer smokes weed regularly?? #outsidethelines,1
@user no u dnt hav to..bt sme ppl do...evn whn they do shit.. :-P,0
"""We rebooted the server, it seems ok now"" YEY! #facepalm #devops",1
"@user: @user: Me and Cam Newton will be engaged by the end of this year just wait on it lmao"" BYYER FOOLISHA""<<good night",0
@user Those who failed to develop hair on their bald hear are talking abr development,1
"@user yes, you got the point. :( it's like, as the time passes we're growing into some kind of beasts.",0
Marked as to-read: Becassine Pendant La Grande Guerre by Caumery http,0
idk what I love more how cold my western civ class is or western civ.,1
Well I've heard that Mexicans and Blacks smoke it and then want to rape white women.    It'll also be detrimental to the cotton industry...,1
"@user man, there is too much in this tweet.",0
Literally cried when I woke up because I know what this day has in store for me #TheStartOfTechWeek Ready #JustShootMeKnow,0
The post talked about questions to conservatives.  Why did you change the topic to refer to 'reasonable people?,1
Fuck all the speculation until we see a video.,0
Now to see whether he will deliver on his promise or not.,0
@user No sugar during christmas time? :(,0
@user y r women considered inferior2men by society even wen in most of d families 2day men need women4decision making! :D,1
@user @user empty threats even #TheBear supports #united http,0
Christians in name only:  ChINOs,0
"Good job @user...""@user: Same-sex marriage harms free speech, new Ontario judge wrote in 2012 http",1
The #blackbrunchnyc hashtag got the racists goin up on a Sunday...,0
"@user Oh, BELIEVE me. I agree totally. My tweet was pure #sarcasm. We need MORE #guns, not less. Santa is bringing me one. #2A",1
