text,label
@user why? university always helping,1
@user @user At least you got my joke,0
"danniella westbrook went to a food bank she should have gone to Iceland, oh yeah she fucked that up too #freedomofspeech",1
"i would tell ya, but you just wouldn't understand...",0
What a great person you are.,1
"amazing how many ""americans"" slag off capitalism , from the comfort of armchairs, sipping decaf,skinny, pumpkins spice lattes",1
"A MAN MUST HAVE (3) F's TO GET a A IN LIFE: FORTITUDE, FOCUS, & FINANCES. http @user",0
"I like to think of myself as a broken down Justin Bieber - my philosophy professor, everyone. #sarcasm",1
"Sad I don't have a Christmas jumper, thanks @user for your super fast delivery",1
Gotta go back to work tonight,0
"Quel domage RT @user: No Canada: Bills in TO series, which was a colossal flop, has been cancelled http #CFL #NFL",1
"@user iv not even started think I'm just going to get the parents and babies something, the fam is multiplying too quickly",0
save your work folks. i'm offically cntrl-alt-deleting this week.,0
@user @user @user That is fine company!,0
"Get on the work bus, driver turns his music on and the first song on is 'another day in paradise' #irony",1
#indonesian#czech#mix#girl#with#my#boy#elvis#im#single by mcrodyn http,0
@user @user @user @user asked back to be models next month,1
"Song of the Day: ""The Lights and Buzz"" - Jack's Mannequin.",0
Gotta love #EMC's latest feature on the VNX side. http,1
you have no argument because you're insane @user @user @user @user @user @user,0
Have you lost your zing? Working too hard? Check out my latest quickie: http #habitually #internetmarketnewbie,0
@user to watch re blues? Chelsea's of course,1
Free chocolates and free delivery with all flower orders from Bunches. http,0
The girls on #SororitySisters thought they'd get rich and famous but instead they be like... http,0
Learned to play 3 string notes on the guitar #pro#idiot,1
yeah English stop saying Jane's word,0
I work in front of laptop for 8 hours a day and suffer terrible dry eye. #bloodshot #eyerony,0
The thought of work tonight really kills that Friday feeling.,0
When you show your valid 16-25 railcard and shes charges you full price anyway. Great service from Tamworth @user,1
I feel like crap today. So instead of Redbull I'm drinking something healthy. #NewYearNewMe #TotallyStillGoingToDrinkTheRedbull,1
I'm not sure how I feel about his theology but I wouldn't take how many feathers he ruffles too seriously until you at least look deeper than I have into what he says and how he justifies it.,0
@user @user protecting the namesake of a #PalinSpawn,1
@user @user It also makes me want to post this... http,0
I wish religious fundamentalism would be officially regarded as a mental illness.,0
@user @user great days there under Wilko.,1
Why I love penguins of Madagascar #humor #reliefcomedy,0
"@user @user Ya, because if history has told us anything, it's that betting on sports is a GREAT way to make money!",1
"he was half of what she deserved, yet he was all that she ever wanted ,,,,",1
Love feeling like I've been lied to. #dontwanttobehere,1
"If loose lips sink ships, then loose tweets sink fleets. ? (@ NASNI Theatre in Coronado, CA) http",1
"Could you image how poor of a state they would be, without ""city folks"" tax money?",0
Nothing beats a surprise Tetanus shot at the doctor's office. #blessed,1
Off to bed can't wait to feel this hangover.,1
About to take a long ass drive with music blasting,0
"Still wondering why the pop-up ""save password"" still pops up even when you do not tick ""keep logged in"". -Sarcastic",0
Love working hard trying to fix other people's fuck ups,1
"yup, amazing how that is, isnt it? @user @user @user",0
Planning a vacation instead of studying... My priorities are in line. #NOT,1
@user yeah I do. But you know there's this thing called an all nighter and apparently I wanna pull one #not,1
@user Here's a list. Lots of great choices to help #Coyotes win a cup next year. http,1
"&gt;every time I pay my new premium, I am paying into a system that makes it possible for my fellow Americans who have not been as lucky as me—people who really have been losers pre-ACA—to finally get affordable health care.  Socialism.  Evil, anti-American, anti-Christian socialism.  Right there.",1
"I checked twitter and snapchat but I can't tell what day it is, someone please help",1
@user @user @user @user @user @user @user @user 9 Followers and now he's relevant?,1
Are they allowed to be touching each other's kneecaps like that?? #questionable #NOA #onuchapel,1
"Watching the news being like; ""oh this totally restored my faith in humanity.""",1
#Law&OrderSVU where rappers go to act,0
because learning for the finals is fucking amazing.,1
@user u do really need to get a wee bit more lol,0
"Azealia Banks call Iggy ""Igloo Australian""...WOOOW an incredible rapper diss another one",1
@user returning my brand new ps4 thanks to your faulty security. #goodjob #not,1
@user @user @user but of course it was. Cops could shoot a black man in front of a hospital & I bet you he'd still get no aid.,0
buzzing for school on monday..,1
@user that's my Saturday night entertainment...,0
ruling party in power#central#state#misusing their power#PM speaking only in foreign parliment#pm to visit out side india during session,0
@user Aren't humans the ones who are playing the sport?,1
Conservative response: herp derp Detroit hurr durr,1
@user I moved here from north Jersey and was a big Rangers fan until the Coyotes came to town. Where are you from?,0
Sneezing when you have to pee #jusygirlythings,1
@user u might b d bigest fan of srk but i find u better actor than him sayng it just fr sayng but realy mean it#expression king,0
This long drive home later in the snow is gonna be shweeeet #not,1
@user We ll take that bad at all,0
11:11 - say something stupid. Oh... You beat me to it.,0
@user I mean that all matter this game,1
@user @user @user @user they better!,0
"Big 12 fans flocking to support TCU after that OU beat down, Texas loss, and WVU manhandling lol.",0
@user You can afford stocks? Teachers make SO MUCH money it's crazy!,1
Farting like the world is ending,0
#Warn them that your degree of #sarcasm depends on them in this #funny tank top! Order now at http http,0
I know who I am. I am not perfect. I'm not the most beautiful woman in the world. But I'm one of them. #women #not #perfet -Mary J. Blige,0
"""I do #speak #because I #want to #save #someone. I speak because I like. Who am I #to save... http",0
"Every parent wants their child to get ahead, help your child with a sponsorship/grant from @user #charity",0
So excited to spend the next 12 hours at school.,1
"When j need the mailman to come late, he's here at 8a. When I can't wait for the mail to come? 7p.",1
"If I carried on the way half the men do on here, I'd be getting called a crank (amongst other things) and be asked if I had #PMT...",1
@user It's ok...thanks for telling me. Passed the idea on to a sydney friend :),0
"When someone on a conference call talks about ""housekeeping items"". Grrr.",0
"The Bay Area storm is so big that tons of people's work was canceled today, causing me to be early to mine. #irony #stormageddon",1
Imagine if schools spent $70 million on education.,1
The truth is out of style,1
"Blue skies, warm air, and the royal accommodation! #WhatMoreDoesOneNeed #Education? #Not... http http",1
@user He's just trying to drive Suh's price up.,1
@user @user and why wouldn't you be after THAT performance!,0
In other news i havent had a good nights sleep in a week. I feel great.,1
Good crowd at the Independence Bowl...,1
#HowToGetUnfollowed Post pictures or videos of you smoking. Especially blowing smoke at the camera. #SoCool #Not #GTFO,1
"Dear () #Spain's gov and Catalan Police, congrats you managed to accomplish the impossible: Go even lower than #Greece #OperaciónPandora",1
@user @user lol then,0
Ready to conquer the day @user #leavemealonemom #my2fave#bahhumbug http,1
New homeschool year. New Marketing business. Clickbank University. Wealthy Affiliate. Writing the book finally. #holyschedule #needanapp 0_0,0
"sorry for being female, I didn't mean to interrupt your perfect little man-world.",1
@user me and you are the only ones that love it,0
#Venezuela -controlled #Moscow junta genocides peaceful protest of #Chechen miners in #Grozny . http,1
This is great...,1
@user @user Thx. If thry real why dont you have them? Friend me on http,0
Dang my selfie game is on point when I'm drinking #actuallysorry,1
@user @user sounds like flat 8 are having a wonderful morn! #HAH #WOTWOT,1
Work hard in silence; let success make the noise.,0
"Going to sleep, hope #sydneysiege is sorted out in the morning",0
How to know when he really loves you. #tmi #imsorry #chickfila http,0
Smh never knew something could be 80% halal...Been muslim my whole life but somehow i've learned something new i guess,1
"In other words, our beliefs make more sense when you're drunk.",0
Casual stroll with lauralobaugh Rochester #FunInTheSun @ Key West Islands - Florida (U.S.A.) http,1
"Pretty sure there's a satanic baby in the apartment next door. Stays howling. Not crying. Howling. All day, all night. Ugh. #killmenow",0
@user I also support instantly murdering 12 year olds with fake plastic guns in public parks...,0
Can't wait to see that he has not talked to me and that he will never do it.,1
Who's eating everything on the table for Noche buena?,0
"#SteveHarvey worships #Obama b/c he doesn't research, then calls every1 else ignorant. #Fuck this guy. http #Idiot",0
@user lids sucks officially! Will not use again good,0
"Honking at me whilst you drive past - so romantic, it makes me want to trace you through your number plate and be with you forever",1
@user don't you see the for call teammates soft when you haven't been to practice in 2 weeks? #overpaid.,1
Can anyone tell iv been uploading items onto depop today lol #lotsofdepopuploaded,1
""" ""@user: Penguins cancel morning skate, which was an optional, due to icy road conditions.""",1
On my lunch break so sleepy,0
This is a great time for me not to be feeling well...,1
@user Ucan MAKE MONEY #TWEETING this info w/ new app http <-News http http,0
@user @user I'm sure you're all inconsolable,1
Nothing makes me happier then getting on the highway and seeing break lights light up like a Christmas tree..,1
@user Whoa! I hope Dione Taylor got a standing ovation for that performance. Incredible voice.,0
@user Wow! I can now afford that holiday I've always wanted!,1
I love being unappreciated,1
"@user amen, bless you Huda, means a lot. You too.",0
"""@user: Electricity generated in Kashmir can illuminate whole India: PM"" but it's only not illuminating #Kashmir",1
@user @user What does PTI do apart from whining? #Youthiacrasy,1
Today is awesome,1
Lagopodous - Like a rabbit's foot!! Not so easy to drop into conversation but you never know.,0
And people who understand math.,0
"Hey man, I'm sure you just missed the memo, but ""capitalism"" is now defined as the government telling us we have to buy something and then narrowing the definition further, by telling us we don't know what we want and they need to show us.",1
"&gt;""Believers are more likely to say that God has significant power over weather and disasters. "" No shit, Sherlock.  It's like saying that people who eat meat are more likely to eat a hamburger than are vegetarians/vegans Edit: formatting",1
is not lost. @user @user @user http,0
Sports rock so hard sometimes.,1
Remember when I ran 14 miles on 90 min of sleep this summer? I've got a 14+ hour day on about two hours of sleep. This'll be fun.,1
@user Oh crap. Mean. What did it mean. See my last few RTs.,0
What a lovely day to drive #not #boo #fog #work http,1
Why are GMOs considered so bad?,0
I just love EU servers...,1
#almajmoua participating in the 4th #CSR forum #lebanon #togetherwegrow -for-profit #microfinance #supporting... http,0
It is so rewarding to work in a place where the teachers and students have been reduced to nothing but numbers and test scores.,1
This clinical psychology exam is gunna be the main cause of whatever mental disorder I develop,1
a bad game last night. Way to go Packers! http,0
@user Yeah...me too!!!!! !! x,1
"@user Also, I would not that my tone was joking, though it's difficult to properly convey that in a Tweet.",1
"I guess I'll eat leftovers for breakfast AGAIN, while others get black bear.. #cuzididntwantgoodfood #truth #hungry",1
Cause I love going to bed alone every night.. #not,1
@user @user We can vote Republican! Their Civil rights record and their ability to empathize is amazing. .,1
It is always nice when I am taking a cig break at like 2am at my house and I hear weird creepy noises and its really dark,1
http In light of the #Murders of two NYPD Officers inspired by #IcantBreathe should... http,0
Check out my latest blog post on MyFairDaily: Pins That Really Work!!! http #lbloggers #lifestyle #pinterest #triedandtrue,0
"I prefer it!  I'm a Texan and a while back I had a HORRIBLE kidney stone but I didn't know what it was because I had never had one before, I went to the ER in EXCRUCIATING pain and they treated me wonderfully!  I got three, count 'em baby three, shots of morphine through an IV, that is an experience I have never had before but enjoyed and would recommend!  Then I left with a handful of prescriptions after a CT scan (is that right?  Some kind of scan! ) and went home and was high as a kite for a few days and then it passed and we were all good again.  Woo!  So then the bill comes and it's $8000!  So at first I was all like ""woah, shit"" so I called and complained because while in the ER I had specifically ask, repeatedly, how much the scan would cost and had repeatedly had my question refused to be answered by the doctors, nurses, radiologists (or whatever they're called) and even the lady who came in to get my personal info and ask me for a credit card to pay ""as much as I could afford right now"" (I authorized 50$ because she wouldn't explain to me what exactly it was I was paying for ""right now"" and I finally decided they just wanted a card on file).  Sooo when the bill comes the scan ALONE was 6000 bucks, just the scan, the entire rest of my treatment was only 2000 which I would probably have paid gladly after the wonderful care I got (and I knew I was uninsured going into this and I knew ERs are expensive and at the time I was in HORRIBLE pain and scared shitless by it so I didn't care).  I made my choices and would live with them but 6 grand for JUST THE SCAN?  That seemed unreasonable to me and I also found out later that scans like that aren't necessary for kidney stones and often aren't done unless you're peeing blood, so wtf?  So this is where the fun starts, I called to complain about this scan cost, I was quite clear that I would pay a reasonable about for my care and was happy with my care but I couldn't afford 8000 total and that 6k for the scan was nuts, so they ask me to fill out some paperwork to see if I qualified for ""financial relief"" from my bill.  I explained again that I didn't want charity, I just wanted a reasonable bill (and BTW, 2000 for the three shots of morhpine and the 10 minutes the doctor spent with me seems a little out of whack too, 800 of that is called an ""ER fee"" and is apparently a charge you get just for walking into the ER regardless of what happens next, but hey they took good care of me and I don't know what the fuck morphine costs).  Anyway the only option I had was to file for the charitable relief, well ya see I am currently a ""stay at home uncle"" my brother abandoned his two kids with our mom, she can't afford day care (you would not fucking believe how expensive day care is) and since I made less money than she does, I become the stay at home parent.  We all live together now, she pays the bills and I take care of the kids.  It was weird at first but it's actually kinda rewarding and fun now (most of the time).  So technically I'm single with no income and have been for about a year and a half now and my tax returns reflect that.  Actually do have some income for contract IT work with people who knew me before I quit, it's all under the table though.  Soooo I got FULL relief.  I actually have some money and my mother actually makes ""ok"" money and we were willing to pay a reasonable amount for the bill (my hope was to reduce it by half to 4k and pay it out over time, lower is better of course but I had braced myself to accept 4 grand if I could negotiate hard enough to get there).  Instead I paid 0$.  And I learned a valuable lesson, if it looks like you have no money you can go to the ER for freeeeee!  Wee!  So suck it tax payers I ripped you off for 8000 bucks and I have three pain pills left over for a rainy day!  Now stupid Obamacare is going to make me pay for my own insurance :( boooo That's going to be like 70$ a month.  EVERY month!  You even have to pay in December!  Come on government, it's baby Jesus birthday, fucking dicks.",1
#basura#immondizia in my name http,0
@user Is it snowing in Canada? Just on the hills here at the minute but hoping for a white Christmas,0
"So... they purchased these books, which by extension funds further prints of these books, just so they could burn these books thus limiting the potential supply.  And this burning of these books does what exactly, save for leading to more printings of those bibles?",1
Pediatric Grand Rounds on statin therapy and the dyslipidemia of obesity. Breakfast on offer is 2 grand platters of donuts.,1
In Scotland ( the little country that's attached to the north of England),0
Sitting in this hall is fun!!,1
"What the hell has happened to Shahid Afridi in last couple of days? Left alone more bouncers than played, got a review right. #pakvnz",0
".@user Computing, the Internet, personal computers & smart phones were all invented by that ""pond scum"" @user",1
Forest Hills Drive on my playlist naw...,0
"oh, and lets not forget this @user @user @user @user @user http",0
"""A year ago my cat was hit by a car... this is him today."" is a great quote",0
"Christmas part two began at my parents house today.Many gifts,mountains of wrapping paper,excited nephew,missing batteries, veggie chilli.",0
Happy Veterans Day!,1
It's funny how you can sit for 15minutes And not be noticed. #MTVStars Taylor Swift,1
@user is that ?,0
@user @user #not sure who will take it home?,0
Some days are just better than others..,0
Stinker of a day... Nothing has gone right. Got worse as the day went on... #Ahhhhhhhhh #Depression #CantWaitForTomorrow,1
How in the world will I start my day once Kaitlyn gets tired of #Frozen? #Idontwanttobuildasnowman #mommyproblems #mommylife,1
They probably gave him talking points to heckle Obama with to make him a victim and make it look like he's more moderate than he really is.,0
Would they take it back?,1
Uhhh can't sleep someone like n I'll text u my phones dry ass fuck fr #am #a #boring#person,0
This is also the kind of shit that'll be on r/cringepics,0
His naiveté makes me cringe on the inside.,0
"@user you didn't make enough of a blót to Ullr (God of Hunting, Skiing, and I assume hockey).",0
@user its a week joke I have with Jessica and my niece,0
Why does Mostella get as much or more playing time as Hubbs...idk might be wrong but I don't understand that,0
THE WORLD'S BIGGEST ONLINE JOB Click and Get Started Now! http,0
Interviewed a turkey & here's what he had to say http #Thanksgiving,0
This is the weather i just love walking to work in #worst #weatherbomb,1
"The website being broken isn't even the biggest problem.   The biggest problem is that *the law is fundamentally flawed*.   Even if the website was working properly, people would still be getting their hours cut at work and kicked off their existing plans.  This is only the beginning of the shit show.   We haven't even entered the second act yet.",1
Turning in my paper then coming back home and studying #perfectday,1
@user I don't think your caramel frappe is salty enough. #McYuck #lostsale,1
Ah yes. Just what I wanted today- a pounding migraine. #Sarcasm,1
the ONLY time a crime becomes a federal crime @user @user @user @user @user @user,0
"Grandma's coming over, yay money. #lol #kidding",1
@user Alone Tonight cause its a personal song which helps me to imagine myself beyond another world. #GoSupersonicQuikr @user,0
#sundayfunday #mylove #mermaidlove #newyear2015 @ Rockefeller Center http,0
"@user: Been friendzoned too many times in my life, the perks of being the good guy #Sarcasm #Lifeall my life this has happened",1
Quizfreak http #proud #Brummie over here xxx,0
Girls just wanna have fun#work#not#friends#only#dance#drinks#antennagrouprocks by mariag... http http,0
Nit pick at every little thing guys. Keep doing that. That'll show the team you're behind them.,1
Sessions!! #why #scary #canary #sydney #australia by lavin56 http http,0
Tomorrow is the day I'm coming back to Florida for good ... :( unless something changes in the next 24hrs which I doubt #ready,0
"how is it possible that somebody so interesting is also so, so, so boring? #irony #what",1
Pulis turned down #NUFC cos he wants to spend a load of money on 30 year old journeymen. Parish wouldn't let him & neither would MA. #cpfc,0
LOL.. Micromax is promising that service? http,1
#np #NowPlaying #NowListening #Music #Don't Let Her Pull You Down by #New Found Glory from the #album: #Not With... http,0
Flight diverted over boiling water incident http,0
SmartPhone APP PAYS you! see- http #Verizon #folloback #tcot Go 2: http http,0
Not enough natural Ghz for gaming.,0
"http #TeensAnalyzed Not expirienced, but cock hungry",0
"Went off the road this morning as did my English professor , thank you FSU for your concern for commuters",1
I'm not usually a fan of anything #pumpkin or #pumpkinspiced but OMG. These are the best cookies I've... http,0
@user Stunning work. #british #textiles #footwear #madeinbritain #not-a-nike-clone,0
@user @user @user Oh wow your talking Skype! Cool!,1
love is bliss...,1
Watch father and not his daughter FUCK http #Old+Young #father #and,0
@user @user @user same here. Tryin to link d convos bt another tweet cums up. #Sarcasm is the only wrd repeated.,1
. which is why i've visited #pakistan as many times as i have .. sez @user,1
Claybo Dawson and I are @user 's #squadgoals,0
#TortureReport trending; I wasn't aware J.K. Rowling released her new book.,1
"""@user: BREAKING: PM Netanyahu slams EU countries: ""The Europeans are hypocrites that learned nothing from the holocaust""""",1
@user @user @user @user @user @user I'm still going to Exeter whether they care or not,0
""" #Congressmen Admit to reading #NDAA before #Voting http "" <3;-}><3 Via @user <3;-}><3",0
#finalsweekgotmelike Ugh. Make it stop. #finals #finalsweek #EWU http,0
"@user @user Spoiled, rancid food AND guns in the aisles? Rats in @user?Sounds great. #GroceriesNotGuns",1
I can be mad at you for a matter of 15 min then I can't stand not talking to you.,0
3 But 350 Girl Friends - #DrAmbarish- Upcoming Movies http,0
Heaven knows I'm miserable now ... #TheSmiths #girl #old #ohwow #InstaSize #a #goodmood #weirdpose http,0
@user Did I really need to put a hashtag? Oh dear!,0
"I'll tell you what, those CEACCP books make a cracking bonfire, don't they? #frca #freedom",0
I love spending five hours a night doing homework! Please assign more teachers!,1
Perfect way to start off my morning,1
"@user @user I know, right? Not like the LAPD have anything better to do. This ain't a distraction or nothing.",0
"Casual meal with a mate, didn't turn out as expected! #disappointed!",0
@user thanks for all your help Giles,1
@user @user @user @user tweeted this at me yesterday,0
Obama supporters will never read or acknowledge that list exists and instead will just chant Hope and Change.,0
Would like to thank my nephew for giving me his horrible cold & sore throat etc.. Much appreciated!,1
Not a strong showing for Pittsburgh sports this weekend. Thanks @user and @user for great seasons! #stillafan,0
"On a good note, only 49 more days until #Scandal.",1
When I start singing songs from Once More With Feeling to myself while at work... #Buffymusical #stuckinmyhead,0
"""Execute"" commands the beginning of a job but it is used to end a person's life Now that's",1
Sitting around listening to sad music really helps the depression.,1
The thing I love the most about coming into work early? Having everyone ask me why I'm here so early. Gets me every time. #annoying,1
Somebody has filled my head with snot & used a cheese grater on the back of my throat during the night #unimpressed,0
Short hair #really http,0
@user oh haha no they ain't you ain't even seen em,0
Good luck today DJ Durkin. It is NOT great to be a Florida gator. #fuckUF,1
"btw, dummy, 140 limits @user @user @user @user @user @user",0
"the people #BillCosby looked down upon are ones coming to his defense. This isn't about race,it's about rape! http",1
"you dont, fish and mammals have nothing in common @user @user @user @user",0
@user a ghostwriter? Shocked...,1
Some guy chattin shit to me on the bus saying I look like snoop dogg #KMT #again,0
"@user yup, more is definitely MORE! #fosho #merrycuteness",0
@user Have you guys tried unplugging the servers waiting 10 seconds and plugging them back in? #psndown,1
At least my tan looks good need to learn to appreciate my pale skin,1
I'm knitting a scarf. Yes. Knitting. A scarf. Because manual dexterity and I like knitting. Problems?,0
"@user @user @user this is true, the Patriots, Packers, or Broncos could suddenly need a new coach #itshappening",1
When u callin I'm tappin lol sorry,1
That was today's talking point.,1
I love waking up out of a dead sleep to two firetrucks blaring past my window,1
