text,label
I am starting to think UK has a pretty good basketball team #BBN,1
Absolutely love waking up to snow,1
Just submitted my final paper of the semester. It's only a make-it or break-it on whether I pass the class. No big deal.,1
"@user @user we've grinded for our gear and now they're worthless, thank you",1
@user thanks for noticing me,1
@user see http #FOLLOWME #FOLLOWNGAIN #TEAMTOFOLLOW #TEAMFOLLOWBACK RETWEET & GAIN FOLLOWERS.,0
"Love how I came into work at 8 because Charlie said we were busy... 3 people in 45 minutes,yeah we got this place packed Charlie.",1
"I often worry that wealth doesn't have enough influence in society, so pleased to see this being addressed http",1
Bush Govt to be prosecuted under Geneva Convention for torture after CIA methods & VP admission exposed. http,1
"@user aww bless ya. Enjoy your break babe, yeah it was great thanks.. Finally recovering from it. How's Ya tash going?",0
"#Sopping #wet #Squishing #mud #between #toes... Well, why ... #Swimming in a #mud #puddle",0
Pretty Shitty day I'm gonna be soaked and full of mud and clay #iliketogetdirty #notreally #sarcasm,1
@user @user journalism at its best,1
It's snowing in Chicago #whitechristmas #not,1
@user #Not #Long To Go #Before #MainStream #Media #Pitch. #Surgery #follows #with #me #using #Prototype #demonstrating #real #situation.Phil,0
"@user @user I wish son. like I said, twitter, wit on twitter and the magic of photos that are 3D = smoke and mirrors effect.",0
Love how I can never fall asleep #insomnia,1
"""@user Few politicians get importance of Patient Dignity & right to die http",1
"Boehner, the perfect example that you (anyone) will not get the government you need, but the one you deserve.",0
@user Hope the header didn't mess up that barnet,0
These Student Athletes Really Picked The Wrong Class To Cheat In http via @user,1
"you do know the ""hands up, dont shoot"" thing has been proven FALSE right? @user @user",0
"Prediction: Erv Santana will be disinterested in playing for the Twins in 2015 too... (aka, we didn't offer enough)",0
Love watching #latenightfilms. Enjoyed #MockingjayPart1 @user #didsbury. Ta @user. #Grateful to have such a #goodfriend.,0
"@user depends who you mean by ""you"" cause everyone is different",0
@user I didn't know the severity of what you were charged with. I just read it on the Internet. Praying for you & your wife.,0
"@user I think being gay is wrong, its like people chose to be gay just to piss off the magic old man that lives in the sky",1
I'm sure it will pass..,1
#Israel #raps #Palestinian #U.N. #draft as '#gimmick.' http via @user,0
Lol hilarious pic RT @user: What a game! @user win! http,0
@user looking forward to the time I have to traipse down the stairs to postie with a baby attached to my nipple!,1
@user I don't think. I know!,0
"I'm okay with snow, but sleet #howaboutno",0
"@user @user hitting the big issues, champ.",1
So is windows 98 se.,0
The spicy cali roll is just cali roll with a dab of sauce on it W T F,0
This should be fun next spring. http,1
And you just skip my TBH? Do you not like me so much as to just erase me from your life or something? #awesome,1
schools in India praying for # #peshawarattack victims #PrayForPakistan ... http,0
My finger is so ducking attractive without my bandage tbh!!!,1
"#ECB #pondering #how #best #to #act, #whether ...: ECB pondering how best to act, not whether ... Reuters – 19... http",0
Glad there's not a typhoon where we go on holiday in 4 weeks. #fml,1
I love getting up at 4 30 so I can wait on other ppl! #sarcasm,1
Go go Power Rangers! #f2xmasparty http,1
Didn't know I was so powerful.   Cool.,1
Hafeez's slider is TOO much of a mess. Bowling it from 'back-of-the-palm' & that too at ~90kph require EXTENSION http,0
"Surely they'll offer an ""In TFSM We Trust"" version, right?  Or maybe ""Joseph Smith Lied""?",1
"""I love that when a female expresses herself in an emphatic manner, it's always attributed to her menstrual cycle."" -Mags #PMS",1
If you gon' judge people who drink and blaze FOH Go choke on some foreskin,0
@user @user Time to listen to ppl complain bout their lot in life bec they cudnt make themselves anything??? Yay!!!!,1
"And right after this [someone in the audience fainted](http://www. youtube. com/watch? v=7J80mVXvs64).  Obama was able to pick them out in a crowd of people, diagnose the issue as not serious from the stage, and then get them some water.   How could anyone not love such a compassionate and caring leader?",1
I'm not really sure how I'm still alive and writing this paper right. Napping instead of sleeping on the weekends isn't cutting it #finals,0
@user this is my new fave thing on facebook #sexpest http,1
"A 'republican move' which will 'effectively rob the royals'. Kate's spending 32k on1meal, who is being robbed? #irony http",1
That moment when you have to go to the bathroom but the cleaning lady is in there...#StillHoldingIt,0
@user if it got the attention of the smartass to comment that.. Didnt it work anyway?? #irony,1
I am always amazed at how biblically illiterate people must be to find stuff like this surprising.,0
"@user getting power from wind is so outdated and unsightly, we should be siphoning it directly from the sun by now.",1
I don't know what's worse...the fact that McDonald's is open on Christmas Day or that people are actually in there eating it right,0
There's nothing better than the feeling of being loved lol nothing,1
@user @user @user Fuck yeah! 600 more viewers!,1
Happy new year to meeeee... http,0
of course the day that it's a monsoon outside i have classes on and off from 10 AM to 8 PM #ilovelife,1
It's been one year of off and on eye twitching. #SoFun,1
@user @user Yes on Auto-messagers No to #FollowBackers ... They make me money over on TSU. Thx your post http,0
They had me at metaphorical Jesus.   That's the last thing we want.,1
I'm so good at sight singing.,1
Rocking the Christmas socks at work. It's the little things like this that make me happy. #essentialservice http,0
#Bit #Chair #Comfy #Mind #Nope #ikea #decor Please RT: http http,0
wow they seem to be so turnt,1
I've got a right thirst on... #NewsYearsEve,0
"@user @user Good points, but Republican party can be just as fractured. Together that makes for a disenchanted electorate.",0
@user haha cannot wait for monday at it's best.. cheers,1
"After getting a total of 4 hours of sleep in 2 days, I FINALLY got good sleep last night",0
"@user just lost a fiver already on the early kick off, cheers Forrest :)",0
@user I think that was the joke.,1
Many of the best ideas come from having fingers too fat for your keyboard. #nimble #agile,1
@user One of those obvious when you see it but oh so clever ideas!! Glad you approved!,0
@user what happens if I RT ?,0
Count the scars on your soul,0
Going to go into central for last minute present shopping #soorganised,1
"I didn't start out that way and I don't really have to stay that way, but distributors are going to have a murderous time competing with the convenience and ease of use offered by most pirating methods.",0
@user A cool look and a cool mind is all you need to party all night. #QuiksilverGoesSupersonic http,0
How much were they given in the bailout?,1
@user you won't get a source other than ISPR :,1
One season down 8 togo! #OneTreeHill,0
@user n the is the promotions r by human n not by the religions. For strictly speaking all religions believe it is the right 1.,1
@user I take it you're not in England then ; ),0
@user thanks I thought it was tomorrow #not #iknow #notthepoint,1
So apparently Catholics aren't Christians according to this pamphlet.,0
In need of a rose winee,0
thanks for clearing everything up Koenig #serialbrady,1
"Thank you for this, good sir.",0
final labs coursework submitted!! now to treat myself by catching up with the whole semester's lectures #winning #not,1
THE EMPEROR HAS NO CLOTHES!,1
"And that would make you a homophobic, regressive douche bag with a gay child.",0
"@user now, to remember which book... #goodluck",0
Awesome rainy day at the track!! http,1
I'm shocked that Mark May doesn't think the Buckeyes should be in the playoff!!! #Sarcasm,1
What is the most important thing that you should do today? -- Breathe. http,0
MLK Day should be renamed Civil Rights Day.,0
"@user @user If you need a #dev #environmnet #then #a #great #pick. For #regular #web #stuff, I #do #like #it",0
I just wrote a 13 page paper... I was awfully tired when I was writing it and now I can't sleep. #irony,1
"ï""?#Depression and #Abuse are sadly a part of many people's testimonies My Monster of a secret: http #DamonLeroi",0
"If you drag yesterday into today, your tomorrow cannot be what it was meant to be. Let. It. Go. #BringOn2015",0
Cats are so cute I wish I wasn't allergic,0
tough day in sun #kitsch#funny @ Costa Teguise Lanzarote http,0
#Uniform#unity #LMFAIR14,0
Surprised SJWs haven't tried to get call of duty banned. You can make male & female guys so you have men KILLING women #Misogyny,1
@user could do with someone making me a hot chocolate right now ahaha,0
doing mental calculations and realizing that your chances of passing a module are slim to none is fantastic,1
work should be fun today,1
Today is already shaping up to be fabulous,1
"you seem super smart MT ""@user: @user @user #NO #BLEEDING happening in #WaterBoarding = it's #Not #Torture""",1
Silent Circle is closed source and shouldn't be trusted.,0
@user # SHOCKING,1
"Still up at 4 , work at 11 is gonna be prime",1
On the other hand condolences to @user and @user for the draw...,0
Thanks Mother nature.. You didn't give us as snow day and now my twitter is filled with people complaining,1
"It's pretty amazing that in 'The Land of the Free', people are debating if we should feel safe around our police.",1
What the hell happened here?,0
My current Christmas song obsession. Played it non-stop all weekend http via @user,1
@user @user LFC worst start in 50 years and still above EFC... that is funny!!! #WishWeHadA28MilStriker,1
If I had a ton of money I'd turn this into a commercial and have it run in prime time over and over and over,0
Yep he had lots of flaws fortunately being a bad sci-fi writer wasn't one of them.,1
"And all I wanna do is blast music and get ready for my trip but my ""second"" roommate is sleeping and I suffer from being considerate",1
Thank God that the wait for an appointment is only until February.,1
"HELLO Wednesday! BY THE WAY IT'S December 10, 2014 at 02:15PM! (just a random information)",0
We spend our childhood in a hurry to grow up and when we grow up we want to retain our childlike nature! #justsaying #lifegoals #kids,1
Today is just not my day,0
"@user oh brother, the bar for journalism is very high these days @user why do you follow such retards?",1
my favorite thing to do on Tuesday is write psychology papers #killme,1
Christmas music on the stair master #SundayFunday,1
It's a Christmas miracle! http,1
BBC News - 'Skywalker' passport cancelled because it was 'frivolous' #trademarks http,1
"2 a.m., just went to bed #Twitter #Sleepy #2am http",0
"I'm a college professor.  Incorrect attribution isn't what happened here.   He plagiarized.    I'd report him to the university, and he'd either get expelled or at least put on academic probation.",1
When you have Challah French Toast on Christmas,1
Because that gives the minority party an even bigger incentive to force budget bills to fail?,0
"@user @user WHAT $2 for an app, OUTRAGIOUS ;)",1
We buy into liberal individualism and see our individual fate as black people in no way linked to the collective fate-Bell Hooks #Ferguson,0
Currently writing about how I plan to stop procrastinating after leaving the paper untouched all day,1
"@user not surprised, it was epic.",0
@user I'm from the UK and I honestly think your a goddess! I love how you speak your mind but have a gentle side. #love #PattiKnows,0
Jihadi killers in #Ottawa #Sidney & #Peshawar are rogue acts while FratBoy UVa Rapists are symbolic of deeper societal flaws... #tcot,1
Just in case you thought you had a blankety blank job check out this guy. #2a #HappyNewYear http http,0
Over on CBS at noon is #BALvsMIA. FOX has #SEAvsPHI after the #Saints. #NFL,0
"Um, really @user? #nothanks #UVA http",1
@user yeh but its still unclear you know.,1
"@user Well since he's basically an employee of the oil & gas sector, it would make sense that he operates this way.",0
Monday morning inspiration! #sarcasm #itstruetho #donttrustnobody #iwokeuplikethis... http,1
Archive pick: Who Makes You Laugh When They're Off Sick? http #mehblog #littlemeh #doctor http,0
@user @user there are more lawful ways the lawmakers whould av gone about gaining entrance not by breaking the law kind of,1
"When a teacher says ""come in tomorrow morning for help"" but they are never in their classroom #wow #thanksforthehelp",1
We provide a structure that ensures you will successfully invest in real estate. http @user,0
LIBERAL/#LEFTISTS USE #RACIST/SEXIST #LABEL FOR #DISLIKES MSNBC host Ed Schultz said RACIST #NOT to SUPPORT demand for #MINIMUM WAGE #SAD,0
Yesterday #PeshawarAttack was a top tag and today the only thing twitter nation seems to be concerned about is #PTIKeptPakFirst,1
Happened in my culture competency class...I couldn't continue to argue with ignorance <- my face in class http,0
Great way to start of the day,1
"""Original Content is hard to come by."" -Anonymous #writingtips #quoteoftheday",1
"In truth this has nothing to do with lobbying or cynical politics.  The uniforms created 8 years ago were horribly designed.  They universally stood out in every environment.  Supposedly the army did their extensive testing on colors and patterns to arrive at good uniform.  But then some top brass ordered them to use the marine digicam pattern (because it's cool and good for recruitment presumably) but to keep the new army colors.  Colors need to be designed specific to a pattern, hence the most ineffective cam since the British invaded (ok, slight overstatement).  This time I hope they do it right.  This is a great story about wasteful spending, but not so much about corruption.",1
My secret name is lizard squad. I like to ruin people's fun time. Follow and rt to a billion and you'll have fun. #psn #giveitup,1
"I'm seeing #catfish while I search for a #fishsitter for my #goldfish, #LoveLife",1
And that's a wrap for 2014 shows kiddies. Ending in the Berkshires. #BoseL1Model2.,0
"Coin ! erraji: "" ZeeGingaNinja: because it seems that some people here need this clarification #sydneysiege ... http",0
"you believe you can say something, provide no proof and its a fact, WRONG @user @user",0
"On the plus side though, maybe this will drastically reduce the number of people who comment on YouTube.",0
"Jesus Christ, she still exists?",1
Church sign of the day: How would you feel if we celebrated your birthday without you? #StoleEm #TheReasonForTheSeason,0
Kinda ironic considering Obama's support of unions.,0
"@user oh joy, now i get to have even more of them in my living room! #putyourtoysaway #badboyfriend",1
"Christmas shopping take 2, the weekends attempt was a waste of time so lets try again #CantWait",1
@user no one really says that,0
Still feeling sorry for myself about being to ill to go out last night!!! here's my memories from... http,0
Double standards are always a fun thing,1
"I don't know how you can love, but also freaking hate someone so much!!",0
"Close to white folks, I am forced to witness firsthand their willful ignorance about the impact of race and racism.-Bell Hooks #Ferguson",0
"""Everything You've Been Told About Copywriting is BS."" http",1
"the ""2/3=75%"" is also in the top 10 LOL @user @user @user @user",0
@user ****ALERT**** PLEASE CHANGE THIS... ITS ME>>> #NowPlaying Relentlezz @user - Who I Be :: Tune In: http,0
@user @user I love button pushers!,1
@user did you think that only making 100 was going to be enough?,1
Equal justice for all...unless you are Black during the Obama administration. http via @user,0
@user I be surprised at how many ppl have me blocked #ITalkTooMuchShit #YOURSTILLCLOCKINGMETHO #ThatsWhyYourGirlStillFollows,1
All I can say is I'm lucky.,0
doesn't convey what I want though. #twitterproblemsforme,0
Can't dispute any of it.,0
"Japan's #Abe #gets #the #mandate #he #wanted #â€"" #but the #recovery he wanted: Japan's Prime Minister Shinzo... http",0
"@user I hope you know how much we really loved you here in Philly. To the greatest shortstop in Phillies history, thank you!",0
"Always gonna be an uphill battle, sometimes I'm gonna have to lose.",0
@user has the best pickup lines,1
"I'm in the back chilling for now on , if I don't keep it contact with you or hit you up don't get mad I'm just on some other shit",0
Oh how I love this http,1
"@user yup gotta keep up with my ""frantic party lifestyle"".",1
"http #GapeLand #Super-sweet Super-sweet Lilli is simply adorable with her all-leg,&#8230;",0
Produce Mobile Apps #not http http,1
wow I love how frizzy my hair gets,1
"What I want to know, what has he down that 37% of people approve of?",1
"again, your myth of ""racist DNA"" is still only a figment of your delusional imagination @user @user @user @user",0
I'll try to guess the ASCII symbols without my admins help. Always trying to learn.,0
@user my favourite day of the year !!!! http,1
@user so I gave up and am now heading for bed orz,0
who gets the money and how do you determine when they don't get anymore money?,0
Day 1. Ski school with instructor Patrick. Soon I'll be ready for the black slopes. ... http,1
@user @user #IndiawithPakistan but it can never be other way round,1
@user you are sleeping? Wake up the next AC game has been leaked!!!!! #ACVictory http,0
I just love working on Christmas and spending it alone 6 hours away from my family!,1
For 9 grand a year we definitely get all of the information we need in this practical class,1
Oh how I love that my ass is too big to fit into my jeans anymore. #bigbootybitches,1
"sony emails tells me a few things. wealthy, high powered business(wo)men are ugly people, stupid & need to learn how to spell. #SonyHack",0
@user @user @user @user @user @user,0
@user Just realised we missed it too. In the middle of a tech troubleshooting mission to get an article on Madiba up on the site. #irony,1
Ummm can I please have @user for Christmas?! Dang he looks great tonight. Why did I not go to this thing tonight?,0
...except we have no hot water. Naturally no one would be in the office to take my call. I fucking hate it here.,0
http <-Video $ #SmartPhone can pay you to post! #iphone #samsung #S4 #S3 #ipad #tablet #mlm Start@ http,0
Twirra is NOT a place. RT @user: Twitter a place where virgins will be tweeting sexual & hoes will be forming saint...,1
"My dad's still gonna get me santa's gifts since it's my last year before 18, but I really don't know what to ask for... #irony",1
@user Please follow me. I have a technical question. Thanks.,0
@user @user @user And it starts :P #GetEnchanted,0
Just got yelled at by proxy. It's going to be an excellent day. #sarcasm,1
This gone be some fire ! Jan 24th #getlifted http,0
The #hardest thing's #knowing & #having the #faith to #keep #going http,0
"I'm so sore, work tomorrow is gonna be fun.. #not",1
Can't fck with you hoe an I'm sorry,1
"Heartless Sanghi #Sarcasm""@user: #IndiawithPakistan because a dumb nation deserves to be taken for a ride again and again. #Lakhvi""",0
This needs to go viral.,0
Bday lily painting for @user http,0
Lesson learnt? Herd of sheep who fought over TVs on #BlackFriday struggling to sell them http #irony #capitalism,1
just our problem - The Express Tribune http,0
"Always ironic to see a guy like Reich, who's already made more money than he'll ever need, lecture the ""New Rich"" on how they are too greedy.",1
Follow> @user now for great tweets about starting an online shop! http StartOnlineHere,0
"@user @user good old JK landing people in trouble again, ffs William i thought you were more savvy than that",1
I asked God to protect me from my enemies a long time ago .. short after I started losing friends or #naah,1
Bummer ending... But what a fun game and season. #Gophers,0
"@user he lost his license not long after, mwahaha @user",1
"It's too bad all this is happening to #TheInterview, it looks like a really good movie.",1
Best Christmas Eve news: I have a half sister. #sarcasm #thanksdad,1
"#Kaley Cuoco-Sweeting #apologises #for #saying she's #a #feminist: Kaley Cuoco-Sweeting, pictured with her... http",0
"My professors moustache is so uneven, Mohstash would be ashamed right now",0
"Dad and step mom bitching at each other, now it's Christmas #ugh",1
"Gotta go out with him and the third,forth,fifth...wheels. #WinterThought",0
@user a kiss on the cheek next time is enough :),0
A copy of your wallet after your bitcoins have been stolen is like a photograph of your coins after someone took your money.,0
internet got me like #stillalive http,1
Climate change redux: CALIFORNIANS experience drought & voted for bonds to cover.Climate changed &now we have most rain in 100 years.,1
#Patriots #report #card: #Grades #half bad: Tom Brady throws under pressure in the 2nd quarter during Sundays http,0
Not everyone's really for you no matter how long you knew them . And not everyone's a bad person just because it's been a short time. #irony,1
"No surprise, extreme hypocrisy is the hallmark of the political left.",0
@user thats not weird at all,1
@user @user @user @user @user @user @user fuck it mite just warch eastenders,0
Last day in Naples with my Emma girl! #soeasytotakeapicwithatoddler #19wksandcounting... http,1
Absolutely love being harassed by a group of twatty adolescents on a late night shop,1
Welcome to twitter @user myself n @user r at ur service as ur twitter coaches,1
Wish she could have told me herself. @user #nicolescherzinger #OneLove #myfav #MyQueen http,0
"Whatever happened to the Guano Apes? Did they ever make it ""Big in Japan""?",1
"dressing gown on, turkey and buffalo sauce sandwich in hand and big fat quiz of the year #moving #ever #again",0
The shadowy Investigatory Powers Tribunal says tapping of major Internet cables OK. That's alright then. http,1
Painting all cops with a broad brush because of the actions of a few is the same logic racists use. #Irony,1
@user The day one of him minions was carrying a sign saying my mother was fat was one of mine.,1
Why can't I (You) retweet my (your) own tweets? This is an important issue that needs to be resolved!,1
*gasp* The girls are at a rehearsal studio today? You don't say... Hmmm wonder what on earth for? #MTVStars Little Mix,1
I'm so happy he's been given enough rope to hang himself.,1
@user @user Love her. please publicise her more.,1
"Thanks to #TeamIpswich ED for making the news crew and I so welcome this morning, as they always do. #BlackFriday filming #ItWasQuiet",1
"Standard Christmas newsfeed. Diamonds everywhere, everyone's engaged. Congratulations. #original #Christmas #engaged",1
@user ___ I love that Song <3,0
"@user ""Malala is fake and planted by the US coz Pakistan is perfectly safe for kids going to school"" #PeshawarAttack #Sarcasm",1
@user yeah that's it,1
Kitty aaaaint happy #cat #happy #today http,0
Rangers league game with Alloa moved because of the Petrofac Cup final in April... #irony,1
@user I'll just wait here :) :) :),0
Sure Staff... Now Hiring. http,1
"Like @user? Visit http for articles and also win a free puppy!! 1 puppy per visit, 6 puppy maximum #ATL",0
Halfway thorough my workday ... Woooo,1
Fav part abt Xmas day..getting merry Xmas tweets from ppl who NEVER talk to me #kys #idontcare,1
@user they are all written out in a gold gel pen waiting! I hate how are relationship consists of twitter messaging #fulfilling,0
"Well, his ""liberal eugenics"" argument just firmly placed him in the same category as the tea party as he makes up shit that sounds scary and appeals to the uninformed.",0
I'm seeing more and more people using the term #GamerGate and I can't believe I'm going to say this but they're using it incorrectly,1
Today was a very good day in Iceland.,0
@user Damn. That would have made excellent thing to recount in autobiography ;p,0
chicks be really pimping more then males these days #the#look #yallknowthatsnotcoolright?,0
"Zimmerman didn’t claim Stand Your Ground, just the same run-of-the-mill Self Defense every other state has.",0
I love waking up with migraines,1
Pretty sure I just sat behind @user in the McDonald's drive through and peeked to see movie what was playing,0
"Cheney will live forever, because only the good die young.",1
Rejoice in knowing he is now in his new place...#not easy,0
"@user Yes ara i am not, and you know that. Hahaha",1
30 week scan #not #long #now #exciting #memory #all #good #happy #clear #baby #boy @ Portlaoise... http,0
@user @user ^^^^ IMAGINE THAT? Never would have guessed,1
@user @user @user YES! Vote for SATAN (@user) in 2016!!!!,1
@user @user hahaha u talk abt policies..just check delhi dialogue page..are u from another gola lol,0
He's on a one man crusade to marry them all...,1
@user Suhs been clean for 2 years and has only been in the league for five don't act like he was dirty for 10 years#not biased my ass,0
Study: Over 80% of Americans will re-elect their Congressman/men this fall.,1
http << Don't know how this didn't get to number 1! #accounting #absolutetosh,1
"Then why  was Hitler rejected from art school?  :p There are particular facets of Card's books that I find really hard to reconcile with his real life bigotry.   In the later books, Ender is among the most rational and egalitarian characters I have ever read.   Card clearly understands diversity and tolerance better than most people, yet he flat out rejects them.  It's sad how much power Religion has to poison even great minds.",1
"Working super early on a Friday, when your will is weakest, is a pure treat. #tired #stormageddon #ArrowMidSeasonFinale",1
