text,label
I'm so happy he's been given enough rope to hang himself.,1
supaaa sweet when you have finals in the AM and ya can't sleep.,1
It's just SUPER to be ignored when you put out a desperate plea.,1
What wonderful weather we are having...I might need sunscreen today 󾍁,1
@user You're a tough bugger ;p,0
I really want to see Into The Woods!,0
My grandpa just gave me a credit card for christmas...he has no idea. Lol,0
What a lovely day to drive #not #boo #fog #work http,1
Just a had a Bruce Springsteen flashback. *shudder* @user @user @user @user @user,0
It is good that very few businesses/govts in EM economies have borrowed much via dollar-denominated loans from international banks. #Sarcasm,1
"I just drank a healthy, homemade, all fruit smoothie...in a @user beer glass. #irony",1
find ONE local PD that reported an 80% drop @user @user @user @user @user @user,0
People with negative personal history will take advantage of the easy fix of saying they found religion.,0
At last I can quit work and enjoy life lol http,1
@user someone's on the defensive...if the shoe fits,0
@user @user For Queen and country yet they go down and destroy an English city and attack English police lol,1
Day 1. Ski school with instructor Patrick. Soon I'll be ready for the black slopes. ... http,1
#GuruMantra for #success. #entrepreneur #startup http,0
"Dayum, I really got the house to myself while my brother still has school all week",0
I dream of different creative methods of punishing him if he were convicted of war crimes.  What I like is feeding his naked living body to pigs in Laos....,1
@user #spinless#gutless acceptable,0
Pulis is available. Will guarantee we stay up,1
@user hahahah Donna being inspirational and shit that's great,0
"But @user was trying to find us, and my battery died. Guess how he found us? Yes, that bastard wand! !!!!!",1
@user @user @user Just wait till Cleveland comes again! #sarcasm,1
@user halting heroine overdoses instantly? How will the music and film industry block that one wonders?,0
Boooooom 2 goals in 2 minutes !!!! #ThatsArsenal 4 you,0
"Regarding my #ATT case; I've contacted the BBB, FCC, and my States Attorney General. next... #WFAA #not #stopping",0
First day of Christmas shopping tomorrow. Can not wait.,1
"@user yeah. So as you can see, I have great success with the ladies! And I'm totally excited for having sex some more!",1
Kisses to you bc you lose wisdom today...from your mouth #clever lol I love you text me when you're able http,0
What is most important today is not family or health but rather NBA action.,1
#ff By ideiasdebolosdocesedelicias. Such a different twist to the regular #frozen cakes :) We love this one! ... http,1
Best Christmas Eve news: I have a half sister. #sarcasm #thanksdad,1
So glad i work mornings now,1
has anyone visualised the different colours and flavours of twitter streams? kinda lipmus test.,0
@user #sarcasm is a service I offer.,0
Yay for Fire Alarms at 3AM #not,1
"She's a reformist, not a revolutionary",0
Please snow let us get out of dance early,0
"@user sorry, missed off my tag from the end of my tweet",0
Festive #ff to @user @user @user @user @user @user @user @user @user,0
Reunited with my pump this morning. #yay #not,1
"@user I'm relaxed, and waiting for the facts to come out. But I've listened to Blaine hammer on players for doing similar before.",0
@user: Pick it up one more time for the homie in the back that's stickin right with us thanks for answering my DM #realmvp,1
@user becauseeee I miss youu coffee later?,1
"the people #BillCosby looked down upon are ones coming to his defense. This isn't about race,it's about rape! http",1
@user @user @user All the more reason for it. Competition breeds innovation & the consumer wins.,0
: When the vapours that are emitted by cleansing solvents are emitted by contaminating chemicals. #Cleansing=#Contaminating #Vapour,1
I reckon straight women fancy victoria secret models more than straight men do #victoriasecret #irony,1
it's International Human Rights Day #irony,1
Can't wait for my boyfriend to come home and kick my butt into shape... @user,1
"the silence tastes like wet flowers wet dead dying flowers. Flowers without life, fallen pieces of silence.",0
@user but you can't expect us to hire one in only 3 weeks. Who moves that quickly on a coaching search? #sarcasm,0
#YesCracker @user - come on - is it 1999? Server too busy... #FAIL #SPAM http,0
I like the feeling when people thinks they're 2 steps ahead of me... But the truth is they're miles and miles behind me AHAHAHAHA #sarcasm,1
When one ear breaks on your headphones it's so frustrating! #today,0
@user Deutsch is a misogynistic toad; how shocking he's a bigot too ... #HandsUpDontShoot,1
LoL game over Napoli win and they are better then Juve,0
Staying #casual #monday #funday #ootd #fashion #style #allyouneedisstyle #todayimwearing http,1
The mouse's first incepted memory was just the sound: BRAAAAAAWWWWWWWWWP!,0
I should get out of bed now lol,0
My favorite new app is Chicago's Comedy Scene (CCS_Radio). You should check it out. #Chicago #Comedy,0
#Big #match #verdict: Tottenham's #Chelsea #loss #was #another #dark #night #at #the ...: There was no end to... http,0
A voice of reason crying in the wilderness of hysteria. http via @user,0
@user Think I may use that in my ads ! :),1
"If daily beatings turned out to be the best incentive for artistic production, Valkvinge would be all for it.",0
I have three test and a two dance performances tomorrow!! #EasyDay,1
@user @user yea they keep bardgin in on stuff they dont even care for. get a hobby sjws! also Babymetal is nice.^^,0
Marked as to-read: Becassine Pendant La Grande Guerre by Caumery http,0
Are you kidding me this is unacceptable http,0
Only thing missing now is a session at the gym... Want to do every body part though and CV! #possible,0
@user the word itself is a mockery ... Bae ...like abey,0
"""@user:Let's go workout! That jiggle is not going to jiggle itself away #ThingsYouSayToYourBestFriend"" this is so us @user",1
"To be fair, *in general*, voting isn't (or shouldn't be) just about choosing what is best for yourself.",0
"If you're making ""art"" to get paid, then you aren't making art, you're making a product.",0
"""@user Few politicians get importance of Patient Dignity & right to die http",1
..and another http #freelesson #english #esl #tesl @user,1
@user clever you!,1
@user I am procrastinating on getting work done b/c I am reading your new book!,1
Playing golf all day 'ery day #PerksOfBeingOld,0
@user @user I believe we have n that's y we SUCK.,0
You can have the prettiest face in the world but stretch marks will ruin it all for me.,0
What a great Christmas. #not,1
one essay submitted now to start the next one :') #thirdyearlife #loveit,1
One more reason not to shop at #Walmart. They make you feel you're not in America! #shopping #Islam #tcot ~ http,1
Nothing beats a surprise Tetanus shot at the doctor's office. #blessed,1
"YOU are violent, it shows in your tweets @user @user @user @user @user",0
"""@user: Goal of the Season 1970: GOAL 1. Jon Sammels #ARSENAL vs #manutd http @user @user",0
"Awake this early on my only day off before christmas...feeling ill banging head, bunged up, shivering... Just what I need!!!!",1
##to#our#countries#special#dedication#to#ma#Syrian#friends#you're#alone#instalisten#by#heart#voice# http,0
College Freshman tells his teacher he will be 'more cautious' with his homework...,1
Gutted Doyle has gone back to #wwfc. I don't think we saw what he's capable of. #cpfc,1
"Love the way @user says fault from last night will be fixed by 4pm, only to see a man in a van pull up at 4pm to fix the fault #irony",1
"@user,@user, women say 1 man asltd them, y so long 2 say sumtin? & the young 1s, where the parents? Hotel wit grn ass man? Smh",0
"@user Ok, hope it will rain soon",1
Hearing gun shots when I first wake up makes me feel like I'm in Compton. What a wonderful way to wake up. #sarcasm #imscared,1
"@user yeah amazing night, I think he out till the death! I'll let u know xx",0
You are so cool!,1
"#Mahathir, one of the godfathers of Asian values, Malaysians are ""stupid"", don't know how to run an airline #irony http",1
@user Grabe! Affordable na Affordable,1
@user Have you guys tried unplugging the servers waiting 10 seconds and plugging them back in? #psndown,1
"@user I think the general rule is, if it's open all night, pull an all-nighter.",0
I think what it means is it can buy attack ads and win the minds of large numbers of voters who do little to no research bar what they see on tv.,0
I think Apple should make their iCloud service and options a little more confusing. Its really getting good now.,1
"FNC is likely either repeating the same stuff over & over, @user @user @user @user @user @user @user",0
@user @user @user Fuck yeah! 600 more viewers!,1
Gareth's polar opposite is a chicken-loving vegetarian #Bones @user,1
"Alas, I know not enough geology to properly refute this.  Instead of researching this myself I'm going to assume they are right.  Pack it up guys, we've been disproven :(",1
just dropped my new single it's me i'm single,1
@user funny joke there bae...,1
Such a great damn day.,1
"@user If I can make it out there, I'd love to have a beer (or ten) and talk baseball. You're a good dude.",0
Can't dispute any of it.,0
"It's already on the books in New York, but the Democratic &amp; Republican politicians think it'd be better to give the billions of dollars back every year rather than fully funding our needed social programs.",0
I love getting up at 4 30 so I can wait on other ppl! #sarcasm,1
@user they can use white/maroon xmas trees :),1
work should be fun today,1
@user @user can't even bring myself to read this #rip,0
Riding the distraction train. CHOO CHOO,0
@user @user At least you got my joke,0
As far away as possible.,0
"Yeah, you're a grown up & at times feel very nostalgic towards your Bachpan. Iife's handiwork!!",0
"This is how I responded ""More movies about heterosexuality. I really wish they would stop shoving their lifestyle down our throats.""",1
Gotta love a Romanian playing an improvised version of jingle bells in a minor key. Really sets the festive mood. #not,1
"""DNA from Richard III has thrown up a surprise: evidence of infidelity in his family tree."" http Well I'm SHOCKED.",1
"Yeah, because that's what's most important. . The man really is a prized prat. http",1
Last day in Naples with my Emma girl! #soeasytotakeapicwithatoddler #19wksandcounting... http,1
With no forwards. #confused sure,0
Nooooooooooo again it's on!!! #PickANewSong #CantStandIt,0
Please dont fuck with me when I first wake up a morning person!,0
"Company profile NOT TWINS VENTURES, LLC - http #TWINS #VENTURES, #LLC",0
When will this girl learn... @user #it #is #everyday #Chezza #sometimes #do #work #andnotgetcaughtbyMR http,0
The moral police & vigilante's are very quiet with every #rape. I suppose it is Indian culture then? #uber #DelhiRape,1
WAIT the GA I have a crush on and emailed me and told me it was great to have me in class he totally loves me,1
"When a teacher says ""come in tomorrow morning for help"" but they are never in their classroom #wow #thanksforthehelp",1
@user thanks for leaving the dish for us #badbusiness,1
"@user Yeah thanks for messing me about and then not delivering on the product, i feel really great about how this went down!! #Not #Thanks",1
@user @user @user @user @user @user - Dutch+Northern theres combo not speaking yr mind,0
"there is no such thing as ""racists"" because there's only ONE race, HUMAN @user @user @user @user @user",0
@user I hardly think @user give a shite about the fans tbh,0
"hit 1000 follower on instagram, ive officially made it in life",1
I'm curious about this as well.,0
@user no one really says that,0
Some #tblightning action along the boards at @user in #Tampa #fuji #x30 #boltssocial #bethethunder http,0
"From user tilio who deleted his comment after realizing how stupid it was,""as the other side of ""independent,"" i feel the exact opposite.  we're 17 trillion in debt with over 70 trillion in unfunded liabilities (medicare is once again, almost bankrupt).  instead of making efforts to work these down, democrats are piling on even more debt.  it's clear that many democrats / fiscal authoritarians have not looked at this from our point of view.  republicans, tea, and fiscal conservatives in general want spending cuts and deficit reduction.  as long as we stand firm, we win.  either democrats cave to our demands (giving us the spending cuts we want), or democrats drive us off the cliff, destroying the US credit rating, forcing spending cuts because they won't be able to borrow nearly as much money.  the only way we lose is to agree to let democrats / fiscal authoritarians to keep spending.  you may dislike this point of view.  but it is inescapable fact. "" Your joking right?   That debt is largely a legacy of the last president and his two wars, which we had to continue.   Conservative fiscal ideas are what drove us over the edge.   Furthermore, we know your position, but you lost, the majority of voters elected representatives that support the ACA, as evidenced by the wast of time that the republicans tried to remote on it and lost every time.   This is a democracy, just because the majority disagrees with you doesn't mean you get to shut down government and act like a bunch of spoiled children.",1
"replurks acatholicprayer: Lord Jesus Christ, Son of God, have mercy on me, a sinner! #Catholic #prayer http",0
@user Thanks for pirating my music! :D #not,1
Rain and sleet hun? Yeah I totally want to get dress and go to work. Sounds like fun #iwannagobacktobed,1
Roman mythology gets me soooo pumped,1
"House adjourned again. With this pace, dont expect the ache din to come to Parl n u cnt blame d Modi Govt fr this #RajyaSabha",0
Babysitting is what I like to do on a Saturday,1
@user 's twitter game is perfect tonight! #amazingness,0
"@user @user Good points, but Republican party can be just as fractured. Together that makes for a disenchanted electorate.",0
Finals week plus hearing that my grandma is in the ICU = amazing #letmegohome,1
@user @user @user because as long as she's a victim she'll have white knights trying to save that damsel in distress.,1
"Oh look, we're having another storm in Sydney. How unusual.",1
Yet another out of a million doctor visits tomorrow...so.stoked.,1
"Aww I've just seen the pictures of @user from today, hows recovery going? #getwellsoon",0
.@user Yup. That's exactly how we do it,1
What an eventful weekend,1
"I feel faint after chasing a whippet and Lily, Libby, Gabby, Millie the cats who were playing chase in the garden #AintItFun !! #notfun",1
Why does my tongue feel it necessary to try and touch the high speed tool my dentist has put in my mouth?,0
#Fact: #StarTrek adult onesie meets clothing requirements 4 Walmart employee. Just put on yr vest & a smile. http,1
Gee faculty at nicholls are so helpful,1
@user @user Damn socialist!,1
You could say after today I'm officially necrophelic #LatinFinal #justajoke #not intodeadthings,1
"Is there a ""like"" tab on me? I'm not a facebook status to be liked by people... #sarcasm #RudeButTrue",1
"pt3..for his family to follow, and they can talk at home. All this talk about new owners and destabilising pf the club could #mot #lufc",0
@user Well maybe if you werent such a noob you would be up talking to me at 2:30 in the morning :P,0
@user the resemblance is uncanny! #firefly @user http,1
San Diego is amazing and I'm never coming home,1
Love it when my mans on a cleaning spree.. Saves me doing it,0
"#LeBron #James: '#Violence #is #the #answer': LeBron James said Thursday that ""violence is not the answer and... http",0
Luv this,1
I'm not calling him progressive until he at least openly discusses the Vatican's policy of covering up charges of child molestation.,0
I bet I'm the first to use that one,1
Can't wait to see that he has not talked to me and that he will never do it.,1
"Photoset: babaybubblez: aquabreeze: disgustinghotels: all men But lets not forget In the real story,... http",0
Something to remember as I head to @user tonight. #goodboy http,0
@user: You can have RESULTS or excuses NOT BOTH.,0
I only bought a few people gifts this year http,1
I can be mad at you for a matter of 15 min then I can't stand not talking to you.,0
@user So...I should click on the link in your private message to see the nasty rumor going around about me? #boohackers,1
And people who understand math.,0
@user returning my brand new ps4 thanks to your faulty security. #goodjob #not,1
http #TeenAnalCasting #Alice Alice and Dana -TLW 3X05 Part 2,0
#Happy young chap ashamed of my God and my savior #spreading the word of God n life of Christ #successful entrepreneur #MindOfGod,0
Responsibility = the ability to respond To control yourself and be in charge of your life,0
Because you can't work the part timers crazy hours now the law will make them full time and require health care.,0
"All I can say is ""ha ha"" they should have read it first.",0
It's mind-boggling that it's that high.,1
"""#NYPD did comment 4 this or provide its own internal #statistics w/ involved s & the info has not been given 2 the FBI since 2006.""",0
"Today stats: 5 followers, 8 unfollowers and followed 2 people via http",0
@user :)) thank you so much. Such a generous display of kindness from your side.,0
"Murdered baby, black man in US, kids in Thailand and a woman's body in Avon gorge. It's a jolly day for news today #sarcasm",1
"I observe this every day.  If you talk to a ""right winger"" in Fox news terms, then they *hate* big government, Obama, socialized medicine, taxes, etc etc etc.  Talk to them about *actual* programs, and suddenly they are actually for almost every government program in existence.",1
I love finals week! #justkidding #stressed,1
@user Ha! I don't have haters. Just a few misguided souls who thought my mentions were a bulletin board for their issues. ;),1
http://en. wikipedia. org/wiki/The_System_Has_Failed,1
lol has his website been suspended again? @user @user,0
"I love getting woken up by my body just to say ""I know you were comfortable sleeping.. But here's something you don't want anyway""",1
"says women & blacks are a different ""species"" @user @user @user @user @user",0
Your tax dollars at work.,1
I come up with some ridiculous scenarios in my head,0
@user still out w/ back sprain?,0
We cram 5 minutes before an exam and get a tag of qualified person.,1
"Yup!  Don't know why more Christians don't follow this.   Oh, wait,  its not hateful and it doesnt further their agenda.",1
Senate Just Confirmed a New Cabinet Member That Has 2nd Amendment Supporters Furious - The Senate confirme... http,0
I think you mean people that they will be hiring in a few years.,1
"Bestiestest. *teary-eyed* THE KING IS COMING! My God's not dead, He's surely alive! #God's #not #dead #faith http",0
@user At 2:30am? Who's gonna favourite it? An owl?,0
MB forgot to move the elf on shelf and now 10 is asking me if Christmas is real. @user,0
"@user I've had three boys, breastfed them all for about a year each and never had to do it out when I was out! necessary",0
@user @user @user His tweet in the context of his history is what makes it a clear bait.,0
"This person has an interesting view of what ""traditional"" means.",0
The ER sucked tonight ... Urgent Care tomorrow ... YAY #fml #ugh,1
Looking forward to doing my 4 page essay tonight seems like fun,1
@user Blount also out. You would think this could be the game that White gets some action. I guess not.,0
@user @user Nice smile,1
...but then it started itself and made the Windows noise. So starts this exciting day of mine...!,1
Ooh! Someone knows how to click the 'Unfollow' button. I'm impressed! #beforeCoffee http,1
@user # SHOCKING,1
"Band playing ""Two Tickets to Paradise"" in parking lot at Redskins game. #Redskins",1
Fun at @user #Basics4Babies Day @user on Sunday: Ask Travis Lulay to get his face painted like Tony The Tiger #worthashot,1
""" ""@user: Penguins cancel morning skate, which was an optional, due to icy road conditions.""",1
"@user @user @user this is true, the Patriots, Packers, or Broncos could suddenly need a new coach #itshappening",1
so glad I came to work at 7:30am for all the customers that are here!!!!!! #not #itsdead,1
I posted this clip here months ago and was downvoted to oblivion.,0
Happy Holidays! (this is officially our Christmas card) #BestFriend #UglySweaterBarCrawl http,0
A £718 phone bill is a lovely email to wake up to,1
One small step for Atheists..,0
@user where's me boots happy,0
Kinda ironic considering Obama's support of unions.,0
@user ready for Jeb and first female #POTUS,1
@user but it wasn't as bad as that picture seemed to indicate. You're still a very horrible person.,1
"Woke up with my foot the size of a balloon, that's just what I needed.. #not #ouch",1
A 21 year old (whatever age you are IDGAF) acting like an immature little @#$%& in public? Yup you're a classy one. #SoNotClassy,1
Pre-Giuliani years here we come,0
Rolled out of bed for closing... #ilookreallygood #not,1
You know your government is shit when it looks more like a reality tv show than an actual functioning government,0
"#newjob Urgent CONTRACT - Assurance Manager - Private Banking, Singapore - Not Specified, Singapore Specifie... http",0
This is what you get when Republicans control your state legislature.,0
If you gon' judge people who drink and blaze FOH Go choke on some foreskin,0
Now gonna enjoy this day with my babies!!,0
Can you write your name on a paper and take a picture ... — I can but I'm busy answering this question oh... http,1
@user @user @user @user for Elrufai#he represents the masses#so it is our victory#,0
I for one am in utter shock that these fine institutions would stoop to such a low level to deceive consumers and benefit themselves financially.   /s,1
"@user Also, I would not that my tone was joking, though it's difficult to properly convey that in a Tweet.",1
"""Let's all do only squats and deadlifts until we hurt ourselves"" --really really good trainers #fitnessmotivation",1
Image via We Heart It http #feelings #not #people #telling http,0
Mid speech @ Christmas Lacrosse Ball #flattering @ Grand Cafe http,1
@user And when you overpay for that talent you get stuck w/ that talent. Which perpetuates the losing cycle the Cubs are in,0
@user @user ikr!! This is not a true Battlefield game! :/ . . . .,1
@user When are you buggering off out of the country,0
OH and now the District line has major signal failures and delays FANTASTIC!!!,1
#take#a#deep#breath#it's#just#a#bad#day#a#bad#life http,0
"4. ""Yes"" was the reply. These are public dollars being used. What's with this lack of transparency around Union Pearson Express? #TOpoli",0
My Com professor keeps talking about Twitter. Lel,0
dead? Why is this stupidest of memes still perpetuated?,1
Big shocker that 2 of 8 called in,1
"@user Yes ara i am not, and you know that. Hahaha",1
@user have you heard back yet?!,0
"If his Twitter account is any sign, then this book looks to be a must read id rather read twilight http",1
It's a Christmas miracle! http,1
I'm so glad I work a double on New Year's Eve and then most of New Year's Day... #pissed,1
"My dove wrapper told me to be mischievous, so if anything happens, that's my extenuating, external attribution to blame #psych",1
http #Landlord collects #Rent from #HoneyBees in #BeeHive ... #Bee #Honey #ItalianBees http,0
When you show your valid 16-25 railcard and shes charges you full price anyway. Great service from Tamworth @user,1
Yea I love it when 2 is already throwing a tantrum upon waking up. Totally. Awesome. @user,1
"Today stats: One follower, No unfollowers and followed 2 people via http",0
"@user @user is it bad that after my ""happy Preds won"" dance my first thought was Donnie?!",0
@user @user @user @user asked back to be models next month,1
Suppose I best move my arse to the #gym. Anything to put off wrapping presents #christmas #chore,0
Always nice when a 40 year old man you don't know calls you pretty,1
Getting Final Jeopardy correct on Kids Jeopardy boosts my self-esteem,0
Am I surprised that my coworker is not going to show up today? #Flurries,1
#Italy -- #Cabinet #approves #first #planks of #Renzi's #labour #reform. http via @user,0
GOT MENTIONS #MGWV #AutoFollow #RETWEET #RTMUZZA #TEAMFOLLOWBACK #TFBJP #500aday #RT2GAIN @user WHOS WANTS TO BE NEXT?,0
Can always #countonmother to impart #wordsofkindness. Especially on a special day! !!,1
"@user @user if accurate, v sad indeed",0
"#Its #Over, Its Not Finished Its Not Ending, Its Only The #Beginning When #God Is In It, #All #Things Are... http",0
"@user @user Everybody just keeps saying ""Gronk and large contingent of Patriots."" Who else is there with Rob?",0
@user @user @user Again fans come second. Thanks again,1
I just love a chaotic school run!!!...,1
@user don't know how#Monsanto # among 100 most sustainable Cos in the world sure all parameters are measured#net positive?,0
Boone Pratt- The Evolution Will Be Televised (Directed By Devin Gibson o...: http via> @user,0
"Wolf in sheep's clothing, BIG-time.",0
"So translation: ""We can't have atheists *helping* people, that totally undermines my desire to believe they're all selfish and uncharitable! """,1
walking in this was fun http,1
"Somebody thinks the ""affordable"" premiums will be going up again.",0
Why the fuck is Twitter telling me to follow myself in following someone?! http,0
Well if they didn't want to die of hunger they should have worked harder when they were younger  /republican.,1
I hate it when my mind keeps drifting to someone who no longer matters in life. #dislike,1
But it's time to face the truth... I will never be with you,0
@user @user @user @user @user How many of those jobs earn #middleclass wages? #Economics #Math #Z,0
