text,label
@user SHE SHOWED YOU!,1
#and #As #But #Cake #Like #MMs #Made #Make #Food Please RT: http http,0
I can't wait to go to the post office to get bent over with $100 shipping fees to mail my folks' #Christmas gifts to Montana.,1
http #TeenAnalCasting #Katarro Katarro Anal &#8211; About a Girl [Nirvana Cover],0
"To be fair, that's probably true for a society where women are currently cloistered: giving them the freedom to leave the house on their own will probably increase rates of shopping and drinking lattes at Starbucks, too.",1
When someone with retrica wali picture complains about how many filters someone has used in their picture to look pretty..,1
@user I saw a leaf blowing in the breeze. You could yell at that if you wanted to?,0
"""I can't breathe!"" was chosen as the most notable quote of the year in an annual list released by a Yale University librarian",1
to be an Ass but ohh Yeaa!!!! http,0
Look! It's a white Christmas after all! #MinnesotaProblems http,1
Shoes on make-up done ! I'm ready,1
Nice touch. All the bar staff in the ground wearing #saintsfc t shirts,0
What a pleasant way for Minneapolis' most prestigious publication to describe its female audience. http,1
@user haha!! Noo I don't need new boob's my old ones are just fabulous,0
"I have a small jacket on , with a big coat for later , I'm back at the train stn going back into town , work Xmas do #joy",1
"She's a uniter.   Most people, regardless of political affiliation, can agree she's horrible.",1
"Pepe's hair RT @user: Palacio's hair...""@user: Ronaldo hair..""@user: Messy hair """,0
I don't wanna hate religious people. Cos i am one of them. I'm so religious in music. #ahaa,1
Gotta go home and cook a big breakfast,0
I wish it was January already... Not because of school but because I'm having major withdrawals #Arrow fair wtfwasthat,0
@user gerrymandering neither party will give up. It is not hard to be an informed voter.#Ferguson,0
"Can't get over this very British weather! Remember to check under you cars and wheels for any small animals, they like to hide under cars",0
"@user,@user,wait..your followup to Ferguson/stereotyping talk is audio about a kid who wants to do ""hood-rat"" stuff?",1
"@user Your not understanding something, does make you an expert in the field.",0
"#Sagittarius know what they want, if they can have it, and they always keep on thinking bigger.""",0
"Dayum, I really got the house to myself while my brother still has school all week",0
"2AM on Christmas Day, and we're heating up Pizza and Breadsticks. #theboysarebackintown http",0
"I haven't read zerohedge in years, but I remember they promised apocalyptic market crashes that should've happened years ago.",0
"your delusion that people are being killed ""cuz Obama black"" is the myth @user @user @user @user @user",0
"@user yeah in the ""honour"" of the picture those lyrics sketched ...",0
Munching cheese like its Christmas #stiltonoverload,0
Stuck behind someone who can't do the speed limit #lateforwork #fuck #happymonday,1
First day of Christmas shopping tomorrow. Can not wait.,1
"@user @user @user this is shallow af, stop discriminating eyes, all eyes are beautiful.",1
Here's the final episode of #minecraft #hardcore survival... We die while trying to get a sustainable food source,1
@user @user I will let @user know - I'm sure he is shaking/quaking in his boots. #not,1
"And a fundy christian half-term governor, with delusions of grandeur, is one of the best sources for comedy in America.",1
"It's okay, you know playing loud music during quiet hours is perfectly fine.. #somepplhavetostudy",1
"#Blame #Bad #Luck, #Genes #as #Cause #of #Most #Cancer #Types. Here's #Why: Heredity and environmental factors... http",0
We'll that was a great way to start off my morning,1
@user brilliant news for potential young buyers!,1
I am an American Jew and I call on the people of Israel to get rid of Netanyahu and other right-wingers.,1
Don't they need it the MOST?,1
Such quality customer service today by @user for the Xbox One #thisiscrap #nothelpfulatall,1
The fact that the judge on the case is most likely friends/colleagues with the father of the lawyer for lodsys already spells corrupt when you look at the facts.,0
@user @user @user @user @user @user - Dutch+Northern theres combo not speaking yr mind,0
"@user Hey, he DOES have the word ""ban"" on his home page like two or three times though. #AcknowledgementIsFirstStep",1
GTA #San #Andreas #2 #is #not #coming #in #2015: One media has released that GTA San Andreas 2 is coming in 2015... http,0
@user My entire body sends sympathies too - I was diagnosed with Rheumatoid Arthritis 11 yrs ago - yay flare-ups!!,1
@user @user @user @user @user @user @user not now guys finals,0
Atheists celebrating Christmas.,1
"Migrains,, throwing up are always fun",1
My dream is to celebrate Christmas with you,0
Since when did train fare get so expensive?? Jesus! Might aswell of drove... Shame I'm drinking,1
"@user Email me when you need a friend...always here to chat, I've been there many many times so right with you xx",0
@user skiing in Regents Park much #not,1
@user @user To be fair he looks like he's lost a lot of weight since his amazingly successful halcyon Leeds' days!,1
@user @user @user *Everything is crossed* #ChristmasGift #BassFace http,0
"@user @user GOP loves immigration. They don't like illegal border crossers, illegal Presidential action and ignoring Constitution.",0
"I believe nothing the Obama regime tells me, I believe a lot of what the Iranian one does.  [**Iran threatens widespread retaliation against US and allies**](http://dailycaller. com/2013/09/10/iran-threatens-widespread-retaliation-against-u-s-and-allies/#ixzz2lo2bVVso)",1
Most important thing I've learned in school http,0
@user not worried about it. Whenevs,0
My glasses are blinding me.,1
Lol my timehop guy though. http,1
@user: Gavy is one rude motherfucker. *Subtweets me* *Calls me a motherfucker* #Irony,1
@user: You want to see something Irish!!Of all the reasons to be closed http #irony,1
"Clovis Cartoon, Tuesday, December 09, 2014 http #jamaicaobserverandroidapp via @user. a real McCoy",0
I liked a @user video http The Ubisoft Graduate Program - Gameplay Programming,0
http What Day is the Sabbath? #follow #Jesus #Christ #FBC #FBCJAX http,0
"@user WOW, so now things are going to change? Never heard that before from the opposition. Please vote, it works so well",1
"@user @user Actually, even delivery won't save some. O voted to let born alive die. Also, look up ""4th trimester abortions"".",0
@user I try to imagine. it's confusing.,0
I hope I could recover from fever today. I need to start with strama..,0
Day 39&40 3 #Novel Train. #comfortzone #christmastree #nextlevel #buzzkillington #familyguy... http via @user,0
Come on #OrionLaunch - it's 1am in Australia. Us down-under #geeks need *some* sleep,0
So glad I'm off work tonite,0
supaaa sweet when you have finals in the AM and ya can't sleep.,1
Just found out I have my making babies final on Thursday. Good thing I have so much time to study,1
"I actually heard Greta Van Whatever complaining on Fox (via Colbert) that nobody knew what to do and where to go to sign up.   Lady, that's your actual job.   That's what the news is actually supposed to be doing.   Informing people.   That's like a garbage man not picking up the trash for month and complaining that there's too much trash everywhere.",1
A year ago this would be just a writing on a t-shirt anymore all thanks to @user @user #MerryXmas http,0
Really loves dentist appointments. #sarcasm,1
2015 prediction: Putin ditches the Ruble and adopts Bitcoin,0
Do you like quality #dancemusic? Go to http for some great FREE downloads #UK #NightClub> @user,0
I'm hungover and I'll end up staying up until 4 :'(,0
So restaurants that thrive on the social nature of eating believe that mothers should only breastfeed in private? #irony,1
"Aww I've just seen the pictures of @user from today, hows recovery going? #getwellsoon",0
"@user Instead of playing the pompous ""do you know who I am card?"" , how about you actually make an educated rebuttal?",0
@user @user Nice but original,0
http #TeenAnalCasting #Alice Alice and Dana -TLW 3X05 Part 2,0
"Watching McCain these days is like watching a political take on ""The Notebook"", but without the sadness... instead of bouncing between happiness/sadness, it's glee/fury.",1
.@user is at her best when she reports frm 'on the field'. Not that she is bad at studio but on field she is a true story teller.,0
"I ate too much... meal, i'm not even done with desserts!",0
Finally went to the doctor and feeling so much better.,0
#np #NowPlaying #NowListening #Music Of Dying On Your Birthday by #Senses Fail from the #album: #Let It E... http,0
@user The only place where you don't wanna sit on the seat that you earned. #Dancing #QuiksilverGoesSupersonic,1
We may be some time. #Hibernot #Not http,0
Love the fact that I turned off my alarm this morning and slept till so freaking late #not,1
almost 72 hs of a kid asking for his christmas gift and zero answers from @user thank you guys! you are awesome #not,1
#Fact: #StarTrek adult onesie meets clothing requirements 4 Walmart employee. Just put on yr vest & a smile. http,1
http I forked node! Get ready for the future. (Where's my interviews),0
@user I'll be a bit sweaty by the time I get to you!,0
"Lucky I've finished all my coursework, revised super hard and feel super healthy. Two words...loving life.",1
It's adorable how this keeps on happening,1
Gotta love working the day after Christmas #smellya,1
@user Just put it in first gear and they will move. Liberals won't ever give their life for a cause. They will just destroy yours.,0
I got to meet a real CSI tonight #cool but the little jerks who broke into his office at 2am cool,0
@user @user @user effigies of jesus or allah... when she herself hadnt kept any of d hindu gods #irony,1
"@user it could have happened to anyone. Your time will come, critics. Oops, apologies. A typical -loving #Brit.",1
Feels like we been playing against the refs most games. That was a clean Wall block that the refs took away. Ugh.,0
"@user start with India , I need to be somewhere they don't speak great English so I don't have to say much lol",0
#BBC #News -- #Denmark #challenges #Russia and #Canada #over #North #Pole. http,0
Just got an email from the law school saying 3 people have infringed copyright by not referencing properly..in our essay on copyright,1
Did you sign up for Obamacare  A.  Yesterday?  B.   Today?,1
"Yo dawg, help an Airman out",1
Last day in #Riga! #self #finnishgirl #businesswoman @ PK Riga Hotel http,0
I love seeing what you guys got,1
I dream of different creative methods of punishing him if he were convicted of war crimes.  What I like is feeding his naked living body to pigs in Laos....,1
@user @user @user @user awesome! :),0
"LIAR, i've never denied the 532 murders in Chicago in 2012 @user @user @user @user @user",0
It's mind-boggling that it's that high.,1
"Apparently my youth group thinks ""Are you kidding me?"" is my default expression--or ""nomal face."" #areyoukiddingme http",0
"hula hoops, hot chocolate and law revision. my breaks in work are filled with glamour and fun.",1
As if i need more water in my pasture.,1
Your friends will bring you down because they fucked up what they had males & females me fool !,0
Hah...  You think Canada has strict regulation of the Financial sector...  adorable.,1
@user has passed @user as the world's most valuable #startup! #growth #nyc http,0
"Somebody thinks the ""affordable"" premiums will be going up again.",0
"Lol, who throws middle fingers up in pictures anymore? Oh, you're bad.",1
@user #ThingsBetterThanTitansJags napalm hotwings #bigjoefavorite love the show #keep it real,1
Today is going to be a great day . #not.,1
It's not even 9 and I've already called the cops twice.. Damn I love my job,1
@user Because we all know that a house is a hermetically sealed environment! @user @user @user,1
@user @user Ah ok. Well I hope things keep going well with person A x,0
Last day of school it was so much fun but not much people came. what a shocker,1
@user @user: Thats quite an interesting number coz I managed to read only 17 but i will surely make it in #2015.,0
@user your tongue in cheek @user weigh in does nothing but instigate breed specific hate. Stick to reporting on tuques. #yyj,0
Can always #countonmother to impart #wordsofkindness. Especially on a special day! !!,1
They are in the banking industry - it goes without saying.,0
"Yeah, because that's what's most important. . The man really is a prized prat. http",1
When hailey I play trivia crack she wants the sports & entertainment while I aim for the science and history hahahah,0
We want turkey!!,1
@user He is exactly that sort of person. Weirdo!,0
What a joke. Thanks for the detailed response and communication with your customers. @user @user,1
It's nice to see continuity in our gender struggles.,1
As far away as possible.,0
"Watching Sanjay, @user ... Getting the start vs. Butler and liking what I see! #Minny",0
Laptop speakers are too quiet for music & simply too loud for porn !#Irony,1
My stomach is a Wonderland for gas inducing bacteria. #blessed,1
"If his Twitter account is any sign, then this book looks to be a must read id rather read twilight http",1
Lots if love for #Miranda,1
@user One could hope.,1
Lol at people saying they're turning 13 this year when did I start following kids #sorry,0
"I do hope you Anti #GamerGate'rs will sleep better, knowing that sabotaging charities would make you more respectable in society. #sarcasm",1
As a conservative: Morality and economics don't and shouldn't mix...,0
Foxy Lady..#waynesworld #excellent,1
Do you want to be right? Or do you want to be happy?,0
Even Soweto TV didn't bother to show these fvcken awards...useless to the bone..go figure,0
Just paid $2.59 for gas! #ThanksObama #sarcasm,1
@user they can be assured you'll recommend them!,1
"So, everyone should love pedophilia?",1
Correlation does not imply causation.,0
Marked as to-read: Becassine Pendant La Grande Guerre by Caumery http,0
@user The Raiders are. I guess we'll see how things play out tonight.,0
Congrats still SASMVT for a good run. Ulitin nalang ulit ang 6-peat next year :),0
Fighting over chargers is definitely how I wanted to start my day. #not,1
@user kabhi I'm messier than usual messy wesay I need chai & I'm resting for last 2 days. May be this is the reason.,0
Pulis is available. Will guarantee we stay up,1
"#latergram with thegoldcoin. Classes done, research is not. #gradschool #basic #blessed ... http",1
"Contemplating responding to @user's tweet saying ""what remains of their pride"" but not sure how well that will go down",1
"""The two constables -- Veer Pal Singh Yadav and Avnish Yadav - did not have any criminal record."" - NDTV",1
I'm glad H & M has employed enough staff today. #nohelp #terrible,1
I was trying to type parkside and it turned to paradise #coincidence #i #think,0
@user @user thanks for plan c two weeks in a row! Getting rid of exotic engrams is also an amazing move!,1
"New Years Eve is generally the most overrated party of the year. It's supposed to be a huge shindig, but usually I'm disappointed.",0
@user heh as if @user and average work in the same sentence!,1
@user @user really? My respect for feminist/womens movements is through the roof. !,1
Whoops. Didn't know I had to live up to other people's expectations instead of mine. Let me just fix that. #sorrynotsorry #soz,1
#GuruMantra for #success. #entrepreneur #startup http,0
Now to write a JavaScript RegExp that allows . and ' in e-mail addresses... http,0
I highly doubt that speech will do him in if he runs.,0
@user I don't think the Hereditary Baronet wants to encourage a something-for-nothing culture :-$ #irony,1
*ahem* SPONGE BOB IS A FUCKING CARTOON!!!!!!,0
i think BurgerKing is working with the SJWs. my fries are as salty as SJWs about @user winning an award,0
"Nice friendly drivers @user ""never get on a bus with a £20 note mate"" what a way to make you feel welcome!",1
I really need to shoot something soon.,0
"Can we trade McCain? Biden helps Republicans more than McCain. In any other time, McCain would be a Democrat. http",0
Dallas (-7) over Washington; New Orleans (-7) over Tampa Bay; Green Bay over Detroit (+9); Carolina (+2.5) over Atlanta.,0
"@user @user @user @user @user @user #irony #oxymoron ""planned parenthood"" nothing abt parenting",1
The #Gophers aren't nervous. #SammyCommentary #Gophers,0
"@user @user @user was STUNNING today, wasn't it?",0
He's still on the air?,0
Oh and it's a positively balmy 7c,1
@user I am procrastinating on getting work done b/c I am reading your new book!,1
@user @user @user please reply to this gentleman on behalf of all of us here @user #jokles #gotrealworktodo,0
Last semester I dropped a class because I had to write a 7pg paper. This semester I've had to write 5 of them,1
This nigga knocced back 6 shots of Henny lastnight ! @user http,0
I just love being wide awake at 4am,1
4:30 an opening my first beer now gonna be a long night/day,0
http #CHRISTMAS #GIFT #BLESSING #Santa #follow #TheInterview#BharatRatna #CallMeEva... http,0
It's super duper fun waking up and immediately shoveling your car out of your driveway for 20 minutes #fuckinsnow,1
"Gun nut yells at cops conducting DUI checkpoint, later hit by drunk driver on way home #irony #karma http",1
@user wow u brought down xbox live arnt you amazing why don't you do something more productive like grow up,1
Hyper at 1AM when I really should be getting rest #ohwhale,0
"I actually just started crying while brushing my teeth due to lack of sleep, stress and test anxiety. Today's gonna be a good one... #not",1
Produce all kinds of Creative Designs #like15 http http,0
"&gt; When her group [the Oklahoma Coalition for Reproductive Justice] began lobbying against a Personhood bill by saying it would restrict in-vitro fertilization, or IVF, a legislator who planned to vote for it, said: “Sorry, what’s IVF? ” Why do American voters allow morons to govern America?   (And no, I'm trying **really really hard** not to just leap to the obvious conclusion. )",1
#phillhughes #63 #out we will miss u always respect for u http,0
http Having sooo much fun in math #math #class #drawing #music #eye #snowflake #flo... http,1
"Yea, yea that's logical.",1
Why would you name your kid Messiah in the first place?,0
@user Are they going for the very original plans now?,0
@user doesn't get more #indiefilm than #miboxzombie http :-),0
@user @user so glad I bought a diesel car 2 years ago,1
@user @user For the masses. I love it.,0
This time last year...shiid was hella funny...unforgettable #khwaaaa,0
Wondering weather to have a few drinks tonight or not,0
"""@user: Adorable little white tiger http",0
"Yeah, but guys, Politifact said this was half-true.  You just don't understand the nuance.  Serious you guys.",1
Yay for cars having a case of the Mondays. #not,1
to have a highway clean up section of highway. people expressed their freedom of speech @user @user @user,0
#notcies #eu Cleaner air would offer major health benefits in the Balkans http,0
"O_o ummm...so, like?? RT""@user: From our family to yours, have a safe and #HappyThanksgiving http",0
"@user transfer fund of £250,000 is given to ... Nottingham Forest a team with a transfer embargo.",1
@user did you get fat on your honeymoon?,0
We prefer to lose the derby vs #SuC and fight for Ligna trophy.,1
"@user ""i feel bad for the American people, now we should invade their country in kill their children so we can save them""",1
"So beware, when the cult ends, it's not usually by everyone realizing how silly they were and retreating to sanity.",0
@user doing a great job... What do I pay my extortionate council taxes for? #Disgrace #OngoingProblem http,1
"Just as the microphone fails: ""If we were having this conversation 100 years ago..."" @user #WebRTC #WebRTCParis",1
GET AHT A TAHN! The Made in PGH Gift Guide http via @user,0
Girls who can rock this thang~ #PrincipalSwag http,1
And we are all a bunch of young white males who aren't being inclusive enough.,1
feeling well,0
@user I have a boyfriend! () *hair flip and walks away*,1
"Quick feet in slow motion ! Never stop loving , knees high , arms moving ! Still a lot more to be done... http",0
Congress just screwed us but it's a great day in the District because we got another stadium! #sarcasm,1
"@user @user ""pit players v. victims?"" How dare the NFL put a divide between men and the women and children they beat? #sarcasm",0
You decide to go on vacation without me sleep? Reaaaal nice. #considerate #not,1
"Him, and all the other Tea Party members are a subsidiary of the Koch brothers",0
@user I hopefully won't be here anyway fingers crossed x,0
@user I just did it. What's the prize?,0
"But nooooo we have religious freedoms, no one ever gets controlled or oppressed by a dominant religion",1
Everybody's Talking about Snow and I'm just Sitting Here and the only Snow around is on our Cars.. #snow #not,0
@user Just abt 2 say d same :) I'm not sure whether Oxford Brookes Uni is part of Oxford Uni. yet his CV is impressive still!,1
"I'm always amazed at how willing liberals are to admit that they agree with ""the ends justifies the means"".",0
@user Makes me so proud to be an American,1
Sweet United Nations video. Just in time for Christmas. #imagine #NoReligion http,1
"@user and that ""somebody"" thought you were Padoin sister LoL !!! #SarcasmFail",0
Haha love when I accidentally spray perfume in my eye,1
@user but it has to be fake!! Where are all the stars??,1
@user you may also see flags of ISIS with him is this govt and ch nisar don't admit :'(,1
Getting hit on by a TSA agent who thinks my first name is Bowie #wifemeup,0
i'm really stoked about going abroad in the fall. and well next week but that's for completely different reasons. #imissmyboyfriend,0
I hope he's more set to go nuclear then the last time he said he was set to go nuclear.,0
"@user he's played 5 minutes, 0-4 from field, a steal and 2 fouls. that's it. that's all he's done.",0
"@user Joel Olstein, a man who hardly ever mentions Jesus in his sermons, is going to talk about the meaning of Christmas?",1
"there is only 1 race, HUMAN so i dont look at things by the myth of ""races"" @user @user",0
I don't think you guys are on-board with how important it is to get every bit of carbon out of the ground and into the atmosphere.,1
Isn't it great to sleep 5 hours and feel like a million bucks? #gettingold,1
All hell is breaking loose... Ahhhh everybody freak out,1
"Balak to Balaam: ""Come now, curse this people for me..for I know that he whom you bless is blessed, and he whom you curse is cursed.""",1
Iiiiiiii have the best boyfriend everrrrrrrrr.,0
The more important question here is should the government be allowed to issue secret rulings and legal precedents.,0
"@user Oh, will keep fingers crossed for you. Sometimes the worse they are, quicker they go #HandyMedicalFact",1
Losing the keys to your car before your have to drive yourself to the airport to catch a flight is awesome.,1
!!! RT @user: Of all the places to get stuck in a traffic jam http,1
"@user @user @user @user @user Yes, you are but it also shows your ignorance , and hate.",0
@user nice to know that you give me so much importance. :) :] @user n,1
@user Really?,1
"@user Happy Christmas to you + yours. May 2015 bring good health, happiness, every success and all you wish yourselves.",0
@user gun laws will fix everything,1
I love when I wake up grumpy #effroommates #yourtooloud #personalalarmclock #notnecessary #bequieter #ugh,1
Nice weather for today.. #not,1
"It surprises me that Republican congressmen use visual aids like this.  It just seems to be contradicting their talking points essentially telling Obama to butt out and concentrate on foreign affairs, leaving domestic issues to Congress.  But then they spend hours on the floor complaining about him negotiating with foreign leaders instead of acting as a liaison between Democrats and Republicans in Congress.  I just wish Republicans would pick one or the other and run with it.  *Edit for grammar",1
First photos of the Infiniti Vision GT concept emerge http,0
@user @user true n that's y we r jaded EVERY YEAR,0
Of course one of my lecturers happened to be at the bar/restaurant we are at for my birthday meal...,0
@user: Sometimes you have to forget what you feel and remember what you deserve.,0
"So, Matt and Natasha are having sex. #WhatASuprise #WhatElseIsNew",1
We're going to end up having it out with these bozos.,0
"#Daesh,#Taliban all need to become part of 'The religion of ""PIECES"" My heart goes out to all the of the victims of #PeshawarAttack",0
"Wings? I don't have wings! ""Of course not... You're a boy!""",0
Wow writing 3 reviews on 3 concerts I didn't attend is exactly what I want to be doing right now instead of sleeping,1
"They decided 2 change King's trunks 2 gold, his logos 2 green & his tights to blue. How creative. .",1
"@user @user @user BF4 SP is shit, while the MP was broken for 11 months so...",0
"The whole #Misogyny thing is hanging in there with Women from the right . A cat fight now ?, imagine pulling that on the left #pmlive",1
"Feel bad, confused over NY cop controversy. That one is on camera. @user brown @user so clear #Love your neighbor",0
Downplaying social media but using a hashtag? #givepresence,1
"soon, stop, wtf, and omg are deff my fav things to hear",1
Landmark in the sense that it conforms to the reality 99% of scientist know to be true.,1
i just loove when my guy friends give me thorough descriptions of their bowel movements... #WHY #STOPTHIS,1
@user: DONT SAY ANYTHING JUST RT http @user,0
@user @user not bad for a kid from Az. Hockey doesn't work in the desert.,0
Oh how I love working in Baltimore #not,1
